id	title	txt	datetime	source	web	batch
2020052116132515	习近平致信祝贺首个“国际茶日”	据新华社北京5月21日电 今年5月21日，是联合国确定的首个“国际茶日”。国家主席习近平向“国际茶日”系列活动致信表示热烈祝贺。习近平指出，茶起源于中国，盛行于世界。联合国设立“国际茶日”，体现了国际社会对茶叶价值的认可与重视，对振兴茶产业、弘扬茶文化很有意义。作为茶叶生产和消费大国，中国愿同各方一道，推动全球茶产业持续健康发展，深化茶文化交融互鉴，让更多的人知茶、爱茶，共品茶香茶韵，共享美好生活。茶是世界三大饮品之一，全球产茶国和地区达60多个，饮茶人口超过20亿。2019年12月，联合国大会宣布将每年5月21日确定为“国际茶日”，以赞美茶叶的经济、社会和文化价值，促进全球农业的可持续发展。今年“国际茶日”期间，我国农业农村部与联合国粮农组织、浙江省政府以“茶和世界 共品共享”为主题，通过网络开展系列宣传推广活动。编辑 彭启航来源：新华社原标题：习近平致信祝贺首个“国际茶日”	2020-05-21 11:00	新华社原标题	bj	20200521161325
2020052116132516	发改委下达首批中央预算内投资24.5亿元支持雄安建设	新京报快讯 据国家发展改革委微信公众号5月21日发布消息，近日，国家发展改革委下达雄安新区建设专项2020年第一批中央预算内投资24.5亿元，支持雄安新区高质量高标准建设。本批项目资金在安排时，一是结合当下新冠肺炎疫情常态化防控要求，优先支持有助于改善雄安新区环境卫生的污水垃圾处理设施项目；二是根据新区建设进展，支持起步区和启动区重大项目建设；三是按照“先地下、后地上”的原则，支持给排水管网、供热和配套燃气设施等项目建设；四是为推动新区内部到雄安高铁站快速直达，为将来承接北京非首都功能疏解作准备，支持相关道路工程项目建设。下一步，国家发展改革委将加快推动雄安新区重大工程项目建设，及时帮助协调解决项目建设中的困难和问题，持续加大对新区建设的资金和政策支持力度。编辑 彭启航来源：国家发展改革委原标题：国家发展改革委下达第一批中央预算内投资24.5亿元支持雄安新区建设	2020-05-21 10:42	国家发展改革委原标题	bj	20200521161325
2020052116132517	俄总理：俄罗斯疫情现已日趋稳定	据央视新闻消息，俄罗斯防疫指挥部5月20日消息，过去24小时俄新增新冠肺炎确诊病例8764例，累计确诊308705例；全俄新增死亡病例135例，累计死亡2972例；新增治愈9262例，累计治愈85392例。这是俄单日新增治愈病例数首次超过新增确诊病例数。当天，俄罗斯总理米舒斯京在俄罗斯政府抗击新冠肺炎疫情协调委员会视频会议上表示，目前俄罗斯疫情形势日趋稳定。俄罗斯总理米舒斯京20日表示，近3天的数据显示，俄罗斯新增新冠肺炎确诊病例数增速放缓，俄罗斯已成功避免了疫情大规模蔓延和爆炸性增长。世卫组织驻俄代表：俄疫情已趋于缓和5月20日，世卫组织驻俄罗斯代表武伊诺维奇表示，俄罗斯疫情看起来已稳定下来，但防控疫情就像一场马拉松比赛，现在才刚跑到半路。追踪病毒感染者活动轨迹、遵守防疫隔离规定，对于保持疫情积极态势至关重要。他呼吁民众继续保持社交距离，注意个人卫生。俄病毒学家：目前不能取消防疫限制措施在同一天，俄病毒学家阿纳托利·阿尔特施泰因表示，尽管俄单日新增确诊病例在明显减少，但目前还不能取消防疫限制措施并开放商场、咖啡馆、理发店等公共场所。编辑 彭启航来源：央视新闻原标题：俄总理：俄罗斯疫情现已日趋稳定	2020-05-21 10:25	央视新闻原标题	bj	20200521161325
2020052116132518	中国科学院院士万卫星因病逝世 享年62岁	新京报快讯 据中国科学院官方微博5月21日消息，九三学社第十四届中央委员会委员、中国科学院院士、中国科学院地质与地球物理研究所研究员万卫星，因病于2020年5月20日晚在北京逝世，享年62岁。据九三学社中央委员会网站资料显示，万卫星  男，1958年7月出生，湖北天门人，汉族。1992年加入九三学社。现任中国科学院地质与地球物理研究所研究员，博士生导师。中国科学院院士。九三学社第十四届中央委员会委员。第十三届全国人大常委会委员。1978年至1982年就读于武汉大学空间物理系，获学士学位。1982年至1984年在中国科学院武汉物理研究所空间物理专业读研究生，获硕士学位。1984年至2004年历任中国科学院武汉物理与数学研究所研究实习员、助理研究员、副研究员、研究员。其间，1987年至1990年在中国科学院武汉物理研究所空间物理专业读研究生，获博士学位。2004年至今任中国科学院地质与地球物理研究所研究员。曾任九三学社第十三届中央委员会委员，湖北省第四届委员会副主委，北京市第十二届委员会委员；第十二届全国人大代表；湖北省第八、九届政协常委。编辑 彭启航来源：中国科学院官方微博原标题：	2020-05-21 09:36	中国科学院官方微博原标题	bj	20200521161325
2020052116132519	国家卫健委：昨日新增确诊病例2例 无症状感染者31例	新京报快讯 据国家卫健委网站消息，5月20日0—24时，31个省(自治区、直辖市)和新疆生产建设兵团报告新增确诊病例2例，其中境外输入病例1例(在广东)，本土病例1例(在上海);无新增死亡病例;新增疑似病例1例，为境外输入病例(在上海)。当日新增治愈出院病例5例，解除医学观察的密切接触者308人，重症病例减少1例。境外输入现有确诊病例43例(含重症病例2例)，现有疑似病例7例。累计确诊病例1709例，累计治愈出院病例1666例，无死亡病例。截至5月20日24时，据31个省(自治区、直辖市)和新疆生产建设兵团报告，现有确诊病例84例(其中重症病例8例)，累计治愈出院病例78249例，累计死亡病例4634例，累计报告确诊病例82967例，现有疑似病例7例。累计追踪到密切接触者740967人，尚在医学观察的密切接触者4864人。31个省(自治区、直辖市)和新疆生产建设兵团报告新增无症状感染者31例(境外输入3例);当日无转为确诊病例;当日解除医学观察24例(无境外输入);尚在医学观察无症状感染者375例(境外输入29例)。累计收到港澳台地区通报确诊病例1540例。其中，香港特别行政区1055例(出院1026例，死亡4例)，澳门特别行政区45例(出院45例)，台湾地区440例(出院402例，死亡7例)。编辑 彭启航来源：国家卫健委原标题：截至5月20日24时新型冠状病毒肺炎疫情最新情况	2020-05-21 08:28	国家卫健委原标题	bj	20200521161325
2020052116132520	北京今日有降雨 气温波动明显早晚需添衣	据中国天气网消息，今天（21日），北京城区有降雨天气，出行要注意防雨。另外，北京气温有所波动，昼夜温差较大，早晨体感偏凉，午后偏热，公众请根据气温变化及时调整着装，以防感冒。预计23-28日期间，大部分时间本市天气为晴到多云。受冷空气影响，23日天空云量较多，夜间山区有阵雨，降雨对城区影响不大；24-26日多3、4级偏北风。该期间气温呈上升趋势，白天最高气温24～34℃，夜间最低气温15～20℃。编辑 彭启航来源：中国天气网原标题：北京今日有降雨 气温波动明显早晚需添衣	2020-05-21 08:09	中国天气网原标题	bj	20200521161325
