id	title	txt	datetime	source	web	batch
2020051220090725	吉林省副省长张志军任长春市委副书记，提名为市长候选人	据长春日报微信公众号消息，12日，全市领导干部会议召开。中央和省委决定：张志军同志任长春市委委员、常委、副书记，提名为长春市市长候选人。张志军简历张志军，男，汉族，1964年7月出生，籍贯辽宁省义县，1989年8月参加工作，中共党员，研究生学历。1985.07--1989.08  长春师范学院中文系汉语言文学专业学生1989.08--1990.11  通榆师范学校教师1990.11--1991.10  长春师范学院团委干事1991.10--1994.09  长春师范学院团委副书记1994.09--1998.04  长春师范学院团委书记兼学工部副部长（1993.09--1995.12在吉林大学行政学院思想政治教育专业研究生在职学习， 1996.04获法学硕士学位）1998.04--1998.10  长春师范学院院长助理兼总务处处长1998.10--2001.08  长春师范学院副院长2001.08--2001.10  吉林省辽源市委常委2001.10--2003.01  吉林省辽源市委常委、政法委书记2003.01--2003.12  吉林省辽源市委常委、宣传部部长2003.12--2008.03  吉林省辽源市委常委、组织部部长（2000.09--2005.12在吉林大学行政学院政治学理论专业研究生在职学习， 2005.12获法学博士学位）2008.03--2010.04  吉林省吉林市委常委、组织部部长2010.04--2010.07  吉林省吉林市委副书记、组织部部长2010.07--2011.03  吉林省吉林市委副书记2011.03--2012.08  吉林省政府外事办公室（吉林省政府侨务办公室）主任、党组书记2012.08--2012.09  吉林省政府外事办公室（吉林省政府侨务办公室）主任、党组书记，吉林省委组织部副部长（兼）2012.09--2015.09  吉林省人力资源和社会保障厅厅长、党组书记，吉林省委组织部副部长（兼）2015.09--2019.09  吉林省白山市委书记2019.09--  吉林省人民政府党组成员、副省长（吉林省人民政府网资料）编辑 彭启航来源：掌上长春原标题：中央和省委决定：张志军任长春市委副书记，提名为市长候选人	2020-05-12 15:01	掌上长春原标题	bj	20200512200907
2020051220090726	香港特区政府暂拟9月6日举行第七届立法会换届选举	据央视新闻客户端消息，香港政制及内地事务局今天向香港立法会提交文件，选举事务处暂时以9月6日为第七届立法会换届选举日期，选举提名期定为7月中旬至7月下旬。当局表示，计划在7月25日前公布2020年正式选民登记册，估计登记选民的整体数字比目前会有所增长，现在会以约420万名地方选区合资格登记选民为基础筹备本次换届选举。选举事务处会为2020年立法会换届选举设立超过610个一般投票站，一般投票站的投票时间为上午7时半至晚上10时半。当局将招募及培训约31000名选举工作人员，其中26000人会派驻到投票站工作，另外约5000人会在亚博馆的中央点票站工作。编辑 杨利来源：央视新闻客户端	2020-05-12 15:01	央视新闻客户端	bj	20200512200907
2020051220090727	云南安宁山火已持续超70小时：北线突破至楚雄州禄丰县	据人民日报消息，5月9日15时33分，云南省昆明市安宁市青龙街道办事处双湄村委会山神坝发生森林火灾。受火场高温大风、植被易燃等不利因素的影响，火场多次出现飞火情况，形成北、西南等多条火线，北线已突破至楚雄州禄丰县，目前仍在进行紧张扑救。5月12日凌晨1时，火场北线己蔓延至楚雄州禄丰县勤丰镇阿姜郎村西侧600米处，联指紧急部署昆明市森林消防支队260名指战员依托小型水库、耕地等有利条件，多路展开扑救，成功拦截大部分火头。截至5月12日9时，火场北线烟雾较大，部分沟谷内有2个较大烟点，火场南线和西南线茶花箐一带仍有较大烟点。指挥部根据实际情况，调整了灭火方案，火场北线继续追歼剩余火头，火场西南线采取常规灭火与水泵灭火相结合，继续扑打、清理，火场南线实施增湿作业。目前，火场共投入森林消防、消防、解放军、地方专业扑火队和干部群众3000余人、工程机械29台。同时，调派了4架灭火直升机参与吊桶灭火。编辑 彭启航来源：人民日报原标题：云南安宁市森林火灾北线已突破至楚雄州禄丰县	2020-05-12 14:46	人民日报原标题	bj	20200512200907
2020051220090728	韩国歌手郑俊英因性暴力犯罪二审被判5年	据海外网消息，据韩联社报道，韩国首尔高等法院12日作出二审判决，判处歌手郑俊英5年有期徒刑，FTISLAND前成员崔钟勋获刑2年半。此前，两人因涉嫌集体性侵和偷拍并散播淫秽影片被起诉，一审时分别获刑6年和5年。报道称，2016年1月和3月，郑俊英和崔钟勋在韩国洪川和大邱，对醉酒女子实施集体性侵。2015年底，郑俊英在群聊中，提到与多名女性发生性关系并分享偷拍视频，受害人多达10名。警方已查明，他在群内共发布11次偷拍视频和照片。2019年3月12日，处在风口浪尖上的郑俊英，暂停海外拍摄的综艺节目回国。当天，他在仁川机场遭遇记者围堵，现场一度混乱。编辑 贾聪聪来源：海外网	2020-05-12 14:23	海外网	bj	20200512200907
2020051220090729	俄罗斯一救治新冠肺炎患者医院起火 5名病人丧生	据海外网消息，据俄罗斯卫星网报道，俄罗斯紧急部门称，圣彼得堡一家医院发生火灾，已致5人丧生。俄媒指出，这家位于圣彼得堡的医院负责治疗新冠肺炎患者。大火导致医院内5名重症监护室内的病人丧生。目前已有150人被疏散。编辑 贾聪聪来源：海外网	2020-05-12 13:57	海外网	bj	20200512200907
2020051220090730	古汉语语法学家麦梅翘逝世，享年94岁	新京报快讯 5月12日，中国社科院语言研究所发布讣告沉痛悼念麦梅翘先生：讣 告古汉语语法学家、中国社会科学院语言研究所麦梅翘先生，因病医治无效，于2020年5月9日在北京逝世，享年94岁。麦梅翘，1926年12月出生于广东省台山县，1953年毕业于中山大学语言学系，同年进入中国科学院语言研究所工作，历任研究实习员、助理研究员、副研究员，1987年12月退休。麦梅翘先生在古代汉语语法研究领域多有贡献，撰有《古汉语语法学资料汇编》（与郑奠先生合编，中华书局，1964）、《文言虚词浅释》（合著，北京出版社，1979）、《古代汉语虚词通释》（合著，北京出版社,1985）、《实用古代汉语》（合著，北京出版社，1991）、《古代汉语虚词词典》（合著，商务印书馆，1999）等著作。发表《〈马氏文通〉和旧有讲虚字的书》（《中国语文》1957年第4期）、《古汉语中的“省文”》(《中国语文》1961年第6期)、《〈左传〉中介词“以”的前置宾语》（《中国语文》1983年第5期）、《古汉语的“望”和“相望”》（《中国语文》1986年第3期）、《〈左传〉的“乎”》（《古汉语研究论文集》（三），北京出版社，1987）、《古汉语的“是以”和“以是”》（《语言文字学术论文集》，知识出版社，1989）等重要学术论文，在古汉语语法学界产生了重要影响。对麦梅翘先生的不幸逝世，我们表示沉痛哀悼！麦梅翘先生千古！中国社会科学院语言研究所2020年5月12日编辑 贾聪聪来源：中国社科院语言研究所	2020-05-12 13:45	中国社科院语言研究所	bj	20200512200907
2020051220090731	第二批对美加征关税商品第二次排除清单发布	新京报快讯 据财政部官网消息，根据《国务院关税税则委员会关于试行开展对美加征关税商品排除工作的公告》（税委会公告〔2019〕2号），经国务院批准，国务院关税税则委员会公布第二批对美加征关税商品第二次排除清单，对第二批对美加征关税商品，第二次排除其中部分商品，自2020年5月19日至2021年5月18日，不再加征我为反制美301措施所加征的关税。对已加征的关税税款予以退还，相关进口企业应自排除清单公布之日起6个月内按规定向海关申请办理。第二批对美加征关税的其余商品，暂不予排除。未列入第一批、第二批对美加征关税商品排除清单的商品，企业可根据《国务院关税税则委员会关于开展对美加征关税商品市场化采购排除工作的公告》（税委会公告〔2020〕2号），申请市场化采购排除。编辑 刘佳妮来源：财政部官网	2020-05-12 13:36	财政部官网	bj	20200512200907
2020051220090732	和州长们缠斗不止，特朗普将联邦制带向危途	▲资料视频。马斯克威胁不让复工就搬走特斯拉，议员爆粗口大骂。新京报我们视频出品新冠疫情正在美国演变成一场更大的危机：不仅仅是公共卫生危机，而且正在变成一场席卷全国的政治危机。在最初的混乱与慌张过去之后，各州的政府已经开始主动性地进行“站队”了：到底是跟着特朗普走，还是自力更生，或者联合起来抗击疫情、恢复经济。这种选边站的策略，不仅仅发生在民主党州长和市长身上，也发生在共和党当政的州中。这基本上是美国从第二次世界大战之后最大的政治变更：联邦政府的地位从未如此岌岌可危。而且，特朗普开启了一个极具杀伤力的先例：在对抗一种危机的时刻，不再以实际的危机应对为目标，而是在与联邦政府的政治考量中，去获取最大的利益。联邦政府甩手不管也就罢了，还不断为各州制造麻烦从克林顿政府之后，美国的两党斗争已经愈演愈烈，几乎在所有的议题上都针锋相对。这种情况使美国的整个知识界都忧心忡忡，关于“两个美国“的研究汗牛充栋，两党之间的政治冲突，甚至能够影响到家庭的和睦，这种情况，在南北战争结束，“重建时代“之后，几乎未曾出现过。但即便如此，政治领域的基本共识与职业精神也未曾受到挑战。在应对公共危机，包括自然灾害、恐怖袭击和金融危机方面，联邦政府与州政府之间依然秉承着良好的职业准则与友爱精神，彼此应援，共渡难关。“9·11”时期，美国出现了空前团结。当时参加救援的消防队，从四面八方赶来，不仅仅是临近的弗吉尼亚、新泽西和马萨诸塞等州，甚至远在数百公里之外的五大湖区，也有消防队日夜兼程赶来救援。虽然由于布什政府的战争政策导致了美国观念群体的分裂，然而，在数次的各种危机中，各州显然依旧保持了职业优先、政治其次的理念，奉行政治与职业之间较为严格的分离。▲资料视频。奥巴马批评抗疫是“混乱的灾难” 特朗普反击：看看你们的H1N1。视频来源：新京报我们视频。然而，特朗普的抗疫政策，已然使这样的政治传统遭遇致命的摧毁。在多次的演讲之中，特朗普一再宣称，抗疫是各州自己的事情，而迟至4月底，他仍在宣称，新冠疫情检测也是各州自己的决定。从3月初美国疫情开始暴发，联邦政府实质上都缺少统一的行动指针，例如在是否佩戴口罩、学校是否停课、居民是否隔离等方面。这当然和特朗普的认知上有极大的关系。加州和纽约州长，都曾经抱怨由于听信特朗普关于疫情并不严重，并且联邦政府已经有效控制的错误信息，导致了各州的反应速度迟缓，才会造成疫情的大面积失控。联邦政府的甩手掌柜政策，一下子让各州慌了手脚。在3月到4月的整整两个月时间里，各州的认知完全不一致，学校停课、商业闭市、居民隔离的措施，完全取决于各州的自行安排。这种慌乱的措施，使美国人的总体流动性还在继续，于是疫情严重失控，尤以纽约为甚。在联邦政府的不作为之下，各州只好自求多福，于是50个州有50个抗疫政策。但可怕的还不仅于此，联邦政府还在不断地制造麻烦。疫情的快速蔓延，使美国的医疗物资储备瞬间出现巨大的缺口。各州唯一的方法，就是向联邦政府求援。但联邦政府的反应再次让各州目瞪口呆：联邦不仅仅不愿向各州伸出援手，反而不断截流各州通过各种方法购买的物资。曾供职于美国布鲁金斯学会的赵修业和目前供职于美国都市研究所的王若冰在《丁香园》公众号中，描述了联邦政府与州政府之间的物资博弈图景。特朗普的女婿库什内直接在白宫新闻发布会上说，“国家战略储备是我们（联邦政府）的战略储备，而不是各州的。”不仅如此，由于海关、物资标准与贸易政策控制在联邦政府手里，因此各州根本无法绕过联邦政府从世界各地自行购买。还有更要命的：由于联邦应急管理署（FEMA）有权统一调配物资，所以各州自行购买的物资，联邦政府有权收购，然后进行统一分配。纽约州长库莫无奈地说：“现在的物资采购像是50个州加上联邦政府一起在e-Bay上竞价拍卖，我们没办法比联邦政府出价更高。”▲美国这州州长通话录音曝光：重启经济定会加速疫情蔓延。视频来源：新京报我们视频。联邦与各州的信任打破，美国的撕裂才刚刚开始当然，特朗普也并不是扣押着物资不放，他的核心在于：谁听话，就给谁。纽约、加州和华盛顿州自然都是受害最为严重的州，所以需要的物资最为紧急和庞大。然而，纽约州长库莫和加州州长纽森都多次指责联邦政府无论在口罩还是呼吸机的分配上，完全不考虑他们的严重情况。那么谁获得的物资最多呢？佛罗里达州。纽约州、加州和伊利诺伊州这些无法获得救援的，都是民主党当政；而共和党执政的州，申请多少给多少。在四顾无援的情况下，一些州依靠自己取得了初步进展。他们本以为能喘口气，但5月份，他们发现要面临另外一场和特朗普之间的战争：复工重启。毋庸讳言，美国经济已经到了命若悬丝的地步。根据美国官方的预测，如果到了6月份仍然不能复工的话，那么美国的失业率将高达24%，追平1933年大萧条的高峰时期。在最近这20年的总统竞选中，尽管有各种各样的话题会分散注意力，但最后决定胜负的临门一脚，依然是经济。如果未曾出现新冠，特朗普连任胜算其实不低；但若持续封闭政策，失业率达到20%，也几乎可以宣判他的连任失败。因而，特朗普几乎孤注一掷地开始推动复工，甚至不惜支持诉诸武力抗议封城措施的右派人士，4月中旬他连续抛出三条推特，全部用大写字母夸张宣示“解放明尼苏达”“解放密歇根”“解放弗吉尼亚”，都在于急于重开经济。当然，这三州的州长，全都是民主党人。但此番，不仅是民主党州长不愿意轻易放松警戒，还有大批的共和党州长。德克萨斯和俄亥俄州，两个共和党州长，都只能同意相当有限开放，并且坚持以逐步复工的方式进行。哈佛大学历史学家丽萨贝·科恩4月29日在《纽约时报》撰文，回顾了罗斯福新政所带来的繁荣与美国“一体化”。罗斯福新政的成就，恰恰在于联邦政府给各州提供了一个保底的政策支持，无论是就业、失业保险还是社会保障，从而使得各州对于联邦政府有着充分的信任，于是能够根据自己的特征，去寻找发展的方向。而特朗普与各州之间的缠斗，背后显著地带有党派斗争的色彩，更加有着连任的政治欲望，不断在加剧着联邦政府与州政府之间的龃龉与离心。目前，各州之间一来已然认清事实，都比较坚决地采取了自助自救的方式，绕过联邦政府获取物资，并且也基本完全按照自己的时间表来安排复工重启的节奏；二来开始形成联盟，对抗联邦政府的侵袭和干扰，例如加州、华盛顿州和俄勒冈州形成了“西部州协议”，开始共同行动；而东部的纽约、新泽西、康涅狄格等7州则成立专门联合委员会，协调物资、重启等事务。联邦政府与各州之间，在二战之后，第一次撕裂罗斯福新政，开始了分离倾向。如果说用“新内战”来形容，颇有些危言耸听的话，那么联邦与州之间的信任打破，各自为政，却是一个不争的事实。美国大选，不仅仅是选总统，也在选州长。抗疫成功的各州州长，多数恐怕连任，州府之间的战争，不过才刚开始。美国未来将如何“撕裂”，还是一个未知数。□连清川（专栏作者）编辑 孟然  校对  刘军	2020-05-12 12:23	新京报我们视频	bj	20200512200907
2020051220090733	上海小区3000字怼丰巢：别只看到“硬刚”	▲丰巢单方面宣布收费遭多小区抵制 业委会：违反合同规定。视频来源：新京报我们视频出品丰巢收取超时费的争议持续发酵。5月8日，上海中环花苑小区业委会在全市率先宣布暂停使用两台丰巢智能柜。5月9日，丰巢发布《致亲爱的用户一封信》和《东新园业委会事件声明》，对用户表达了不安，并做出了一些解释。5月10日，中环花苑小区发布了致丰巢公司的公开信，这封逾3000字的信里直接称“你们不改，我们不用！”还驳斥了丰巢“亏损运营”的说法，称其单柜利润率超2倍。信里还重申了两大诉求：要求在快递柜上张贴醒目提示，请快递员必须先行联系客户同意方可投入丰巢柜；将免费时长延长到24小时。这封公开信很快刷屏网络，并引起强烈反响。都在正常市场博弈的范畴至此，这轮涉及多方的市场博弈进入高潮。各方分别阐明理由、主张自身立场的合理性，有利于厘清真相、判明是非曲折，有助于社会大众认识中国物流业现状。在针尖对麦芒的争论中，哪些是市场博弈的正确思维，哪些是“屁股决定脑袋”、文过饰非，值得细细分析。就这封公开信本身来说，中环花苑小区业委会从业务流程和通识逻辑的角度，对丰巢的批评很合理。“快递件是用户和快递公司之间形成的契约关系，这中间其实本没有丰巢柜什么事情，丰巢柜在这里是横插一脚截流的角色”，可谓一针见血。丰巢的快递柜业务确实可以提高物流的效率，快递公司和收件人都可以是这项服务的受益者。但再好的服务也要对方自愿接受才行，尤其是“横插一脚”的角色更要注意上下游的充分授权。即便是免费服务，收件人也有不同意丰巢介入的权利。改为超时收费后，更要尊重收件人的选择权。丰巢单方面认为十二小时免费时间很充分、超时费用每小时0.5元很低廉，就轻忽了收件人的选择权，是想当然。企业的确有调整价格的自由，但这也并不免除其充分告知的义务。五年免费服务也好，提高设备利用率的正当理由也罢，都不能免除其告知的责任，丰巢显然也没有做到。由此可以理解涉事业委会暂停使用快递柜的激烈反应。当初丰巢向业委会承诺免费，是业委会决策的依据。即便没有反应在协议文本中，道义上也应该遵守到底。事到如今，即便业委会的暂停决定存在法律争议，丰巢是否准备承担与上海78家小区“法庭见”的司法成本？何况后续还可能有更多的社区加入反制的阵营。▲丰巢快递柜“超时收费”引热议：因抢占市场亏损 “12小时”需解释。视频来源：新京报我们视频出品物业收取的场地租金是否合理应纳入讨论范围当然，回到丰巢收取超时费这一事件的根本问题，企业不是公益慈善机构，追求利润是企业的天然属性，本身无可指责。而利润源于收费和成本之差，那么首先要解决的问题是哪些收费是合理的。首先，针对快递柜入驻，小区物业公司收取的场地租金就是其中一项——实际上，在双方的公开信中，物业公司收取的场地租金到底是否“高昂”，也成为焦点之一。5月9日，在《致亲爱的用户一封信》和《东新园业委会事件声明》中，丰巢明确指出“进驻小区每年支付高昂进场费”，并将无法为用户提供免费服务归咎于此。但中环花苑小区业委会的公开信也对此进行了驳斥，认为他们小区“每台快递柜平均每天的场地租金收入（含电费）就十几元，并不高昂”。二者之间在事实上的偏差，显然还需要进一步得到解答，但物业管理方是否利用垄断优势不当得利，丰巢公司的快递柜业务是否为此支付了不必要的费用、增加了成本，这些成本是不是导致此次价格上浮的因素，确实应该纳入此次争议的考虑范围中。作为国际大都市，上海寸土寸金，但是小区公共空间不是普通的商业资源，功能有诸多限制，没有市场价格参照。收取快递柜的租金，缺乏市场依据。小区物业公司只是受托管理小区公共空间，没有小区公共空间的产权或收益权，按理说，并无收取租金的正当性。至于物业公司从快递柜项目中收取服务性质的费用，也要在合理的范围。快递箱的服务是由丰巢公司提供的，而不是物业公司。物业公司如果提供必要的辅助服务，才能从丰巢公司获得相应的费用。比如，快递柜的电费应由丰巢公司承担，物业公司可以提供代收服务。如果丰巢公司委托物业公司为快递箱提供安保服务，那么双方应单独签订相应的服务合同。此类衍生费用不属于地租金，与小区业主也没有直接关系，也不应强制垄断。业委会的角色应该是代表小区业主监督物业公司的管理运营。如果物业公司利用物业管理的垄断优势，在快递柜业务中不当得利，业委会理应制止。这一场因为几毛钱而扯动整个局面的议题还在继续发酵。作为上海首个宣布暂停使用丰巢智能柜的小区，丰巢将如何应对中环花苑的公开信，对这一牵涉公共利益的议题来说，显然具有样本价值。我认为，丰巢公司应该注意到，中环花苑小区业委会的行动虽然激进，但诉求冷静合理。醒目标贴提示请快递员必须先行联系客户同意方可投入丰巢柜，应该作为行业规范推行。延长免费时间，也完全可以作为交涉的方向。这不只该适用单个小区，而应该对所有小区通用。对丰巢方面而言，当下应积极与相关社区交涉，及时形成各方接受的方案并全域推行。不能指望商业主体长期做公益，也不能无视民众的正当权益，显然是谈论这事的两点基础。□关不羽（专栏作者）编辑 陈静  校对 危卓	2020-05-12 12:23	新京报我们视频出品物业收取的场地租金是否合理应纳入讨论范围当然	bj	20200512200907
2020051220090734	北京城区杨柳飞絮基本结束，山区15日进入高发期	新京报快讯 据首都园林绿化官博消息，12日，2020年北京杨柳飞絮第3个高发期预报发布。预报称，15日至24日为北京山区局地杨柳飞絮高发期。主要飞絮物种为部分欧美杨、青杨和山杨。编辑 刘佳妮来源：首都园林绿化官博	2020-05-12 12:17	首都园林绿化官博	bj	20200512200907
2020051220090735	韩国夜店集体感染致101人确诊 距出现首例患者仅6天	据海外网消息，据韩国KBS新闻报道，韩国防疫部门12日通报称，截至当天上午10点，韩国首尔梨泰院夜店集体感染事件已致101人确诊，包括曾到访夜店的人员，以及上述人员的家人、朋友等密切接触者。此时距离首例确诊患者出现仅有6天。从地域分布来看，64例分布在首尔，京畿道23例，仁川7例，忠清北道5例，釜山1例，济州道1例。这也是继呼叫中心集体感染事件（98人确诊）后，首尔暴发的第二大集体感染事件。首尔市长朴元淳12日表示，首尔已对7272名相关人员进行检测，并在警方和通信公司协助下，通过调查手机信号，获取了近期访问梨泰院人员的名单，共计10905人，已向他们发送提醒短信。此外，为防范疫情进一步扩散，首尔市政府已于9日发布行政命令，宣布即日起暂停首尔市内夜店、酒吧等部分娱乐场所的运营，违反规定的营业者将受到重罚。编辑 贾聪聪来源：海外网	2020-05-12 11:26	海外网	bj	20200512200907
