id	title	txt	datetime	source	web	batch
2020052115563369	宁夏：5月底前小学生全部返校复课	据人民日报消息，根据疫情形势变化，经宁夏回族自治区党委应对新冠肺炎疫情工作领导小组和指挥部同意，5月19日，宁夏回族自治区教育厅下发《关于做好2020年春季学期小学生返校复课有关工作的通知》。通知明确，5月27日小学四、五、六年级学生返校复课，5月31日小学一、二、三年级学生返校复课。幼儿园幼儿返园、特殊教育学校（机构）学生返校复课和校外培训机构线下培训在小学返校复课观察一段时间后，由属地市、县（区）党委、政府针对疫情防控风险等级管理原则确定。通知要求宁夏各地各学校要严格执行教育部办公厅、国家卫生健康委办公厅《中小学校、托幼机构新冠肺炎疫情防控技术方案（修订版）》和自治区应对新冠肺炎疫情工作指挥部学校工作组《关于建立同疫情防控相适应的教育教学秩序扎实做好2020年春季学期开学工作的通知》要求，做好疫情防控和学校安全工作，确保校园安全、学生健康。编辑 彭启航来源：人民日报原标题：宁夏：小学生全部返校复课	2020-05-20 11:00	人民日报原标题	bj	20200521155633
2020052115563370	北京前4月查处违反中央八项规定精神问题109人	清风北京微信公众号新京报快讯 据清风北京微信公众号消息，日前，市纪委监委对外公布今年1月至4月查处违反中央八项规定精神问题统计指标表。截至4月30日，本市已查处违反中央八项规定精神问题108个，处理109人，其中局级2人、处级25人、科级及以下82人。在被查处的109人中，给予党纪政务处分的94人，其中局级1人、处级21人、科级及以下72人。查处问题类型包括两大类，即形式主义、官僚主义问题和享乐主义、奢靡之风问题，查处人数分别为35人、74人。其中，形式主义、官僚主义问题方面，被查处的问题集中在两类，即在履职尽责、服务经济社会发展和生态环境保护方面不担当、不作为、乱作为、假作为，严重影响高质量发展；文山会海反弹回潮，文风会风不实不正，督查检查考核过多过频、过度留痕，给基层造成严重负担，分别为33人、2人。享乐主义、奢靡之风问题方面，在查处的问题中，比较集中的是：违规发放津补贴或福利、违规收送礼金和其他礼品、违规接受管理和服务对象等宴请、违规公款吃喝，分别为20人、14人、9人、9人。今年4月份，本市共查处违反中央八项规定精神问题23个，处理23人，其中处级6人、科级及以下17人；给予党纪政务处分20人，其中处级6人、科级及以下14人。主要集中在履职尽责、服务经济社会发展和生态环境保护方面不担当、不作为、乱作为、假作为，严重影响高质量发展；违规发放津补贴或福利、违规收送礼金和其他礼品、违规接受管理和服务对象等宴请等方面。编辑 马浩歌来源：清风北京微信公众号	2020-05-20 10:58	清风北京微信公众号	bj	20200521155633
2020052115563371	香港特区政府再度委任史美伦为港交所主席	据央视新闻客户端消息 香港特区政府表示，行政长官林郑月娥已核准史美伦再度出任香港交易所主席，任期即时生效，直至2022年股东周年大会完结后届满。特区政府深信在史美伦的领导下，港交所会致力进一步提升香港的市场竞争力，并巩固香港作为区内首选集资及风险管理平台的地位。史美伦是在2020年2月被再度委任为港交所董事会成员，任期约两年，直至该公司于2022年举行的股东周年大会完结为止。史美伦2018年成为港交所历史上第一位女主席，担任香港金融领导委员会委员，曾任香港金融发展局主席。她曾在2001年至2004年担任中国证监会副主席。编辑 马浩歌来源：央视新闻客户端	2020-05-20 10:58	央视新闻客户端	bj	20200521155633
2020052115563372	工信部：规模以上工业企业平均开工率回升至99.1%	据央视新闻客户端消息，5月20日上午10时，国务院新闻办公室举行新闻发布会，工业和信息化部部长苗圩介绍统筹推进疫情防控和产业转型升级，促进制造业通信业稳定发展有关情况。苗圩介绍，截至5月18日，全国规模以上工业企业平均开工率和复岗率分别回升至99.1%和95.4%，基本达到正常水平。编辑 马浩歌来源：央视新闻客户端	2020-05-20 10:13	央视新闻客户端	bj	20200521155633
2020052115563373	吉林市公布新增确诊病例行程：曾在汉堡店聚餐	新京报快讯 据吉林市卫健委网站消息，5月19日1-24时，吉林市新增本地确诊病例1例。5月20日，吉林市卫健委通报该病例行程轨迹：男，2000年出生，吉林市人，系5月19日吉林市通报的确诊病例3的密切接触者，现住址为吉林市高新区天天向上小区。通过密切接触者主动筛查核酸检测阳性，5月19日经专家组会诊，诊断为确诊病例。5月4日 11时乘私家车到园艺路派乐汉堡店聚餐后返回家中。5月5日至9日 无外出。5月10日 13时去丰满区龙湾雅苑办事，15时到物华商城二层龙泽电脑商铺购物，16时到丰满区荣光花园小区办事后在3路公交车水工站桩附近的金状元米线就餐，饭后返回家中。以上出行均骑乘电瓶车。5月11日 11时骑自行车去小兰旗哈弗4S店办事后返回家中。5月12日-18日 被居家隔离观察。5月18日 送至隔离点集中隔离。5月19日 送吉林医药学院附属医院隔离诊疗，诊断为确诊病例。编辑 马浩歌来源：吉林市卫健委网站	2020-05-20 09:52	吉林市卫健委网站	bj	20200521155633
2020052115563374	四川将引导制定国内指标最严、要求最高的年份酒团体标准	新京报讯 日前，四川省市场监管局召开四川白酒团体标准体系建设座谈会。座谈会上，四川省局标准化处处长徐翔就团体标准的意义、功能、作用以及全省团体标准简要情况作了相应介绍，他指出，将引导我省白酒龙头企业加强合作，共同制定国内指标最严、要求最高的年份酒团体标准，以标准引领四川白酒产业高质量发展。他要求一是白酒骨干企业要抱团发展，进一步打开视野，凝聚智慧，促进白酒质量提高。二是各企业要立足团体标准体系建设，就年份酒的原粮、产品工艺、指标、包装、储存等方面标准制定积极协商、相互碰撞、消除分歧、达成一致。三是成都、宜宾、泸州市市场监管局要切实营造良好环境，积极指导、推动年份酒团体标准制定工作，促进我省白酒产业发展壮大。宜宾五粮液股份有限公司、泸州老窖股份有限公司、四川水井坊股份有限公司、四川郎酒股份有限公司技术质量和标准化工作负责人重点围绕年份酒的原粮种植技术规程、产品生产工艺、质量管控、质量指标、检测方法、标志标签、包装、储存等方面的团体标准制定以及提升白酒质量水平进行交流，一致认为加快制定四川白酒团体标准对推进川酒向高端发展具有重要意义，将及时向公司领导层汇报，积极参与团体标准制定的相关工作。来源：四川省市场监督管理局官方网站编辑 徐晶晶 校对 王心	2020-05-20 09:30	四川省市场监督管理局官方网站编辑	bj	20200521155633
2020052115563375	包商银行：营业网点将变更为蒙商银行，5月25日营业	新京报快讯 5月20日，包商银行官网发布《关于蒙商银行股份有限公司全面营业的公告》，蒙商银行承接包商银行的相关业务，包商银行在内蒙古自治区内的营业网点将全部变更为蒙商银行营业网点。目前，银行系统切换和网点标识、凭证、印章更换等准备工作已就绪，定于5月25日正式以“蒙商银行”名义全面对外营业。全文如下：关于蒙商银行股份有限公司全面营业的公告包商银行股份有限公司接管组于2020年4月30日于中国人民银行网站、中国银行保险监督管理委员会网站发布了《关于包商银行股份有限公司转让相关业务、资产及负债的公告》，蒙商银行股份有限公司（以下简称蒙商银行或我行）承接包商银行股份有限公司（以下简称包商银行）的相关业务，包商银行在内蒙古自治区内的营业网点将全部变更为蒙商银行营业网点。目前，我行系统切换和网点标识、凭证、印章更换等准备工作已就绪，定于5月25日正式以“蒙商银行”名义全面对外营业。现将有关事项公告如下：一、系统切换期间对客户服务的影响自2020年5月22日17时至5月24日0时，原包商银行信息系统以及第三方的支付系统和清算系统将陆续变更为“蒙商银行”的相应标识。营业网点、自助设备、网上银行、手机银行、微信公众号等交易渠道，及支付宝、微信支付等第三方交易界面中，可能出现“蒙商银行”与“包商银行”名称并存的情况。这是系统更名过程中的正常现象，客户的交易与资金安全不受影响。我行将于2020年5月24日0时起进行系统切换，期间暂停服务，预计系统将于2020年5月24日6时起恢复服务，请客户根据需要，提前做好相应安排。二、蒙商银行承接的业务办理客户与原包商银行签署的合同、协议等由蒙商银行承接，债权债务关系将根据法律法规的有关规定相应转移。客户持有的原包商银行支票等空白票据需于5月25日至6月24日（含首尾当日）到开户机构免费更换新票据，客户于5月25日至6月24日期间（含首尾当日）签发的原包商银行票据仍可正常流通。客户持有的原包商银行借记卡、存单、存折等交易介质可继续使用，也可自愿到蒙商银行营业网点免费更换新的交易介质；客户持有的原包商银行信用卡可继续使用，也可自愿申请蒙商银行发行的新信用卡。三、徽商银行承接的业务办理对于徽商银行承接的业务，自5月25日起至转移到徽商银行系统前，客户仍在蒙商银行系统办理。具体业务办理规则见徽商银行公告。编辑 彭启航来源：包商银行官网原标题：关于蒙商银行股份有限公司全面营业的公告	2020-05-20 09:24	包商银行官网原标题	bj	20200521155633
2020052115563376	北京连续34天无本地报告新增确诊病例	新京报快讯 据北京市卫健委微信公众号消息，5月19日0时至24时，无新增报告境外输入新冠肺炎确诊病例、疑似病例和无症状感染者。截至5月19日24时，累计报告境外输入确诊病例174例，累计出院170例，在院4例。5月19日0时至24时，无新增报告本地确诊病例、疑似病例和无症状感染者。截至5月19日24时，累计报告本地确诊病例419例，累计出院408例，在院2例，累计死亡9例。全市已连续34天无本地报告新增确诊病例，具体为平谷区自有疫情以来无报告病例、延庆区117天、门头沟区107天、怀柔区103天、顺义区101天、密云区98天、石景山区96天、大兴区96天、房山区93天、昌平区92天、西城区90天、通州区90天、丰台区77天、东城区74天、海淀区57天、 朝阳区34天。编辑 彭启航来源：健康北京原标题：疫情发布丨北京昨日无新增报告新冠肺炎确诊病例	2020-05-20 09:01	健康北京原标题	bj	20200521155633
2020052115563377	国家卫健委：昨日新增确诊病例5例 4例为吉林本土病例	新京报快讯　据国家卫健委网站消息，5月19日0—24时，31个省（自治区、直辖市）和新疆生产建设兵团报告新增确诊病例5例，其中境外输入病例1例（在内蒙古），本土病例4例（均在吉林）；无新增死亡病例；新增疑似病例3例，其中境外输入病例2例（均在上海），本土病例1例（在上海）。当日新增治愈出院病例3例，解除医学观察的密切接触者328人，重症病例减少1例。境外输入现有确诊病例46例（含重症病例2例），现有疑似病例6例。累计确诊病例1708例，累计治愈出院病例1662例，无死亡病例。截至5月19日24时，据31个省（自治区、直辖市）和新疆生产建设兵团报告，现有确诊病例87例（其中重症病例9例），累计治愈出院病例78244例，累计死亡病例4634例，累计报告确诊病例82965例，现有疑似病例7例。累计追踪到密切接触者740614人，尚在医学观察的密切接触者4893人。31个省（自治区、直辖市）和新疆生产建设兵团报告新增无症状感染者16例（境外输入1例）；当日无转为确诊病例；当日解除医学观察37例（境外输入4例）；尚在医学观察无症状感染者368例（境外输入26例）。累计收到港澳台地区通报确诊病例1540例。其中，香港特别行政区1055例（出院1025例，死亡4例），澳门特别行政区45例（出院45例），台湾地区440例（出院401例，死亡7例）。编辑 马浩歌来源：国家卫健委网站	2020-05-20 08:30	国家卫健委网站	bj	20200521155633
2020052115563378	吉林卫健委：19日1-24时本省新增本地确诊病例1例	新京报快讯 据吉林省卫健委网站消息，5月19日0-24时，全省无新增境外输入确诊病例。截至5月19日24时，全省累计报告境外输入确诊病例19例，累计治愈出院19例（吉林市12例，延边州2例，长春市4例，梅河口市1例）。上述境外输入确诊病例的密切接触者307人，已全部解除医学观察。5月19日1-24时，全省新增本地确诊病例1例（吉林市），是在控制范围内主动筛查检测阳性确诊的。新增治愈出院2例（吉林市）。5月19日0时-1时新增3例本地确诊病例已于5月19日进行通报。截至5月19日24时，全省累计报告本地确诊病例133例，累计治愈出院106例，在院隔离治疗25例（吉林市25例），病亡2例。现有重型病例3例（吉林市）。现有本地确诊病例的密切接触者1181人，均在指定地点进行隔离医学观察。5月19日0-24时，全省无新增无症状感染者。截至5月19日24时，全省累计报告10例无症状感染者（6例输入），其中4例已订正为确诊病例，解除隔离医学观察5例，现有无症状感染者1例。该病例，男，2000年出生，系5月19日吉林省通报的吉林市高新区确诊病例3的密切接触者。住址为吉林市高新区。通过密切接触者主动筛查核酸检测阳性，5月19日经专家组会诊，诊断为确诊病例。提醒广大群众，当前“外防输入，内防反弹”形势依然严峻，要进一步提高防范意识，做好个人防护，保护好自己和家人的健康。一旦出现发热、咳嗽等急性呼吸道症状，要及时到当地定点医疗机构发热门诊就诊。编辑 彭启航来源：吉林省卫健委原标题：吉林省卫生健康委员会关于新型冠状病毒肺炎疫情情况通报（2020年5月20日公布）	2020-05-20 07:32	吉林省卫健委原标题	bj	20200521155633
2020052115563379	巴勒斯坦停止履行与美国和以色列达成的所有协议	据央视新闻消息，巴勒斯坦总统阿巴斯当地时间19日深夜宣布，巴方停止履行与美国和以色列达成的所有协议。编辑 贾聪聪来源：央视	2020-05-20 06:53	央视	bj	20200521155633
2020052115563380	英国剑桥大学取消下一学年所有面对面授课	据央视新闻消息，当地时间5月19日，英国剑桥大学宣布下一学年将不会进行面对面授课，成为英国首所宣布全学年网络授课的大学。学校称在符合社交距离要求的情况下，仍可能举行较小的教学小组以面授教学。剑桥大学表示，受新冠肺炎影响保持社交距离的要求可能还会持续，如政府疫情防控措施变化，学校会对此重新讨论。近期曼彻斯特大学也宣布，受新冠疫情影响下学期只保留线上授课。英国政府表示，即使大学继续采取网络授课的方式，学生们也仍需全额支付学费。编辑 贾聪聪来源：央视	2020-05-20 06:44	央视	bj	20200521155633
2020052115563381	埃及政府出台口罩强制佩戴政策	据央视新闻消息，当地时间19日，埃及政府出台政令，规定从5月30日起，民众在公共场合必须佩戴口罩。埃及总理马德布利在当天的记者会上对外公布了这一政策。该政策规定，自5月30日起，所有进入包括市场、商店、公共或私人机构、银行等在内的公共场合的人员，以及所有乘坐任何公共交通工具的人员，都必须佩戴口罩，违者将会被处以最多4000埃磅（约合人民币1800元）的罚款。马德布利还表示，政府多个部门在经过了两周的商议讨论之后，决定于近期开始生产可重复使用的布口罩，并将于之后向市场投放，以满足口罩强制佩戴政策实施后对于口罩的庞大需求。编辑 贾聪聪来源：央视	2020-05-20 06:42	央视	bj	20200521155633
2020052115563382	法国报告152例儿童川崎病病例 多例或与新冠病毒有关	据央视新闻消息，当地时间5月19日晚，法国卫生总局局长萨洛蒙在当天举行的新闻发布会上表示，自3月1日起，法国累计报告儿童川崎病病例152例，其中98例“可能与新冠病毒有关”。稍早前的5月15日，法国一名同时患有类似川崎病症状、并感染新冠病毒的儿童病亡。编辑 贾聪聪来源：央视	2020-05-20 06:40	央视	bj	20200521155633
2020052115563383	受疫情、油价多重影响 俄四月GDP下滑约28%	据央视新闻消息，据俄财政部19日公布的月度预算执行报告，俄罗斯4月份名义GDP约为6.3万亿卢布，同比下降约28%，环比下降约33%。俄媒认为，经济下滑主要受新冠肺炎疫情影响。俄总统普京宣布4月全国放假，俄国内大部分企业停工或转为远程办公。此外，3月初国际油价崩盘也对俄经济打击较大。虽然欧佩克和非欧佩克产油国达成的新减产协议已经于5月1日生效，但是俄专家分析这份协议无力扭转国际原油和石油产品市场供需失衡的状况。编辑 贾聪聪来源：央视	2020-05-20 06:39	央视	bj	20200521155633
2020052115563384	美加边境关闭延至6月21日	据央视新闻消息，当地时间5月19日，加拿大总理贾斯廷·特鲁多宣布，美加边境将继续关闭直至6月21日。目前边境禁止非必要的旅行，但允许商业交通和包括在美国医院工作的人员继续过境。受新冠肺炎疫情影响，美加边境于3月18日关闭。这是自4月18日双方决定延长关闭30日后，第三次延长边境关闭时间。编辑 贾聪聪来源：央视	2020-05-20 06:38	央视	bj	20200521155633
2020052115563385	世卫组织：全球新冠肺炎确诊病例超过473万例	据央视新闻消息，根据世卫组织最新实时统计数据，截至欧洲中部夏令时间5月19日16时05分(北京时间5月19日22时05分)，全球确诊新冠肺炎4731458例，死亡316169例。编辑 贾聪聪来源：央视	2020-05-20 00:36	央视	bj	20200521155633
2020052115563386	天津小学低年级和幼儿园6月2日开学	据央视新闻消息，记者刚刚从天津市新型冠状病毒感染的肺炎疫情防控工作指挥部获悉，根据天津新冠肺炎疫情防控工作情况，经天津市防控指挥部研究决定，2020年春季学期第四批学生复课开学安排如下：一、6月2日，全市小学一、二、三年级及特殊教育学校同步复课开学。二、6月2日，全市公办幼儿园开园；6月2日起，民办幼儿园（含托幼点）经所在区核验同意后，可自主选择开园时间。所有家长均可自愿选择幼儿是否到园，幼儿园为选择本学期暂时不到园的幼儿保留学位。三、6月2日起，校外培训机构可向所在区提出线下开班申请，经所在区有关部门核验合格后可有序恢复线下培训。四、复课开学前，应继续按有关要求扎实开展线上教学工作。五、各有关学校、幼儿园要精准有效做好复课开学后疫情防控工作，筑牢校园防疫阵地，确保师生安全健康。编辑 贾聪聪来源：央视	2020-05-19 23:29	央视	bj	20200521155633
