id	title	txt	datetime	source	web	batch
2020051220090750	上海一业委会公开信走红 丰巢究竟该如何服务小区？	4月底，丰巢宣布旗下智能快递柜上线会员服务，超时取快递将收取0.5元-3元。此消息引发了各界关注，抵制声此起彼伏。5月10日，上海市中环花苑小区业委会也代表众多业主向丰巢发公开信要求，在快递柜上张贴醒目提示，并将免费时长延长到24小时。“目前为止，我们没有接到丰巢方面的任何回应。”5月11日，中环花苑业委会主任何先生向记者表示，“双方合同上没有任何关于向业主收费的约定，全部是丰巢快递柜方面单方面所为。”从小区物业管理方面看，此类问题的矛盾点究竟在哪？又该如何解决？中环花苑业委会：“超时收费”损害业主利益据悉，4月29日，丰巢科技宣布将上线会员服务，普通用户保管包裹超12小时需交纳一定费用，超时取快递将收取0.5元-3元，而会员最长可存放7天时间。该消息发布不久，就引来了一波又一波抵制。5月5日，第一波抵制浪起，杭州东新园小区业主委员会一纸通知宣告丰巢快递柜停用。5月9日，丰巢智能柜微信公众号发文称，从上线会员功能以来，丰巢12小时内取件比例提升了5个百分点，凡顺丰包裹在2小时内被取出的用户都会得到2元红包，4小时内取出将得到1元红包。然而，丰巢的上述说明并未得到部分业主的认可，“丰巢更多避重就轻地强调了企业的不易，如已经提供了五年的免费服务仍然亏损运营等等，事实上，即使仅依靠快递员付费模式和广告收入模式，未来该公司的盈利能力也将是卓越的。”中环花苑小区业委会方面表示。中环花苑业委会发出的公开信。（图片来源：中环花苑业委会微信公众号）5月10日，上海市中环花苑小区业委会又代表众多业主向丰巢公司发出了公开信要求，在快递柜上张贴醒目提示，请快递员必须先行联系客户同意下方可投入丰巢柜，免费时长延长到24小时。该业委会表示，若上述两点不能满足，中环花苑小区两处丰巢快递柜将无限期停止使用，直到协议期结束。对于发出该公开信的具体原因，中环花苑业委会介绍，丰巢快递柜在未经协商情况下，于2020年4月30日开始向收件人收取超时保管费，通过对该小区业主随机投票调查显示，有45%的业主要求撤销快递柜，有37%的业主要求停用快递柜，合计占比达82%。业委会认为，丰巢此举损害了小区业主的利益，有违当初进驻小区谈判时介绍的情况，决定从5月11日起暂停使用丰巢快递柜。“我们业委会已经得到小区业主的授权，正在行使正当权利。” 中环花苑业委会主任何先生说。北京已有小区暂停使用丰巢快递柜连日来，新京报记者在走访中发现，丰巢快递柜方面发布的通知，同样也引起了北京多个小区业主的不满。因丰巢快递柜“超时收费”，北京也已经有小区对其暂停使用了。“家里有人接收快递的时候，快递员却未经我们允许就将快递放在了小区丰巢快递柜内，这已经是未按照要求送货上门了，接下来还要收费，我们坚决抵制这种行为。”通州区马驹桥新海北里小区住户方刚（化名）告诉记者，“现在小区没有业委会，物业公司也不管，不知道这几个丰巢快递柜是如何进门的，更不知道谁能管这事。”5月11日，新京报记者就此事与新海北里小区的物业公司取得了联系，该公司一名陶（音）姓工作人员告诉记者，“这个小区没有业委会，我们不管快递柜的事。”此外，家住北京市顺义区金成雅苑小区的苏晓（化名）告诉记者，“我们小区去年刚入住就安装了丰巢快递柜，安装之前，快递小哥还会把快递送上门，现在可倒好，未经我们允许就直接放进了快递柜，这几天小区物业公司的人又告诉我们超过一定时间要收费。”对于丰巢快递柜收费问题，包括苏晓在内多位金成雅苑业主都表示，“不是钱多少的问题，这有点无缘无故被‘绑架垄断’的感觉，不该给的钱，我们一分都不给。”5月11日当天，记者在金成雅苑小区西门一侧的丰巢快递柜看到，该快递柜的显示屏显示出“收费开通丰巢会员、领红包”等字样，同时提示“超时收费”等字样。丰巢快递柜显示“收费开通丰巢会员、领红包等字样”。对于此类问题，5月11日，金成雅苑小区物业服务商金隅大成物业公司一名王姓工作人员回复记者称，“今年5月份开始，丰巢快递柜就开始收费。我们已经告知业主，如果不想付费在丰巢快递柜取件，就联系快递员来取，目前还没有其他办法。”记者在采访中了解到，北京也有一些小区物业公司对丰巢一事做出了积极反应。5月11日，北京顺义区金地悦景台小区的物业服务商——北京金地格林物业有限公司一名杨姓工作人员向记者介绍，“我们早已暂停使用丰巢快递柜，现在已经告诉所有的快递员一律将快递放置物业前台，我们将为业主免费保管。”金地悦景台小区物业已经暂停使用丰巢快递柜。（物业供图）律师：业委会经授权有权阻止快递柜入场那么，丰巢快递柜到底该如何进入小区？又该如何收费？“我们与丰巢快递柜方面签订了合同约定，丰巢快递柜方面向小区业主每年支付4700元费用，外加每年800元的电费，这属于全体业主共同收益。” 中环花苑业委会主任何先生向记者介绍，“我们双方合同中未约定可以向业主收费，并且有口头约定强调不向业主收费。”何先生进一步表示，“我们并不是直接否定丰巢快递柜存在的意义，比如，如果快递员经过业主同意，是可以将快递放进丰巢快递柜的。现在我们双方谈判的渠道始终是敞开的，但是至今丰巢快递柜方面也未理会我们。”针对此事，中环花苑的物业服务商——上海中环陆家嘴物业管理有限公司中环花苑项目负责人袁先生告诉记者，“作为物业服务商，我们尊重业主的意见，也就是尊重业委会的意见，上述问题的解决方案由业委会决定。”“这种事要尊重业主的意见，同时，也要按照合同约定执行，如果合同未约定向业主收费，那么丰巢快递柜方面的做法就不对了。”对于上述案例，北京中天房鑫物业管理有限公司经理杨先生向记者表示，“我基本认可中环花苑业委会的要求，在我们公司服务的小区中，也是始终坚持这种原则。”“按照5月1日实施的《北京市物业管理条例》第26条规定，丰巢快递柜占用小区内场地是属于业主共有的，公共收益归全体业主所有。业主大会依照法律法规决定共用部分的经营方式，管理、使用共用部分经营收益等共有资金。” 北京英淇律师事务所主任夏广域律师表示，“小区业委会在业主授权的情况下，有权与丰巢快递柜方面签订服务合同，同时也有权阻止快递柜的进场和使用。”夏广域律师进一步表示，“若小区暂未组成业委会，一般情况下，物业公司不能未经业主同意私自允许丰巢快递柜进场，对于已经使用的快递柜，物业公司应当尊重业主的意见，保护业主利益不受侵害。如果丰巢当初签订合同时确实承诺免费使用，现在又进行违约行为，物业公司有权终止履行合同。”新京报记者 张建 摄影 张建（除署名外）编辑 杨娟娟 校对 贾宁记者邮箱：792195842@qq.com	2020-05-12 08:15	中环花苑业委会微信公众号	bj	20200512200907
2020051220090751	北京：一校一案，以班级为单元闭环管理，有序复学复课	据“识政”微信公众号5月12日消息，昨天下午，北京新冠肺炎疫情防控工作领导小组召开第六十一次会议，深入贯彻习近平总书记关于疫情防控工作的一系列重要指示精神，进一步研究调度疫情防控工作。市委书记、防控工作领导小组组长蔡奇主持会议，市委副书记、市长、防控工作领导小组副组长陈吉宁出席会议。会议指出，境外疫情暴发态势仍在持续，国内有些地区疫情出现反复，外防输入、内防反弹的风险依然严峻。要时刻保持清醒头脑，不能有丝毫松懈，落实“四方责任”，坚持“三防”“四早”“九严格”，持续深入找隐患、查风险、补漏洞，更加精准有效落实好各项常态化防控措施，巩固来之不易的防控成果。会议强调，要持续做好疫情防控形势的研判和评估。科学制定佩戴口罩指引，引导市民做好个人防护，加强自我健康管理。落实各区属地责任和学校主体责任，坚持一校一案，以班级为单元实现闭环管理，有序推进复学复课。会议强调，要及时动态掌握中高风险地区变化，坚持关口前移，加强入境和中高风险地区进京人员管理。落实责任，抓好市属企业海外项目和人员防疫管理。会议强调，坚持不懈抓好社区防控。继续做好在院患者救治，争取早日康复。持续推进复工复产，酒吧、室内儿童游乐场、健身房等场所要严格落实测温、验码、限流和通风消毒等措施，加强日常巡查。做好物资保障工作，支持产业链、供应链防疫需要，帮助企业开拓市场。加强工作指导和监督检查，排查风险点和薄弱环节，抓好整改落实。加强工作对接，落实各项防疫措施，全力以赴做好全国“两会”服务保障。编辑 贾聪聪来源：识政	2020-05-12 08:02	识政	bj	20200512200907
2020051220090752	国家卫健委：昨日新增确诊病例1例，为境外输入	新京报快讯 据国家卫健委消息，5月11日0—24时，31个省(自治区、直辖市)和新疆生产建设兵团报告新增确诊病例1例，为境外输入病例(在内蒙古);无新增死亡病例;新增疑似病例1例，为境外输入疑似病例(在上海)。当日新增治愈出院病例27例，解除医学观察的密切接触者503人，重症病例增加1例。境外输入现有确诊病例80例(含重症病例3例)，现有疑似病例3例。累计确诊病例1691例，累计治愈出院病例1611例，无死亡病例。截至5月11日24时，据31个省(自治区、直辖市)和新疆生产建设兵团报告，现有确诊病例115例(其中重症病例10例)，累计治愈出院病例78171例，累计死亡病例4633例，累计报告确诊病例82919例，现有疑似病例3例。累计追踪到密切接触者737599人，尚在医学观察的密切接触者5470人。31个省(自治区、直辖市)和新疆生产建设兵团报告新增无症状感染者15例(无境外输入);当日无转为确诊病例;当日解除医学观察35例(境外输入6例);尚在医学观察无症状感染者760例(境外输入38例)。累计收到港澳台地区通报确诊病例1532例。其中，香港特别行政区1047例(出院985例，死亡4例)，澳门特别行政区45例(出院42例)，台湾地区440例(出院368例，死亡7例)。编辑 刘佳妮来源：国家卫健委	2020-05-12 08:02	国家卫健委	bj	20200512200907
2020051220090753	特朗普要求所有白宫人员佩戴口罩	据央视新闻客户端消息，美国总统特朗普5月11日在白宫记者会上表示，要求白宫人员戴口罩，而据现场记者观察，特朗普似乎是现场唯一未戴口罩的人，但他与其他人之间至少保持了六英尺（约1.8米）的距离。当天早些时候，白宫要求所有在白宫西翼办公区的工作人员佩戴口罩，要求办公人员严格保持社交距离，遵守访客限制。上周，先是特朗普的一名贴身侍从新冠病毒检测呈阳性，随后副总统彭斯的新闻秘书凯蒂·米勒确诊，白宫随即升级了防疫措施。白宫副发言人贾德·迪尔表示医生将采取一切预防措施确保总统、第一家庭及整个白宫的健康安全。特朗普11日还证实，副总统彭斯当天的病毒检测结果为阴性，且是连续两天为阴性。但彭斯并未出席该记者会。编辑 林玮琪来源：央视新闻客户端原标题：特朗普要求所有白宫人员佩戴口罩	2020-05-12 07:12	央视新闻客户端原标题	bj	20200512200907
2020051220090754	美国得克萨斯州沃斯堡发生枪击事件 造成5人受伤	据央视新闻客户端援引美国媒体当地时间5月11日报道，周日（10日）晚间6时30分左右，得州沃斯堡（Fort Worth）的乡村小溪公园（Village Creek Park）发生枪击事件，共造成5人受伤，其中2人伤势严重。据目击者描述，该公园当时大约有600人聚会，准备观看烟花表演，傍晚6时30分左右，公园突然传来至少30声枪响，警方随后赶到现场并试图驱散聚集的民众。当地警方在10日晚间的新闻发布会上透露，此次枪击事件共造成5人受伤，其中3人暂无生命危险，另外2人伤势严重。目前关于此次枪击案的具体原因正在进一步调查之中。编辑 林玮琪来源：央视新闻客户端原标题：美国得克萨斯州沃斯堡发生枪击事件 造成5人受伤	2020-05-12 07:09	央视新闻客户端原标题	bj	20200512200907
2020051220090755	世卫组织发布重新开放学校及工作场所指南	据央视新闻客户端消息，当地时间5月11日，世卫组织召开新冠肺炎例行发布会，世卫组织总干事谭德塞表示，已发布重新开放学校及工作场所的指南。决策者在决定儿童是否重返学校以及如何重新开放学校时，应考虑三个因素。首先需要对病毒在儿童中传播程度及严重性有清晰了解，其次要考虑学校所在位置的新冠肺炎流行情况，最后校园要有保持新冠肺炎预防和控制措施的能力。对于重新开放工作场所，谭德塞建议所有工作场所开展风险评估，并采取预防病毒传播的措施。此外，工作场所应制定预防和缓解疫情的行动计划，并将其作为总体业务计划的一部分，并包含在重新开放、关闭和改造工作场所中所采取的保护健康及安全的保障措施。编辑 林玮琪来源：央视新闻客户端原标题：世卫组织发布重新开放学校及工作场所指南	2020-05-12 07:07	央视新闻客户端原标题	bj	20200512200907
2020051220090756	阿联酋从6月起每天额外减产10万桶石油	据央视新闻客户端消息，当地时间5月11日，阿联酋能源部长马兹鲁伊表示，阿联酋将在6月份比其在欧佩克+协定下的承诺每天减少10万桶的石油产量，从而与沙特阿拉伯和科威特一起进行额外减产。马兹鲁伊在一份声明中说：“为支持沙特王国进一步恢复能源市场稳定所作的努力，阿联酋已承诺在6月份每天自愿减产10万桶。”为了支撑油价，OPEC+上个月达成了创纪录的减产协议：将自2020年5月1日起减产970万桶/日；自2020年7月1日至12月减产770万桶/日；自2021年1月至2022年4月减产580万桶/日。沙特在5月11日宣布，从6月起，每天额外减产100万桶。编辑 林玮琪来源：央视新闻客户端原标题：阿联酋从6月起每天额外减产10万桶石油	2020-05-12 07:05	央视新闻客户端原标题	bj	20200512200907
2020051220090757	英国一名高级外交官失踪 警方急寻下落	据央视新闻客户端消息，当地时间11日傍晚（北京时间12日凌晨），英国西南部汉普郡警方发出紧急通知，搜寻一名英国高级外交官的下落。这名英国外交官名为理查德·莫里斯，现年52岁，面部长有明显胎记。5月6日晚10时30分，莫里斯离开位于汉普郡本特利的家外出跑步后就下落不明。英国外交部原定于7月将他作为高级外交专员派往斐济。此前，他曾担任英国驻尼泊尔大使。警方已经呼吁在他家住所附近的其他建筑单位提供外部监控录像以寻找线索。编辑 林玮琪来源：央视新闻客户端原标题：英国一名高级外交官失踪 警方急寻下落	2020-05-12 07:03	央视新闻客户端原标题	bj	20200512200907
2020051220090758	世卫组织：大部分感染新冠肺炎的儿童症状轻微	据央视新闻客户端消息，当地时间11日，世卫组织召开新冠肺炎例行发布会，世卫组织卫生紧急项目技术主管玛丽亚·范·科霍夫表示，部分研究显示新冠肺炎在儿童中的发病率较低，主要由成人向儿童传播，儿童向成人传播的情况要少得多，大部分感染新冠肺炎的儿童症状轻微，少部分较为严重甚至也有死亡病例。编辑 林玮琪来源：央视新闻客户端原标题：世卫组织：大部分感染新冠肺炎的儿童症状轻微	2020-05-12 07:01	央视新闻客户端原标题	bj	20200512200907
2020051220090759	北京今天北转南风二三间四级 最高气温28℃	新京报快讯 据北京市气象局官方微博消息，北京市气象台12日6时发布：今天白天晴，北转南风二三间四级，最高气温28℃；夜间晴，南转北风一二级，最低气温12℃。气温升高，午后较热，早晚略凉，请注意及时调整着装。空气干燥，紫外线强，宜多食蔬果勤补水，出行注意遮阳防晒。编辑 林玮琪来源：北京市气象局官方微博	2020-05-12 06:59	北京市气象局官方微博	bj	20200512200907
2020051220090760	法国宪法委员会批准延长卫生紧急状态法案	据央视新闻客户端消息，法国宪法委员会11日批准延长卫生紧急状态法案，但是取缔了与“隔离”及“追踪”接触者有关的部分内容。根据该法案，法国卫生紧急状态将延长至7月10日。宪法委员会对该法案中两项条例进行了部分取缔，以限制可以访问个人医疗数据的人员数目，并且允许自由与羁押法官在“患者每天超过12个小时不能离开隔离地点”的情况下可以进行审查。法国宪法委员会有权对各项经过议会通过的法案进行审查，以确认它们是否符合法国宪法原则。法国议会于5月9日通过政府提交的延长卫生紧急状态法案。编辑 林玮琪来源：央视新闻客户端原标题：法国宪法委员会批准延长卫生紧急状态法案	2020-05-12 06:59	央视新闻客户端原标题	bj	20200512200907
2020051220090761	因科技股恢复上涨 美国纳斯达克指数连续六日攀升	据央视新闻客户端消息，当地时间5月11日，美国纳斯达克综合指数因主要科技公司股价恢复上涨，连续第六个交易日攀升。大型科技股的强势表现也使标准普尔500指数从早些时候的跌盘中恢复。科技股为主的纳斯达克当天上涨0.8%，连续第六个交易日上涨，这是自去年12月以来最长的连续上涨纪录。当天早些时候，科技股重仓指数曾平均下跌0.8%。今年以来，纳斯达克指数上涨约3%，比2月份创下的纪录低约6%。标准普尔500指数在开盘下跌0.9%后收回跌幅上涨0.01%。道琼斯工业平均指数在下跌109.33点，收报24221.99点，跌幅0.45%。科技股中，脸书（Facebook）上涨0.9%，而亚马逊、苹果、奈飞和Alphabet均上涨1%以上。微软上涨1%，英特尔攀升1.6%。分析师认为，新冠肺炎疫情加强了科技对企业和消费者的重要作用，并激起了人们对于经济衰退可能会让许多最大的成长型公司变得更加占优势的期待，所以科技股近期普涨。然而，投资者对经济过早重启仍心存疑虑，在韩国警告称发生新的群聚感染后，大盘的上涨势头被消失。新加坡和日本也确认了新的病例。世界卫生组织表示，放宽封锁措施的国家出现新冠病毒感染病例上升。有分析师悲观认为，市场将继续取决于新冠肺炎疫情。“如果我们找不到更好的大规模测试方法……市场的日子会更加艰难。”美国财经媒体引用分析师的话称。美国市场主要平均指数在三周内首次出现单周上涨，标普500指数上周上涨3.5%。即便上周五（8日），投资者们录得有记录以来最大的月失业率。标普500指数自3月23日触及低点以来，已经上涨超过33%。这一涨幅主要由脸书、亚马逊、苹果、奈飞、谷歌母公司Alphabet和微软等超大型科技股领涨。这些股价自3月下旬以来均已飙升超过20%。芯片制造商Nvidia11日创下历史新高，使其2020年的涨幅达到37%以上。编辑 林玮琪来源：央视新闻客户端原标题：因科技股恢复上涨 美国纳斯达克指数连续六日攀升	2020-05-12 06:59	央视新闻客户端原标题	bj	20200512200907
2020051220090762	因科技股恢复上涨 美国纳斯达克指数连续六日攀升	据央视新闻客户端消息，当地时间5月11日，美国纳斯达克综合指数因主要科技公司股价恢复上涨，连续第六个交易日攀升。大型科技股的强势表现也使标准普尔500指数从早些时候的跌盘中恢复。科技股为主的纳斯达克当天上涨0.8%，连续第六个交易日上涨，这是自去年12月以来最长的连续上涨纪录。当天早些时候，科技股重仓指数曾平均下跌0.8%。今年以来，纳斯达克指数上涨约3%，比2月份创下的纪录低约6%。标准普尔500指数在开盘下跌0.9%后收回跌幅上涨0.01%。道琼斯工业平均指数在下跌109.33点，收报24221.99点，跌幅0.45%。科技股中，脸书（Facebook）上涨0.9%，而亚马逊、苹果、奈飞和Alphabet均上涨1%以上。微软上涨1%，英特尔攀升1.6%。分析师认为，新冠肺炎疫情加强了科技对企业和消费者的重要作用，并激起了人们对于经济衰退可能会让许多最大的成长型公司变得更加占优势的期待，所以科技股近期普涨。然而，投资者对经济过早重启仍心存疑虑，在韩国警告称发生新的群聚感染后，大盘的上涨势头被消失。新加坡和日本也确认了新的病例。世界卫生组织表示，放宽封锁措施的国家出现新冠病毒感染病例上升。有分析师悲观认为，市场将继续取决于新冠肺炎疫情。“如果我们找不到更好的大规模测试方法……市场的日子会更加艰难。”美国财经媒体引用分析师的话称。美国市场主要平均指数在三周内首次出现单周上涨，标普500指数上周上涨3.5%。即便上周五（8日），投资者们录得有记录以来最大的月失业率。标普500指数自3月23日触及低点以来，已经上涨超过33%。这一涨幅主要由脸书、亚马逊、苹果、奈飞、谷歌母公司Alphabet和微软等超大型科技股领涨。这些股价自3月下旬以来均已飙升超过20%。芯片制造商Nvidia11日创下历史新高，使其2020年的涨幅达到37%以上。编辑 林玮琪来源：央视新闻客户端原标题：因科技股恢复上涨 美国纳斯达克指数连续六日攀升	2020-05-12 06:59	央视新闻客户端原标题	bj	20200512200907
2020051220090763	联合国马里维和部队遇袭 造成3死4伤	据央视新闻客户端消息，联合国马里多层面综合稳定特派团于当地时间5月11日发布消息称，两支维和部队于当地时间10日在马里北部战区基达尔的阿盖洛克（Aguelhok）执行任务时，分别遭遇路边简易爆炸物袭击，造成共计3名乍得维和士兵死亡，4人受伤。联马团团长、联合国秘书长马里问题特别代表安纳迪夫谴责此次袭击行为，表示应查明和逮捕犯下这些恐怖主义行为的人。联合国秘书长古特雷斯也强烈谴责此次袭击，并向遇难者家属以及乍得政府和人民表示深切哀悼。古特雷斯表示，这种怯懦的恐袭行为不会阻止联合国继续支持马里人民和政府追求和平与稳定的决心。联合国马里多层面综合稳定特派团成立于2013年，目前在马里各地部署了约13000名维和官兵，近年来安全形势不断恶化，被称为联合国最危险的维和任务区。编辑 林玮琪来源：央视新闻客户端原标题：联合国马里维和部队遇袭 造成3死4伤	2020-05-12 06:59	央视新闻客户端原标题	bj	20200512200907
