id	title	txt	datetime	source	web	batch
202005291325221	无房无就业单位也能落户！两座省会城市齐放大招，门槛“史上最低”！近百城已在行动	5月28日，济南市委市政府召开新闻发布会，发布解读《济南市公安局贯彻落实<济南市委办公厅济南市政府办公厅关于深化户籍制度改革加快人才集聚的若干措施>全面放开落户限制实施细则》。按照《实施细则》，6月1日起，济南市按新户口迁移政策办理户口迁移业务。此次出台的放开落户限制政策及配套《实施细则》，全面取消了落户城镇条件限制，实行有意愿在济南从业、居住生活的居民分类登记备案政策。据济南市公安局人口管理支队副支队长马洪山介绍，全面放开落户限制一个主要目的就是，在2019年全面放开人才落户条件的基础上，进一步深化解决农村学生升学和参军进入城镇、在城镇就业居住和举家迁徙、农业转移人口以及新生代农民工等重点群体迁济落户问题，以最优服务、最大诚意为有意愿来济从业、居住生活人员提供多途径落户通道，同时对应拓展了落户地址选择，让户改新政普惠广大来济居民群众。据中国证券报，诸葛找房分析师王小嫱表示，济南作为山东省的省会城市，GDP位居青岛之后，本次全面放开落户的主要目的在于为省会经济和城市高质量的发展创造积极条件，不仅吸引外省人口流入，也吸引省内人群的流入，增强城市的活力。王小嫱指出，济南本次落户的条件极低，中专以上学历，租房人群均可落户。短期对房地产市场的影响不大，但落户的放开带来了一部分潜在购房需求，长期看会加强当地房地产市场的活跃度。截至2020年4月，济南的新房可售面积为1091.52万㎡，出清周期为25.8个月，库存处在相对较高的局面。在落户全面放开下，济南商品房库存的去化压力有望减小。济南历下区某房产中介人士表示，在此次之前，具有本科学历的人才通过租房落户比较常见。这些人通过租赁合同以及半年的社保证明，可以到所在街道进行落户。6月1日起，学历和社保限制都没有了。上述销售人员称，根据此前的落户政策，济南历下区、市中区通过租房落户的人数相对较多。一方面，这两个区具有最好的教育资源和医疗养老资源。另一方面，产业聚集较多。2017年是济南地区房价的高点，最近几年，历下区、市中区价格一路走低，老小区目前成交均价在2万元/平方米，相比2017年低了5000元/平方米左右。最高的次新小区均价在4万元/平方米，价格也出现了不同程度的走低。按照《细则》规定，6月1日起，济南市将按照新户口迁移政策办理户口迁移业务，通过人才途径、院校学生途径、居住途径、就业途径、投靠途径、其他情形六大途径全面放开落户。其中，居住途径规定，在城镇拥有合法产权房屋人员，或近亲属拥有合法产权房屋（限申请人在本市无合法产权房屋，且该房屋上无户口）供其居住的人员，在产权房屋处落户。有使用权住房的，参照本款执行。租赁居住经住建部门登记备案住房的人员（限申请人在本市无合法产权房屋），在租赁住房处或租赁住房地的社区集体户落户。对申请人在本市无合法产权房屋的，租住经住建部门登记备案的住房可按租赁住房落户（平阴县、商河县仍按原政策执行），需提供租赁登记备案证明，可在租赁住房处或租赁住房地的社区集体户落户。图/图虫取消参保、居住年限、就业年限等落户条件限制，或许已不足称之为“最低”落户门槛。近日，南宁市也发布了落户新规。2020年6月1日起，《南宁市深化户籍制度改革户口迁移实施办法》（下称《办法》）将正式施行，南宁市全面放开城镇落户条件，以具有合法稳定住所（含租赁）或合法稳定就业为户口迁移的基本条件。值得注意的是，本次南宁“落户新政”将对新落户城镇的农村籍大学生实行“来去自由”的落户政策，同时允许相关申报资料“容缺”办理，落户门槛堪称“史上最低”。据南宁市公安局相关负责人介绍，此次户籍管理制度改革是南宁市有史以来最低落户门槛。以具有合法稳定住所（含租赁）或合法稳定就业为户口迁移的基本条件，同时全面放宽在本市具有合法稳定住所（含租赁）或合法稳定就业人员的落户准入条件，亦将放宽引进的各类人才的入户条件。允许农村籍大学生“来去自由”是此次《办法》的最大亮点，无论是已毕业、新入学还是应届生，都可以享受自愿原则，随时申请将户口迁回原籍农村。具体来说，符合以下三种情形之一的农村籍大学生都可以申请将户口迁回原籍：一是已毕业的农村籍大学生在2019年12月1日（含当日）之后将户口从农村迁往城镇落户的，以自愿为原则，落户后可随时申请将户口迁回原籍农村。二是2019年12月1日（含当日）之后新入学就读全日制高校的农村籍大学生，因入学将户口从农村迁往城镇落户的，毕业后以自愿为原则可申请将户口迁回原籍农村。三是2019年12月1日之前入学就读全日制高校的农村籍应届大中专毕业生，毕业后未落实工作单位，户口仍保留在学校所在地派出所的，可申请迁回原籍农村落户。图/新华社此外，为方便外来人员落户，南宁市将设立集体户为有意在本市城镇落户的无就业单位人员、无自主产权住房者提供落户便利。一是经辖区公安派出所核准，符合条件的机关、团体、企业、事业等单位可以设立单位集体户。二是各派出所按需在市区、城镇的社区居委会办公地址其他适当的实体地址上设立“社区集体户”。在南宁有合法稳定就业人员或具有大、中专及以上学历、职业资格证书的各类人才，在南宁没有合法稳定住所落户的，可申请在单位集体户或社区集体户落户。另一方面，实行“容缺”办理制度也体现出落户的门槛之低。据悉，所谓“容缺”办理制度，是指申办人在申报材料不齐备的情况下，公安派出所通过各部门信息共享能查询到相关信息的，就可“容缺”相关申报材料。例如，申办人本人到派出所户籍窗口现场确认并拍摄人像，经派出所核对部、省级人口信息库的人像信息确认为申办人本人的，可“容缺”居民身份证；通过部、省级人口信息库或派出所户籍档案查询有相关人员关系信息的，即可“容缺”人员关系证明。值得一提的是，根据《办法》，南宁市将为集体户内居民签发居民户口簿，单位集体户和社区集体户户内居民均可申请单独打印含本人户籍信息的居民户口簿。中原地产首席分析师张大伟分析认为，多滴密集发布人才政策，主要是为了城市发展，吸引劳动力。2020年来，人才政策井喷，年内累计接近100座城市发布了力度不同的人才政策。张大伟强调，对于地方需要的人才，不应该简单地推入房地产市场，人才更多应该与产业政策挂钩，对于人才的居住也更应该以保障类型住房为主。人才不应该是购房者，城市应该为人才提供居住条件。（来源：21世纪经济报道（记者：刘美琳）、中国证券报、广西日报、南宁晚报）	2020-05-29 13:00	21世纪经济报道	nf	20200529132522
202005291325222	记者手记 | 直播翡翠像“卖菜”？我看见一个传统行当的那么多纠结	2019年3月9日，在瑞丽翡翠交易市场，商人用直播平台推销翡翠。 （新华社记者 秦晴/图）（相关文章《“疯狂的石头”——不眠不休的翡翠直播间》首发于2020年5月21日《南方周末》）第一次注意到翡翠直播，是一个失眠的凌晨。打开淘宝想买点什么，却看到首页的置顶推送了一家翡翠直播。点进去，直播间环境昏暗，一个外形普通的年轻男子坐在桌前，与旁人交谈。他在卖什么，我已记不清，只记得言语中不乏“卧槽”等言辞。这是我对翡翠直播的第一印象。后来做相关报道，我才知道直播卖翡翠早已不是新闻。它始于2016年的中国云南边境，随后两年迅速风靡翡翠市场。过去，传统的珠宝实体店很少打广告，基本上每个城市都会有一两个珠宝交易市场，珠宝	2020-05-29 12:05	南方周末记者 敬奕步	nf	20200529132522
202005291325223	修改传染病防治法——“划定疫区是应对的逻辑起点”	SARS疫情之后，传染病防治法在2004年迎来大修。新冠肺炎疫情稳定之后，传染病防治法修改再次被提出。 （视觉中国/图）2020年5月26日，全国人大代表、山东眼科研究所所长史伟云就传染病防治法的修改，提出自己的看法。现行传染病防治法规定，当发现甲类传染病时方可采取“强制隔离治疗”等措施，但是对于诸如“封城”“封闭小区”等非常规性手段并没有明确规定。史伟云认为，这使得各级政府在操作时没有明确的法律依据，将面临巨大的压力。他建议在疫情已经取得战略性胜利的阶段，要加快推动传染病防治法的修订与完善。早在“两会”召开之前，4月26日，全国人大常委会法工委向常委会提交的报告指出，“认真评估传染病防治法等法律的修改完善”。5月21日，十三届全国人大三次会议发言人张业遂也表示，全国人大将有针对性地修改完善。会议召开期间，包括传染病防治法在内的相关法律法规的修订成了热门话题。传染病防治法因疫情而生，后来也因疫情而修。1988年，上海暴发甲肝疫情，30万人被感染。次年，《中华人民共和国传染病防治法》出台。SARS疫情之后，传染病防治法在2004年迎来大修。此后每逢甲型流感、禽流感等疫情出现，法学界和医疗界都会响起修法呼声。2013年的《国务院关于传染病防治工作和传染病防治法实施情况的报告》显示：近10年来中国几乎每一两年就有1种新发传染病出现。由于新发传染病不在法定传染病之列，从发现、调查到纳入法定传染病存在时差，往往会导致	2020-05-29 11:09	南方周末记者 李玉楼  南方周末特约撰稿 周缦卿	nf	20200529132522
202005291325224	强制报告！九类未成年人遭不法侵害情形须立即报案	记者今天从最高人民检察院了解到，最高检等9部门共同建立侵害未成年人案件强制报告制度，规定9类未成年人遭受不法侵害情形，有关单位和个人须立即报案。据最高检第九检察厅厅长史卫忠介绍，近年来，侵害未成年人犯罪持续上升，案件预防难、发现难、取证难的问题亟待破解。2017年至2019年，检察机关起诉侵害未成年人犯罪分别为4.76万人、5.07万人、6.29万人，后两年同比分别增长6.8%、24.2%。司法办案发现，案件发现不及时，严重影响了打击犯罪和救助未成年人的效率、效果。有些案件后来即使被发现，由于时过境迁，给侦查取证、打击犯罪带来很大困难，有的甚至因为证据灭失，让犯罪分子得以逃避应有惩罚。事实上，我国未成年人保护法等多部法律对发现侵害未成年人犯罪报案举报都作出了相应规定，但因过于原则等原因，在落实中出现了一些问题。2018年4月，浙江省杭州市萧山区检察院率先在全国建立侵害未成年人犯罪案件强制报告制度，要求有关部门和人员发现未成年人遭受侵害时，应当立即报案。此后，浙江、江苏、广东、江西等省一些地方也都建立了相关制度。实践证明，强制报告制度是行之有效的惩防措施，浙江杭州自建立侵害未成年人案件强制报告制度以来，已通过相关部门报告案件线索发现、办理侵害未成年人权益刑事案件33件。2019年，湖北省检察院联合教育、公安等部门出台省级层面的侵害未成年人案件强制报告制度，不久就根据相关人员报告的案件线索，破获一起性侵多名未成年人的严重犯罪案件。此次，最高人民检察院与国家监委、教育部、公安部、民政部、司法部、国家卫健委、共青团中央、全国妇联会签下发了《关于建立侵害未成年人案件强制报告制度的意见（试行）》（下称《意见》），旨在进一步完善机制，确保及时干预、严厉惩治、有效预防侵害未成年人犯罪。《意见》明确，国家机关、法律法规授权行使公权力的各类组织及法律规定的公职人员，以及密切接触未成年人的教育、医疗、儿童福利机构、救助机构等各类组织及其从业人员对侵害未成年人案件有报告的义务。这些组织和人员在工作中发现未成年人遭受或者疑似遭受不法侵害以及面临不法侵害危险的，应当立即向公安机关报案或举报，推动及时发现、处置侵害未成年人犯罪。《意见》根据实践中侵害未成年人案件多发类型及常见特征，规定了性侵、虐待、欺凌、遗弃、拐卖等九类应当报告的情形，并规定发现“疑似”情形的也要报告。公安机关接到报案或举报后，应当立即接受，问明案件初步情况，对涉嫌违反治安管理的依法受案审查，涉嫌犯罪的依法立案侦查，并在受案或者立案后三日内向报案单位反馈案件进展，在移送审查起诉前告知报案单位。检察机关应当切实加强对侵害未成年人案件的立案监督。《意见》规定，公安机关、检察机关发现未成年人需要保护救助的，应当委托或者联合民政部门或共青团、妇联等提供救助；发现未成年人父母或者其他监护人不依法履行监护职责，或者侵害未成年人合法权益的，应当予以训诫或者责令其接受家庭教育指导，情节严重的依法依规予以惩处；发现未成年人遭受家庭暴力或面临家庭暴力的现实危险，可以依法代未成年人向法院申请人身安全保护令。《意见》明确了检察机关依法对强制报告制度的执行情况进行法律监督，对于工作中发现相关单位执行、监管不力的，可以通过发出检察建议书等方式进行监督纠正。对公职人员长期不重视强制报告工作，不按规定落实强制报告制度要求的，监察委员会依法进行问责，对涉嫌职务违法犯罪的依法调查处理。史卫忠表示，与未成年人密切接触行业点多线长，需要有关主管部门切实履行管理、督导职责。在落实制度的过程中，要同步做好涉案未成年人的保护和救助工作，切实保障他们的隐私，避免二次伤害，并第一时间提供有针对性的救助，最大限度减轻不法侵害的影响。（来源：人民日报客户端）	2020-05-29 10:35	彭波	nf	20200529132522
202005291325225	政务服务自助终端进村，是雪中送炭	对城市居民来说，政务服务自助终端机并不陌生。村里有了政务服务自助终端，对留守老人来说，很多业务就不需要再跑去城里，足不出村就可以办理了，大大节省了时间。 （ICphoto/图）山东新泰市近日在部分农村设置了政务服务自助终端机，农民足不出村就可以办理社保医保查询等六十多项业务，甚至林木采伐许可证也可在自助终端上申请，审批通过后由邮政快递送上门。政务服务自助终端进村，能够让农民也享受到电子政务的便捷服务，弥补信息鸿沟导致的城乡政务服务差距，值得推广。对城市居民来说，政务服务自助终端机并不陌生。早在多年前，一些城市的政府部门就开始在政务服务大厅设置了自助服务终端，居民刷身份证就可以办理一些查询打印类的业务。比如，早在2014年，广州市人	2020-05-29 10:00	辛省志	nf	20200529132522
202005291325226	新一轮“西部淘金”：从大开发到大开放	成都IFS广场上，一个移动机器人在广场上巡逻。指导意见鼓励重庆、成都、西安等加快建设国际门户枢纽城市。 （IC photo/图）时隔14个月，2019年3月19日在中央全面深化改革委员会第七次会议上审议通过的《关于新时代推进西部大开发形成新格局的指导意见》（以下简称《指导意见》），终于在2020年5月17日由国务院正式对外公布。《指导意见》发布之后，5月22日的政府工作报告再次提出促进西部地区开放发展的系列举措。围绕进一步促进西部地区高质量发展，两会代表委员积极建言献策。广西、青海、陕西、四川、甘肃、宁夏、内蒙古、重庆等西部八省份政协主席，联名向全国政协十三届三次会议提交提案，建议“十四五”加强巩固西部地区脱贫攻坚成果，对西部地区脱贫攻坚后续政策给予支持。西部地区地广人稀，目前占中国领土面积的71%，人口的27%，GDP的20%。以改革开放为界，中国东部沿海地区先富，打破了过去的均衡发展，与西部地区逐渐拉开差距，中国经济呈东、中、西梯度发展局面。针对东西部地区发展失衡，过去20年，中央政府对这片土地持续予以货币财政、对外开放、科技教育以及产业政策的倾斜，但“西部地区经济结构不合理、内生增长动力不足的问题仍然存在”（引自西部大开发“十三五规划”）。西部大开发也不仅是发展经济，西部地区同时关涉中国的边界安全、生态安全、能源安全、民族团结。面对国内外形势的发展变化，西部地区的定位也在不断调整。“虽然字面上仍用了‘西部大开发’，但其内涵不一样。”浙江大学中国西部发展研究院常务副院长董雪兵对南方周末记者说，第一个十年，西部大开发着重于西部地区基础设施建设和生态保护；第二个十年，注重西部地区的内生发展动力，包括开放和进一步的基础设施建设、产业发展；未来十五年，则是大保护、大开放、高质量发展。浙江大学中国西部发展研究院，成立于2006年，由国家发展和改革委员会与浙江大学共建，多年一直致力于西部大开发的研究。董雪兵参与了2010年和2020年两份西部大开发政策的前期研究和起草，以及西部大开发“十二五”规划、“十三五”规划的编制。西南财经大学中国西部经济研究中心主任毛中根亦向南方周末记者表示，“如果说前面20年是西部开发的1.0版本，现在则进入了2.0版本”。1980年代，学术界对中国经济提出“三分法”，即东、中、西三部分。东部有10省市，依次是北京、天津、河北、上海、江苏、浙江、福建、山东、广东和海南；西部则有12个省份，分别为内蒙古、广西、重庆、四川、贵州、云南、西藏、陕西、甘肃、青海、宁夏和新疆。新中国成	2020-05-29 09:00	南方周末记者 黄金萍	nf	20200529132522
