id	title	txt	datetime	source	web	batch
2020052913252211	社会把脉 | 一方婚前病史，另一方应有知情权	近日，国家卫健委、民政部等多部门联合印发《关于加强婚前保健工作的通知》，指导各地全面加强婚前保健和出生缺陷防治工作。婚前检查再次进入公众视野。 （ICphoto/图）近日，国家卫健委、民政部等多部门联合印发《关于加强婚前保健工作的通知》，指导各地全面加强婚前保健和出生缺陷防治工作。婚前检查再次进入公众视野。2003年10月，新《婚姻登记条例》正式实施。根据该条例，婚检不再作为结婚登记的前提条件，宣告了中国婚检制度从强制走向自愿。但是，这一变化始终存在法律冲突。因为，另一部涉及婚育的法律母婴保健法自1994年10月27日通过伊始，至2017年11月4日修改，始终保留了第十二条：“男女双方在结婚登记时，应当持有婚前医学检查证明或者医学鉴定证明”。该条的表述显然对婚检有强制性的要求。	2020-05-28 19:00	关不羽	nf	20200529132522
2020052913252212	后疫情时期的全国两会细节：做核酸检测，开短会，线上交流	2020年5月25日，十三届全国人大三次会议在北京人民大会堂举行第二次全体会议。 （视觉中国/图）2020年5月22日，近三千名全国人大代表和两千多名全国政协委员，从各地汇聚北京人民大会堂。受新冠肺炎疫情影响，2020年全国两会延迟了两月有余召开。后疫情时期的全国两会，相较以往有着诸多变化，最大的变化是会期缩短至7天，没有休息日。外界最关注的其中一项是会务防疫措施。除了发言时脸上也仍然戴着的淡蓝色口罩，抵京之前，抵京之后，代表委员们也都做了核酸检测。会期压缩，议程更加紧凑，有的会议甚至安排在晚间。视频采访、视频旁听，交流沟通的形式从线下转移到了线上。5月22日，上午9时，第十三届全国人民代表大会第三次会议开幕，国务院总理李克强作政府工作报告。代表委员们手中的政府工作报告，厚度明显比往年薄了些。从篇幅看，今年的报告仅10500多字，比去年压缩近一半，这也是改革开放以来，篇幅最短的国务院政府工作报告。2020年是李克强作政府工作报告的第7年。此前6年的政府工作报告，字数分别约为1.7万字、1.8万字、2万字、1.9万字、2万字、2万字。而此前一天，全国政协主席汪洋所作的全国政协工作报告，全文也仅六千五百多字，比往年精简近三分之一。一名全国政协委员向南方周末记者透露，实际上，委员们手头上还拿着一份简版的全国政协工作报告。“汪洋作的是简版（报告），语速感觉比往年快了一些。”前述政协委员说。“受新冠肺炎疫情影响，国内外形势发生重大变化。我们最近一段时间对《政府工作报告》进行了较大调整和修改。”5月22日当天举行的国务院新闻办吹风会上，《政府工作报告》起草组负责人、国务院研究室主任黄守宏说，《政府工作报告》在不断修改，特别是最近一段时间，几乎每天都在改。从起草时间来看，这份报告经历了长达半年的起草和反复修改——自2019年底启动，直到今年全国两会前夕完成	2020-05-28 16:08	南方周末记者 贺佳雯 南方周末实习生 彭思聪	nf	20200529132522
2020052913252213	十三届全国人大三次会议表决通过《中华人民共和国民法典》	十三届全国人大三次会议5月28日下午3时举行闭幕会，表决各项决议草案、法律草案和决定草案。会议表决通过了《中华人民共和国民法典》。	2020-05-28 15:12	央视新闻客户端	nf	20200529132522
2020052913252214	司法公正 人人受益	日前，新任司法部长唐一军首次对外接受采访，透露司法部2020年的工作部署。他表示要着眼于健全社会公平正义法治保障制度，加强刑事执行和法律事务管理，严格规范“有权人”“有钱人”减刑、假释和暂予监外执行工作。与此相呼应，2020年最高法工作报告提及了孙小果案，称将其“坚决判处并执行死刑，让正义最终得以实现”。监狱是“国家的刑罚执行机关”，由司法部主管。“有权人”“有钱人”犯罪了，照样被判刑、被收监，本是司法公正的体现；但这	2020-05-28 15:00	南方周末评论员	nf	20200529132522
2020052913252215	突发事件应对法13年来首修公私边界，如何合理划定？	“两会”召开期间，全国政协委员王煜建议，进一步完善突发事件应对法，将民营企业纳入国家突发事件应对体系。 （新京报网截图/图）“大概会是一个中等幅度的修改，涉及的问题比较多，但每个问题到底怎么改，目前还没到有定论的时候。”2020年4月28日，中国政法大学教授林鸿潮这样向南方周末介绍突发事件应对法的修改工作，他的另一身份是政法大学应急管理法律与政策研究基地主任，此次被应急管理部聘为突发事件应对法修法专家组成员。新冠疫情暴露了现有法律存在的不足和短板。4月26日，全国人大常委会法工委主任沈春耀作了关于强化公共卫生法治保障立法修法工作有关情况报告。这是全国人大常委会首次制定专项立法修法工作计划，第一部分17件拟在2020—2021年制定修改，其中就包括《中华人民共和国突发事件应对法》。突发事件应对法于2007年通过并于当年施行，这是13年来首次修改。全国“两会”期间，不少代表、委员都建议加快修改这部法律，并提出了具体建议。对个人权利的保障问题，被代表、委员以及专家学者们频频提及。疫情期间，部分地区出现了公民信息被泄露、出行受阻等情形。林鸿潮建议，修法时要在公私权利当中重新划定一个跟平时不同，但是又比较合理的边界。中国出台应急法规，与SARS息息相关。2003年那场造成中国内地349人死亡的疫情，初期信息不畅、协调不灵，这些情形表明，一事一办或者临机处置的方式已经不能适应应急需要。在此之前，中国只有1989年制定的传染病防治法和传染病防治法实施办法、全国救灾防病预案等行政法规和规章。为应对SARS，2003年5月12日，国务院公布了《突发公共卫生事件应急条例》。疫情结束后，应急机制的建立被提上了日程。据《中国减灾》杂志记载，2003年11月10日晚，时任国务院应急管理专家组组长闪淳昌被国务委员华建敏叫到办公室，交谈了一个多小时，提到不仅要“在公共卫生领域建立应急机制，还必须在全社会各个领域建立健全应急机制”。不久，国务院办公厅成立了“应急预案工作小组”，闪淳	2020-05-28 14:00	南方周末特约撰稿 王书至	nf	20200529132522
2020052913252216	悠悠古渡，英雄迟暮吴佩孚的最后一战	三月末的一个晴日，我从湖北老河口出发，沿汉水西岸南下，前往谷城县庙滩镇探访千年古渡。暮春三月，鄂北门户老河口盛开着油菜花。 （王在田/图）汉水发源于秦岭西段，向东横贯秦岭南坡后进入湖北，至丹江口为其上游，该河段落差大、流速急而流量小，不利航运；由丹江口至钟祥为其中游，又称襄江，落差缩小，流速略降，流量显著增长，历史上行船仍有一定风险，尤其是从老河口至襄阳段，河道较窄，流速甚快，不易行船。好在汉水上中游含沙量大，出秦岭后在中游迅速沉积下来，形成大片沙洲，故而在谷城县造就了两处著名的渡口，一处是县城赖以兴起的仙人渡，福银高速便在此跨过汉水，而另一处就是庙滩/太平店渡口。襄江河道在庙滩镇东北侧骤然开阔，流速放缓，遂积沙为洲。有些沙洲已与江岸融合，成为良田，“李家洲”、“蒋家洲”、“汪家洲”这样的地名说明了其身世。另一些沙洲仍悬于江中，但与江岸或其他沙洲仅隔一衣带水，这些沙洲之间的河道分流了襄江干流，便于渡船连接襄江两岸。上游丹江口水库建成后，汉水从秦岭裹挟而下的大量泥沙遭到拦阻，襄江积沙成洲的速度显著下降；但随着南水北调工程将丹江口水库的汉江、丹江水引向华北，襄江的上游来水锐减，致使沙洲出浮，河道收窄。这意味着今天的庙滩渡口比解放前距离更短、水流更缓。汉江流域示意图 （南方周末资料图/图）我驱车穿过庙滩镇，经一座小桥进入胡家洲。这是庙滩河段最大的一块江心沙洲，散漫的襄江仍在不断堆积、切割着它。沙洲内水道纵横，既有开垦的零星农田，也有巨大的挖砂场，道路坎坷，遍地沙土，缺乏路标，不易辨认方向，蜿蜒辗转方才来到沙洲东岸，找到了渡口。这里是一座车客渡，乃一艘拖轮平行绑定一条驳船，收费低廉，逢车就走，对面便是樊城太平店。渡口东西两侧的土路都叫304乡道，连通东岸的302省道和西岸的303省道。胡家洲渡口 （王在田/图）1927年6月24日，直系“战神”吴佩孚就是在这里仓皇渡过襄江，弃豫入鄂，遁入蜀道。	2020-05-28 12:00	王在田	nf	20200529132522
2020052913252217	只有不到万分之一的人见过这种美｜中国绿色公号榜230期	数据支持｜清博大数据检测时间｜2020年5月17日0时 — 2020年5月23日24时制作｜周嘉珺5月22日是国际生物多样性日。生物多样性包括地球上所有的植物、动物和微生物及其所拥有的全部基因和各种各样的生态系统。当天，生态环境部发布了2020年国际生物多样性日宣传片，河南省生态环境厅也发布了河南生态合集。“河南环境”公众号发布的《只有不到万分之一的人见过——河南生物多样性之美》视频推送阅读量86214，在看数1259。（《河南生物多样性之美》视频截图/图）无锡市启动建设项目环评告知承诺制审批改革试点工作，属于 “正面清单”中环评豁免范围的建设项目，全部实行环评豁免。试点范围包括农副食品加工业、食品制造业、社会事业与服务业、交通运输业、管道运输业和仓储业等。此外，属疫情防控急需的医疗卫生、物资生产、研究试验等三类建设项目，严格按照疫情防控期间相关通知规定的要求和时限等执行。疫情防控结束后，根据生态环境部相关文件要求，确定是否补办环评手续。“无锡生态环境”发布的《无锡企业好消息！这些项目环评豁免审批啦！》一文阅读量12721，位列市级生态环境公众号第一。2019年5月，生态环境部会同国家市场监督管理总局发布了《挥发性有机物无组织排放控制标准》（GB37822-2019），要求新建企业于2019年7月1日起，现有企业于2020年7月1日起执行此标准。无组织排放是与有组织排放相对的，指大气污染物不经过排气筒的无规则排放，排放范围广、监管难度大。VOCs挥发性强，涉及行业多、产排污环节多，无组织排放特征尤为突出。尤其是大量中小企业管理水平差，收集效率低，逸散问题突出。因此，通过各种技术、管理手段降低VOCs无组织排放，是大气污染治理尤其是臭氧污染治理中十分重要的一环。涉VOCs企业主要包括制药、农药、涂料、油墨、胶粘剂、染料、日用化工、化学助剂、合成革、橡胶制品、塑料制品等30个行业。“VOCs前沿”公众号发布的《7月1日起，所有企业全面执行GB37822国标！附：2020VOCs攻坚要点图解版》一文阅读量40197，在看数55，为本周媒体榜阅读量最高文章。2020年5月18日，江苏省环保集团正式挂牌。该集团注册资本金50亿元，为多元投资主体的国有控股公司，其中省级出资40亿元，占比80%；央企出资10亿元，占比20%。集团下属6家二级子公司，业务聚焦工业（园区）污染治理、生态环境整治、固危废处理、土壤修复、监测监控与信息化“五大板块”。（周嘉珺/图）（周嘉珺/图）（周嘉珺/图）（周嘉珺/图）	2020-05-28 09:00	千篇一绿	nf	20200529132522
2020052913252218	日本童谣运动的三大旗手一流文学家不主动执笔，为孩子就是一句假话	日本的童谣运动有三位旗手：北原白秋、野口雨情、西条八十，并称童谣三大家。他们都出身于早稻田大学，还有一位三木露风，庆应大学毕业，与北原白秋合称白露时代。北原白秋以诗成名，铃木三重吉请他来担纲《赤鸟》童谣栏，创作了365首，为数最多。次之的是西条八十，43首；他又从《赤鸟》转到《童话》，发现了金子美铃，还特意去她家乡见面。2006年日本文化厅选定101首歌，供亲子传唱下去，其中有白秋四首。例如《这条路》：这条路是曾经来过的路/啊，是呀/开着合欢花/那山丘是曾经见过的山丘/啊，是呀/瞧，白色的钟楼哟/这条路是曾经来过的路/啊，是呀/和妈妈乘马车走了哟/那朵云也是曾经见过的云/啊，是呀/山楂树也垂着枝。主持《金船》及《金星》童谣栏的是野口雨情，创作142首，为该刊之最。日本歌百选里有他五首，例如《肥皂泡》：肥皂泡飞了/飞到房顶/飞到房顶/破灭了/肥皂泡灭了/没飞就灭了/生下来马上/破灭了/风风不要吹/肥皂泡飞吧。脍炙人口的儿歌《红蜻蜓》即出自三木露风（1889-1964）之手。日本人最喜爱的童谣是《红蜻蜓》，这是三木露风的，作于1921年。原题当初是赤蜻蛉。某学友托他写军歌，他予以拒绝，说：硬要写的话，写不出像样的东西。1947年作曲家山田耕筰为《	2020-05-28 08:00	李长声	nf	20200529132522
2020052913252219	砸下六十万，买到了什么？氪金玩家的“觉醒”	2018年8月14日讯，英国伊普斯威奇，职业游戏玩家Harry Darwin充当一款射击游戏的导师，学生包括儿童及成人，收费每小时28美元，打包课程5小时140美元。 （视觉中国/图）“大姐头抽卡花了18万啊！”2020年4月13日，在一款角色扮演类手游的玩家群中，这句话瞬间刷屏。官方做活动抽卡，一位女玩家为了抽到心仪的角色，砸了18万元。该群群主告诉南方周末，这位女玩家一向都是“氪金（特指在网路游戏中的充值行为）大佬”，被群友尊称为“大姐头”。游戏群里有来自世界各地的玩家，大家氪金的币种各不相同。中国台湾玩家阿扣疫情暴发前在日本留学，他尝试过日元、新台币、人民币、美元等多币种充值，截至目前的花费约合人民币三万元。氪金的不止游戏本身，北京玩家盛康圆为游戏和游戏直播打赏花了近六十万元人民币。他告诉南方周末：“这钱花得有点多，后悔肯定有一点，都能买辆路虎了。”2019年8月2日，上海，第十七届中国国际数码互动娱乐展览会（2019ChinaJoy），一名玩家正在体验VR赛车游戏。 （视觉中国/图）盛康圆从2017年底开始看直播，最初主要看游戏类直播，每次打赏都是几千块。直播平台的年度比赛较多，为了能让自己喜欢的主播取胜，盛康圆会花很多钱去刷游戏礼物。“每个平台礼物设置不一样，价格也都不一样。最贵的一个礼物单品五千元左右，属性是抽奖礼。”据盛康圆描述，花钱多少与他跟主播的亲疏并无直接关系，但是消费到一定程度，平台会给予他一些特权，比如进入这个直播间会出现类似横幅的超大提示，上面展示着他的ID；上升到钻石级别，主播是不能踢人的；还会有平台专属VIP客服人员主动对接满足更多要求；一些平台甚至会把线上主播和达到某个级别的氪金大佬邀请去参加线下活动。“不知不觉，一年多下来，大号我就花了近四十万，几个小号各花了几万块的样子。”在花掉的这些钱里，最大的一笔是13万元，打赏给一个游戏主播。盛康圆认识的另一位氪金大佬，在线下活动中，直接买了一辆一百多万元的跑车开过去送给喜欢的主播。盛康圆回忆，“那时候不会每天都算计我花了多少，但打比赛要是输了，我可能就立刻充钱去抽奖或者去刷礼物，就是为了赢。”与盛康圆不同，阿扣玩	2020-05-27 23:00	南方周末特约撰稿 何豆豆	nf	20200529132522
2020052913252220	不想学英语，我该怎么办？——一个中学生梦里的兴趣教育	一教师在录制英语课程。 （新华社记者 杨植森/图）众所周知，现今中国教育分为两类，素质教育与应试教育，两个理念相生相克，互相弥补各自的不足。在这两大理念之间，我认为还有似有似无的第三种教育理念——兴趣教育。若将应试教育比作阴，素质教育比作阳，那么兴趣教育便是那维护阴阳平衡的阴阳分割线。因为素质教育的理念并未深入人心，若是任由其与应试教育混合，迟早会被应试教育吞噬，而兴趣教育便是维护其不被吞噬的保护罩。简化点说，若在学习上丧失了兴趣，人的学习便只会为了考试，甚至放弃并厌恶学习，若兴趣有了，人便能完美地将应试教育与素质教育相结合，成为人们口中称的“学霸”。可惜的是，我从小到大所接受的教育是毫无这种理念的存在的。就拿我自己来说吧	2020-05-27 21:00	蓝致远	nf	20200529132522
