id	title	txt	datetime	source	web	batch
2020051222044433	我总去咖啡馆，不工作，甚至不喝咖啡，只为喘口气	近日，位于日本东京JR山手线新站“高轮Gateway站”的星巴克，与日本当地的铁路运营商推出了专为办公人群和商旅客户设计的“Smart Lounge”概念店?185㎡的店面里，容纳了43个办公座位，包括两个付费的全封闭办公区、免费的半独立包厢和带小隔板的窗边办公区，配备充电口和移动电源租赁服务，WiFi覆盖整个空间。当星巴克率先将“付费在咖啡馆办公”提上日程，大家不约而同地意识到，咖啡馆似乎已经成了当代都市人的精神疗养所。咖啡馆不像图书馆，安静得让你翻阅动作稍大都会有种“冒犯感”，也不像家，床近在咫尺，稍微有点懈怠的念头人就躺下了。”刚刚好的热闹“让咖啡馆的氛围变得微妙，这使咖啡馆成为不少伟大的思想家、艺术家、音乐家、文学家的灵感爆发之地。读过《悲惨世界》的人大概还记得，法国大革命的起义者就是在咖啡馆里策划的革命，革命风潮退去后，咖啡馆又摇身一变成为艺术青年的聚集地。位于巴黎的百年老店花神咖啡馆和双叟咖啡馆 图源@Vera“我不在家，就在咖啡馆，不在咖啡馆，就在去咖啡馆的路上。”这是19世纪作家巴尔扎克在豪饮咖啡20年后，流传百世的话。用他的话来讲，《人间喜剧》是他用咖啡堆砌起来的小作。而21世纪，依然有千万个“巴尔扎克”一头“扎”进咖啡馆。“把自己置于公共环境中，明知无人关注但依然有种被监督的感觉。一旦松懈就有可能成为别人嘴里那个‘来咖啡馆装X’的人，工作效率自然就提高了。” 在咖啡馆办公近两年的@环子 说道。图源@Vera如果说艺术家和都市白领来咖啡馆找的是创作和工作灵感，那每逢寒暑假快结束的那几天“驻扎”在咖啡馆的学子们，找的就是抄作业灵感。几杯咖啡，几个“同伙”，带着空白的卷子来到咖啡馆，作业“灵感”爆棚，奋笔疾书一下午，带着写得满当当的卷子走。没写完？那明天继续。作为休闲场所，咖啡馆欢迎所有人来这里“喘口气”，不管是身体上，还是精神上。商圈的咖啡馆林立，最重要的目的是为了方便逛街逛累的人进来歇歇。长期把咖啡馆当作“歇脚地”的@Elvis 对这种观点表示了赞同，“特别是动森上线后，和朋友去咖啡厅联机的时间更多了。经常是带着游戏机出门，逛累了就找家店坐下然后开始联机，不知不觉一天就这样耗在这了。”五一假期，@Elvis 跟一起逛街的朋友在咖啡馆里联机了无数次。有吃有喝，温度适中，座椅舒适，网速还不差……大部分人在这落座后自然而然地就敞开了话匣子，一聊就是一下午，就像那句粤语说的那样，“hea下hea下又一日”（消遣消遣又一天）。有人来咖啡馆是边歇脚边聊天，但有人来这为拍照。这些年ins风、工业风的流行，使得咖啡馆的装潢也开始往这个方向上跑。前些年大热火烈鸟、海洋球池等一度成为咖啡馆装修必备，这也吸引了无数淘宝模特、网红博主来店内打卡拍照。某红书APP上一搜，从拍照姿势到打卡圣地，应有尽有。也是，谁还没在朋友圈里看过几张“咖啡馆写真”了？但更多人追求的，是咖啡馆能让精神“喘口气”的氛围。作为咖啡馆爱好者，@Vera 去旅行时会打卡百年老店的咖啡馆或者电影里的同款咖啡馆。“因为旅行路上比较奔波，所以旅程中的咖啡馆能提供一个场所，让我静坐思考，在奔忙中暂停下来，思考一些事情，捋捋思绪。”@Vera 打卡过的巴黎的双风车咖啡馆，同时是《天使爱美丽》的拍摄地当我们问到“一家什么样的咖啡馆，会吸引你让你长期驻守？”时，读者@谢耳朵 给出的答案非常简单：“环境好，装修赏心悦目，价格实惠，有猫更好。”当猫成为当代人的生活调味剂之一，在抚摸宠物的同时，也能使他们的精神得到极大的满足。无奈养猫的开销着实不小，只好去咖啡馆里“撸猫”了。@谢耳朵 常去学习的咖啡馆里的猫。我们还发现，爱在咖啡馆“喘气”，逃离现实世界的，并不局限于青年人，许多中年人也是咖啡馆的常客，Vera就遇见过不少。“我在咖啡馆里见过周末暂时不想带小孩而出来喘口气的妈妈们，还有一次遇到一个什么都不干，就光点了一瓶水的中年男子。他好像一直在发呆，还提出想看看我手里的书，我们聊了一下，他说自己每天下班不想回家，但也没地方可去，只有在咖啡馆里可以喘口气，什么都可以不用去想。”@Vera 在国内常去的咖啡馆。第一种相遇，是“咖啡馆钉子户”们和咖啡师的相遇。咖啡馆爱好者@阿润 把这当作自己工作学习的地方，他对第一次喝手冲咖啡的经历记忆尤深，“咖啡师引导着你去闻、品尝、交流的感觉太棒了！”在咖啡馆工作的@阿润另一位受访者@淡淡 也分享了一位让她印象颇深的咖啡师。她说：“有次一个马来西亚的奶奶来店里，是常喝咖啡很懂的那种奶奶，老板很开心地和她介绍咖啡品种之类的， 因为有些产地的英文有点复杂，所以对话有点磕绊，老板就慢慢一点点地讲，直到她理解了。奶奶喝完手冲之后非常喜欢，老板就非常爽快地又冲了另一种给她喝，奶奶也挺开心的。最后付钱时，奶奶要付两杯的钱，老板很可爱地小声说‘不要啦~后面一杯是送你的’，就是那种遇到懂味道的人的快乐。”@淡淡 在咖啡馆里，遇见了这位奶奶和咖啡馆老板。渐渐的，“钉子户”和咖啡师们成了朋友，TA成了最熟悉你口味的人，来到店里，不需你多言，他们就会送上最适合你的饮品，这是一种让人沉迷的默契。除此以外，就是你和另一位陌生顾客的相遇。“你可能会在这遇见一个只在记忆里留下痕迹的人。”读者@扑棱 告诉我们。“每天我的座位旁边都会有个留着长卷发的女人，每天我们都会聊一会，她关注我的学习进度，也说自己在边工作边备考，还分享自己的感情生活或生活趣事。这样的生活持续了大半年，我们每天都见面聊天，却始终没留联系方式，后来有一天，她突然就消失了。”没有留下照片，也没有联系方式，这个女人仿佛只在@扑棱 的记忆里留下了痕迹。越来越多人往来于城市里的咖啡馆，也因为各种原因短暂停留在此，那些长期“赖”在这的人，和他们相遇的同时，也在这里“观察人间”。要留住“人”，还得靠“人”。正是因为一次又一次与不同的人相遇，才使得咖啡馆留住了人。咖啡师正在调制咖啡，图源@Vera……奥地利作家斯蒂芬·茨威格认为“咖啡馆始终是一个接触和接受新闻的最好场所”，也是一个“文化机构，是一个民主俱乐部，而入场券不过是一杯咖啡的价格。”在离开居住和工作的空间后，我们一直迫切地在找寻一个第三空间，而兼顾了休闲、社交和独自思考空间的咖啡厅恰好就是这样一个把价格和氛围平衡得很好的地方。一人一杯一电脑，可终日矣。	2020-05-08 20:00	城市画报	nf	20200512220444
2020051222044434	“活埋79岁母亲”的男子被批捕，涉嫌故意杀人罪	2020年5月8日，靖边县人民检察院审查决定，依法对马某某以涉嫌故意杀人罪批准逮捕，案件正在进一步办理中。2020年5月2日晚20时许，犯罪嫌疑人马某某将其行动不便、生活不能自理的母亲王某某用家中的两轮手推车推至靖边县榆林炼油厂东侧“万亩林”，将母亲王某某推进一废弃墓坑内，并用事先准备好的铁锹铲土掩埋。案件发生后，靖边检察机关第一时间提前介入，引导公安机关侦查取证。（来源：人民日报客户端）	2020-05-08 18:34	陕西检察	nf	20200512220444
2020051222044435	国家卫生健康委：低风险地区校园内学生不需戴口罩	今日，国家卫生健康委发布通知，要求中小学校和托幼机构做好校园防控安全保障，尽可能确保进校进园的每个人都是健康的、没有感染的，将外来输入风险降到最低。低风险地区校园内学生不需佩戴口罩，教师授课不需佩戴口罩，不建议托幼机构婴幼儿佩戴口罩。（来源：央视新闻客户端）	2020-05-08 18:00	央视新闻客户端	nf	20200512220444
2020051222044436	委内瑞拉俘获美国雇佣兵　美老兵自认策划人	委内瑞拉总统尼古拉斯·马杜罗4日说，委方当天俘获13名从哥伦比亚经海上侵入的雇佣兵，包括两名美国人。一名美国退役军人当天早些时候自称雇用这伙武装人员、策划侵入行动，与委内瑞拉反对派签有合同。4日发表全国电视讲话期间，马杜罗手持两本蓝皮美国护照，读出护照上的姓名“阿里安·贝里”“卢克·登曼”及出生日期，展示雇佣兵所乘船只、所用无线对讲机和夜视镜的照片。“美国政府完全地参与这起遭挫败的袭击，”马杜罗说，这两人受美国退役军人乔丹·古德罗雇用。他说，古德罗与委内瑞拉反对派签有合同，利用他在美国佛罗里达州的一家企业招募雇佣兵。马杜罗称赞委内瑞拉北部阿拉瓜州渔民俘获其中一伙“专业美国雇佣兵”。阿拉瓜州州长鲁道夫·马尔科当天早些时候说，有赖情报部门信息和军民团结，当地渔民在海岸抓获8名乘船登陆的“恐怖分子”。这名州长发布照片，显示8名男子趴在地上，身着便服，手扣在背后。委内瑞拉媒体报道，这8人包括一名参与去年4月反对派未遂军事政变的原委内瑞拉上尉和两名美国人。这是委内瑞拉连续第二天拦截从海上侵入的雇佣兵。军方已调集2.5万名士兵防范威胁。军队和特警3日在拉瓜伊拉州海岸拦截一伙雇佣兵，击毙8人、俘获2人。委内瑞拉政府说，那伙人来自哥伦比亚、受美国和哥伦比亚政府资助，一名被俘雇佣兵自称是“美国毒品管制局特工”。哥伦比亚政府否认参与入侵图谋。古德罗4日早些时候在社交媒体直播中说，他策划侵入委内瑞拉的行动，与委内瑞拉反对派要员胡安·瓜伊多签有合同，组织雇佣兵在哥伦比亚受训，目标是“活捉马杜罗”。古德罗说，瓜伊多“始终没有履行合同”，在资金不足情况下，他招募大约60名雇佣兵，包括两名他当年的战友；这两人曾和他一起在伊拉克和阿富汗执行美军任务。古德罗服役期间三次获得美军铜星勋章，他在佛州创办的那家企业名义上提供安全服务。马杜罗发表最新讲话后，古德罗向路透社记者证实，贝里和登曼参与4日行动，“是我的人”。“我试图联系（派去委内瑞拉的雇佣兵），没人回我电话。”委内瑞拉总检察长塔雷克·萨阿布当天告诉媒体记者，瓜伊多与古德罗签有2.12亿美元合同，欲以“抢夺和窃取的委内瑞拉石油公司收入”支付。萨阿布在社交媒体上传一张照片，说照片是瓜伊多与古德罗签署的合同。这张照片由一名驻美国佛州的委内瑞拉记者拍摄。瓜伊多当天声称与古德罗“没有任何关系”。他去年1月自封“临时总统”，获美国承认和支持。美国制裁委内瑞拉石油公司，冻结这家企业在美国子公司的资产。（吴宝澍）（来源：新华社）	2020-05-08 17:00	新华社	nf	20200512220444
2020051222044437	货拉拉天价搬运费背后：不合理加价屡被诟病，搬家收费急待规范	近日，有网友爆料称，自己在使用货拉拉平台预约搬家时，不到2公里车程司机开价5000元费用，事件引发公众持续关注。5月6日货拉拉官方微博发出事件声明称，违规司机已被平台封号并清退，终身不可再加入平台。近年来国内同城短途货运市场规模逐渐扩大，易观数据显示，预计2020年同城货运市场规模较2014年将会增长78.1%，达到14245亿元。与此同时，以货拉拉、快狗打车、居家通、搬运帮为代表的国内服务C端用户市场的货运平台也在快速发展。但与此同时，司机加价、乱收费等现象却也普遍存在，受到用户诟病。5月4日，网友@我是FancyWang、@川大發使用货拉拉便捷搬家产品被索要高额费用后，在微博上曝光与司机交谈的视频进行维权。他们表示，总共1.2公里的车程，在已支付货拉拉平台费用440元和人工费用330元的情况下，被司机索要5000多元“天价搬运费”。按照其描述，因为车辆不能进入小区，还剩大概200米距离，司机遂将车停下，声称公司规定司机可以和用户协商另定收费标准——有电梯的可以不收取楼层费用，但没有电梯的位置按距离收费。于是，司机定的收费标准是按米收费，每米5元，交费后才能继续搬运。据报道，按照货拉拉客服的回应，该事件属于炒作，且搬运没有统一标准，需要与搬运工协商。最终经过协商用户实际转账给司机3000元。事件在公众中持续发酵，截至目前，有关天价搬家事件的微博话题超1.5亿次阅读量。5月6日晚，货拉拉官方微博对此发出了事件声明，称在事发后第一时间成立专门处理小组进行调查，平台司机豆某行为严重违反平台规则，已被平台封号并清退，且终身不可再加入平台。此外，货拉拉回应，在接受媒体采访时，货拉拉客服在不了解事件过程的情况下，擅自回复事件为“用户炒作”，对两位当事平台用户造成了二次伤害，货拉拉声明，该客服言论不代表平台立场，并已在公司内部对该客服予以通报和严惩。货拉拉对事件中的用户提出三点补偿措施：免除此单运输和搬运的全部费用；承担用户因此事件带来的一切后续花费；希望平等协商以补偿用户精神方面的伤害。5月7日，南都记者就此询问货拉拉方面，对方表示：“目前事件已处理，用户也接受了处理方案。”货拉拉官微声明据货拉拉官方平台显示，搬家费用会根据订单车型、搬运楼层以及有无大件物品来计算。在车型选择上，货拉拉平台有小面包车、中面包车、小货车和中货车四种。南都记者在货拉拉小程序平台发现，每个地区收费标准不一，以北京为例，起步价分别为30元-120元不等，5公里以内为起步价，超出部分以车型不同按每公里3-5元计算。此外，高速费、停车费、搬运费，需用户额外支付。其中，上货、卸货免费等候时长共40分钟，过后每10分钟加收5元，不足10分钟按10分钟计算。若涉及逾时等候费，需与司机按收费标准结算。南都记者搜索相关信息发现，定价规则、接单司机管理以及客服人员素质等都令各类货运平台备受诟病。不少网友在社交网络也“吐槽”自己遇到不合理加价的经历，例如称被货拉拉搬家司机告知即使有电梯，一层楼也要收100元费用；有网友表示因为没有同意司机的加价，被直接丢在马路上。还有部分网友反映曾遇到偷窃、性骚扰的司机。此外，客服态度也被诟病，有网友称此前搬家，因等待司机1个小时不至后打电话联系客服，被客服告知此事“管不了”，没交谈几句就被挂掉电话。上述问题不仅存在于货拉拉平台，南都记者在聚投诉平台发现，有关货拉拉的投诉帖达891条，而快狗打车的投诉贴也达到548条，包括不退押金、价格欺诈、联系不上客服等。其中今年3月有消费者反映，快狗打车司机接单后迟到，到达目的地后直接将行李扔在小区门口，拒绝帮助搬运，且在系统显示费用136.5元的情况下，司机强行要求顾客线下扫码付款150元。据艾瑞咨询发布的《2019年中国同城货运行业研究报告》，2014年-2020年是同城货运市场发展的变革期。其中，在细分市场结构方面，C端市场的特点是客户规模庞大但分散，具有黏性低、需求频率不稳定等特征，在保障物流服务信息实时传输的同时，需要兼顾服务评价体系和售后客情管理，能够确保和收派两端的客户交互，最大程度优化服务质量。对于今后搬家业务的整改，货拉拉在官方声明中表示，除楼层搬运费之外，将设定平地搬运费的平台标准；在涉及搬运订单时，优先推送评分较高的司机；提醒用户使用APP支付，避免线下交易并提供及时申诉渠道；加强司机服务管控，并改善客服服务态度和沟通方式，优先前置解决用户问题。	2020-05-08 15:00	南方都市报	nf	20200512220444
2020051222044438	卤味铺案板下上网课的7岁女孩：在市场长大人缘很好，梦想当医生	案板上，各色荤素卤菜散发出诱人香味；案板下，一个小女孩端坐物料之间，盯着一台旧式笔记本电脑，专注地上网课。这样的生活，湖北五峰7岁的柯恩雅已坚持了一个多月。近日，她在卤味铺案板下学习的照片在网络热传，感动了许多人。有网友评论：案板上是生活，案板下是未来。5月7日，柯恩雅的妈妈告诉南都记者，女儿上一年级，老人不在身边，因此从4月3日复工后，她和老公便带着女儿一起回到市场卖卤菜。由于铺面只有8平方米，只能让孩子在案板下学习。柯恩雅说，虽然在家会更安静，但她想和爸爸妈妈在一起。她的梦想是成为一名医生，而现在，她最希望能提高算术能力。柯恩雅在案板下上网课的照片在网络热传。今年7岁的柯恩雅是湖北五峰渔洋关镇小学一年级的学生。她的班主任余文艳，是最早注意到她在案板下学习的人。5月7日，余文艳告诉南都记者，线上开学后，学校发了家访通知，各班根据具体情况制定计划，她管理的一年级（2）班一共有55位同学，从4月初开始，她已经陆续对十来位同学进行了家访。在对柯恩雅家访前不久，语文老师曾向她反映，柯恩雅的书写已进步很多，但视频课里看见她坐的地方光线不太好，“让我给家长提建议，给她弄亮一点。”当时，余文艳并不知道柯恩雅是在案板下上课。4月29日，余文艳和一名音乐老师一起去柯恩雅家的卤味铺家访，进入铺面后，发现她正在案板下学习，“给我的触动很大。”余文艳当场就拍下柯恩雅学习的场景发了条朋友圈，“孩子上网课条件虽然艰苦，但进步却明显！只要家长坚持陪伴，孩子眼中的世界就是一片光明！”班主任家访时看到柯恩雅在案板下学习。余文艳拍下的照片里，案板上摆放着各色荤素卤菜，案板下，是正在学习的柯恩雅。这间位于渔洋关镇城区集贸市场的卤味铺只有约8平方米，是一个铁皮板房，三面是铁皮案板，一面是入口，案板上摆满了卤菜，案板下的两旁堆放着物料，中间的铁架之间，柯恩雅蜷坐着学习。被纸箱垫起的桌板上，摆着一台老旧的笔记本电脑和台灯。“眼睛的光感染到我了。”余文艳告诉南都记者，她眼中的柯恩雅“古灵精怪”，很聪明、活泼、可爱。“成绩以前是中等，这学期有了明显的进步，不仅语文，数学的正确率也提高了很多。” 余文艳说，平常柯恩雅都是在托教的地方做作业，这学期在家长的辅导下，有了明显的进步。班主任在朋友圈发布了柯恩雅的照片，获得大量点赞。5月7日下午，柯恩雅录完背课文的视频，出门找菜市场的小伙伴们玩耍。母亲赵女士在手机上上传完视频后，终于得以腾出双手，安心准备卤菜的食材。赵女士告诉南都记者，她的老家在宜昌夷陵区，丈夫是温州人。2003年，夫妻俩经朋友介绍来到五峰县，做起了卤菜生意，丈夫主要负责加工，她负责销售。一呆，就是十多年。今年春节，一家人回到夷陵区老家，3月底返回渔洋关镇。按防疫要求居家隔离期满后，4月3日，卤味铺重新营业。虽然家里离卤味铺步行只有几分钟的距离，但放心不下女儿独自在家，他们便带着女儿在店里学习。“她才一年级，像这样上网课的话，很多东西都是需要指导的。她一个人家里就没人带。”赵女士说，菜市场许多店铺老板的孩子和柯恩雅年纪相仿，也都在菜市场学习，不过因其他店铺面积更大，所以不用被安排在案板下。柯恩雅家的卤味铺只有8平方米。“从小她就在这（市场）长大的，慢慢就习惯了。”赵女士说，柯恩雅3岁前由老家的母亲抚养，之后便在五峰成长，也经常在市场和朋友一起玩，对这里环境再熟悉不过。此前的周末，她也曾偶尔在案板下学习。为了让女儿更好地上网课，这次，赵女士专门腾出了案板下的整块空间，布置了纸箱和台灯等，还升级了手机流量包。在赵女士看来，在案板下学习并非没有好处。面对市场熙熙攘攘的人群，柯恩雅很容易在学习时分心，“在下面比较黑一点，安静一点。”柯恩雅在学习。“但没有影响是不可能的，有时候也很吵。”赵女士说。女儿经常在案板下录制背课文视频，“砰砰砰”的剁菜声、嘈杂的说话声，常常让她正在录制的视频不得不重来许多次。由于空间太小，柯恩雅时常会碰到头。“有时猛一抬头就撞到了脑袋，疼哦。”赵女士告诉南都记者，她和丈夫一般会在四五点起床准备食材，之后她先去市场准备营业，丈夫再带孩子过去，直到晚上八点左右才收摊回家。孩子上午的主要任务是上网课，下午则忙于写作业、交作业。交了作业，柯恩雅也会出去找附近的同伴玩耍。一个多月以来，辅导孩子的学业，成为了赵女士做生意之外的另一个重心。但她正给女儿检查着的作业，常常因为要做生意而不得不打断。“忙的时候，又要切菜，又要卖菜，小孩又在下面喊，‘妈妈，你看一下这个东西’。”令赵女士倍感欣慰的是，柯恩雅十分听话、懂事，基本不太需要她操心。赵女士说，柯恩雅对待学习很认真。每天都会按时完成老师布置的作业，“不做完就不会出去玩”。学校老师建议写的日记，她每天也会完成。“可能写得不好，就是记流水账，但每天都会写几句话。” 柯恩雅的人缘也很好，菜市场附近的小孩经常找她玩。令赵女士颇为难忘的是，柯恩雅有时还主动提出帮她分担工作。“有时候我们需要给附近的人送菜，她会主动说“妈妈，我帮你送过去吧”。如果距离不远，我就同意让她去了。”柯恩雅。但柯恩雅有时也容易分心。“走红”之后，有不少光顾卤味铺的客人主动问起柯恩雅，正在案板下学习的她听到之后，会从下面探出头来，伸出手摇一摇，说“我在这里”！“她知道自己火了之后很开心，还跟别人说‘你们看，我出名了’。”赵女士说。5月7日晚，柯恩雅告诉南都记者，这段时间自己上课、做作业都在案板下，虽然“头顶着有点疼”“有点吵”，但都能接受。她坦言，觉得在家里学习会更安静一点，但她还是更愿意在案板下学习，和爸爸妈妈在一起。柯恩雅告诉南都记者，她的梦想是长大后当医生。而现在，她最希望的还是“提高算术能力”。对此，赵女士告诉南都记者，这段时间她网购了一些算术相关教辅，供女儿在课后学习。“但她也不爱做，想出去玩。”赵女士笑言。对于柯恩雅的学习，赵女士暂时没有明确的期望。“我们也不想给到她太大的压力，毕竟才一年级。” 近期，赵女士打算把案板加高，让柯恩雅的学习空间更宽敞、舒适一些。“现在她个子长高了，上面有点挤。”“像我们这样做肯定是持续不了的。”赵女士坦言，兼顾孩子的学业和生意，对她来说有一定的压力，但她庆幸自己还能辅导孩子的学业。“我和他爸爸也没读过什么书，她现在小学一年级，我们还可以辅导，之后升高年级了可能会有些困难了。”她也为自己可以继续工作而感到幸运。“受疫情影响，很多人打工碰壁，我们在这里有个店可以营业，也还算不错了。”	2020-05-08 13:00	南都记者 吴佳灵 实习生 陈婷婷	nf	20200512220444
