id	title	txt	datetime	source	web	batch
2020052116031576	常态化疫情防控下科学佩戴口罩指引来了，北京疾控发布	在5月21日召开的北京市新冠肺炎疫情防控工作第109场新闻发布会上，北京市疾病预防控制中心副主任刘晓峰发布了首都常态化疫情防控工作下公众佩戴口罩指引：一、医务人员和前往医院就诊住院人员、陪同陪护探视人员，应当佩戴口罩。二、有发热或患呼吸道感染病的患者及其接触人员居家或外出时，应当佩戴口罩。三、从事公众服务（含窗口岗位）人员，商场、超市、餐饮、酒吧、KTV、美容美发、环卫、公交、地铁、出租车、网约车等行业人员，社区、机关企事业单位、公共场所等测温验证人员，应当佩戴口罩。四、前往人群拥挤、通风较差的室内公共场所，乘坐地铁等公共交通工具，进入养老、托幼、托育、中小学校、福利等机构，应当佩戴口罩。五、年老体弱者、患慢性病人员、孕妇等外出时，或需与他人密切接触而又无法确定风险时，建议佩戴口罩。六、学校师生上课时，建议佩戴口罩。七、户外活动在保持1米线社交距离的情况下，可以不戴口罩。八、在消毒通风良好、严格健康监测、保持社交距离的室内会议及活动场所，可以不戴口罩。九、有关行业和单位根据各自工作环境特点，在卫生专业机构或人员指导下，可制定具体场景下佩戴口罩指引。（原题为《何时应佩戴口罩？常态化疫情防控下科学佩戴口罩指引来了》）(本文来自澎湃新闻，更多原创资讯请下载“澎湃新闻”APP)	2020-05-21 14:36	罗子瑛、胡亚利、危家煦/央视新闻	pp	20200521160315
2020052116031577	520当天，荆州抗疫警察百对新人参加云婚礼	5月20日，湖北荆州。疫情之后，百对推迟婚期的新人举办了一场“云集体婚礼”。一对来自荆州市公安局的新人，他们9年的爱情长跑终于划上句点。	2020-05-21 14:34	澎湃新闻	pp	20200521160315
2020052116031578	全国政协委员孙承业：应限制处于特殊生理期女性参与疫情防控	疫情期间，全国政协委员孙承业经常从新闻报道中看到处在孕期的女医生坚持工作在抗疫一线，他认为，疫情对处于特殊生理期（孕期）的女性以及对胎儿健康是有影响的，而且影响要比对普通人大得多，今年全国两会他带来一份提案，建议限制处于特殊生理期女性参与疫情防控，以此来保护女性，同时保护我们的下一代。（原题为《全国政协委员孙承业：限制处于特殊生理期女性参与疫情防控》）(本文来自澎湃新闻，更多原创资讯请下载“澎湃新闻”APP)	2020-05-21 14:29	工人日报	pp	20200521160315
2020052116031579	钱锋委员：尽快将新知识、新技术融入工程学科人才培养方案	智能化时代，应该如何培养制造业工程科技人才？今年“全国两会”上，全国政协委员、中国工程院院士、九三学社上海市委主委、华东理工大学副校长钱锋拟提交一份提案，就智能化时代的制造业工程科技人才培养模式改革，提出自己的真知灼见。提案指出，制造业是国民经济的支柱和基础产业，也是全球经济持续增长的重要支撑力量。疫情期间，我国发挥制造业集群和产业链优势，在防护服、口罩、消毒用品等防护物资生产和保障方面发挥了关键作用。面对新一轮科技革命和产业变革，必须推动制造业转型和智能化发展，培养适应和引领未来智能制造的工程科技人才就显得尤为迫切。钱锋认为，新时代要求人工智能等现代信息技术与制造业实现深度融合，推动制造业高质量发展。因此，制造业智能化发展要求未来的制造业人才具有多学科知识、跨界整合能力和解决现实工程技术和管理问题的能力，对当前的人才培养模式带来了新的挑战。不可否认的是，从当前人才培养模式的现状来看，仍存在一些问题，比如：人才培养方案和知识体系更新滞后；跨学科的人才培养存在体制机制障碍；工科师资队伍能力素质建设亟待加强等。针对上述问题，钱锋在提案中提出了四个方面的具体建议：第一，加快工程学科和专业的知识体系再造。当务之急是要高度重视制造业与人工智能、大数据等现代信息技术的深度融合，尽快将新知识、新技术融入工程学科和专业的人才培养方案，使学生能够系统掌握。长期目标是建设适应制造业智能化发展的人才培养体系，通过开设新技术与制造业相结合的课程、编写案例和教材，形成全新的课程体系、教材体系和知识体系，使新技术成为未来制造业人才培养的天然组成部分，培养学生真正掌握将新技术融入到制造业中的能力。第二，探索多元化的制造业工程科技人才培养模式。制造业行业内分工越来越细，专业创新越来越重要，培养模式的多元化十分重要。除了传统的“技术员→工程师→总工程师（或创业）”科技型人才，还需要“业务员→销售主管→区域经理→销售总监”销售型人才，更需要既掌握工业生产、工艺、研发、质量检验等专业知识，也了解物流、法律、环保、项目管理等多学科知识的“复合型”人才，这对多元化培养模式和双学位培养制度提出了迫切的要求。第三，创新制造业工程科技人才跨学科培养方式。一是打破学科和专业藩篱。组建跨学科的课程和教学团队，共同开发新技术与制造业相结合的课程并开展教学；二是建立跨学科导师制度。为研究生配备一名专业导师和一名智能技术领域的导师，共同指导其开展智能制造方向的研究；三是鼓励跨学科攻读硕博学位。吸引智能技术领域和制造业领域的本科生跨学科攻读硕博学位。第四，大力提升面向制造业的专业师资队伍综合能力。一是创造有利于教师开展跨学科研究和掌握人工智能等新技术的条件。组建跨学科的研究平台和项目，鼓励制造业领域和智能技术领域的教师开展跨学科的研究，共同攻关制造业领域的智能技术问题。二是强化对工科教师解决现实工程问题的能力考察。将工科教师在解决制造业现实工程问题的贡献作为其绩效分配、职务职称晋升、岗位晋级考核中的重要指标，引导其关注并解决当前制造业发展中亟待解决的关键问题。三是增强教师的工程实践能力。组建由教师领衔组成的企业实践团，深入一线，帮助企业解决工程实际问题，在实践中提高教师整体工程科技素质与能力。(本文来自澎湃新闻，更多原创资讯请下载“澎湃新闻”APP)	2020-05-21 14:29	澎湃新闻	pp	20200521160315
2020052116031580	特稿｜全球确诊500万之际的“完美风暴”：新冠病毒在巴西	在50岁的巴西人鲁本（Ruben）记忆中，巴西从来没有遭遇过这样的“浩劫”。“太惨了。”他对澎湃新闻（www.thepaper.cn）哀叹道，“把寨卡病毒、登革热、 H1N1、流感、艾滋病这些流行病加在一起，也没有这次的新冠疫情严重。大概只有100年前的西班牙流感和70年前的二战可以相提并论。”5月21日，约翰·霍普金斯大学全球新冠疫情统计数据显示，全球新冠肺炎累计确诊病例突破500万。24小时前，世卫组织收到了自疫情发生以来单日全球最高新增纪录——106000例新增病例。“新冠大流行还没有结束。病毒正在转向较贫穷的国家。”世卫总干事谭德塞发出严厉警告。眼下，美洲已经成为了全球疫情的中心，而南美洲的巴西正在成为新的震中。过去10天，巴西新冠肺炎死亡人数增加了50％，达到近2万人，累计确诊病例近30万，超过了意大利、西班牙、英国等重灾区，目前仅次于美国和俄罗斯。5月18日，新上任仅三天的代理卫生部长——陆军将军帕祖洛（Pazuello）在世卫大会上向全世界介绍巴西的疫情。帕祖洛将军是巴西一个月来迎来的第三位卫生部长。三天前，他的前上司纳尔逊·泰希（Nelson Teich）突然宣布辞职。此时距离上一任卫生部长去职还未满一个月。如走马灯般更替的卫生部长和每日不断攀升的疫情数字凸显出这个拉美第一大国眼下面临的严峻挑战。专家警告，新冠疫情在拉美大流行的速度和广度可能与亚洲、欧洲和北美洲的情况完全不同。拉丁美洲和加勒比地区有着超过 6.66 亿人口。这里也是世界上贫富最悬殊的地区。除了巴西，墨西哥、秘鲁、智利等国的疫情也在不但升温。大量的贫民窟让人倍感担忧——当疫情在人口密集和公卫医疗设施薄弱的地区大面积爆发，没有有效的隔离措施，医疗资源遭到挤兑，政府内部又充满矛盾，应对失调，所有这一切凑在一起，新冠病毒将在巴西掀起一场“完美风暴”（编注：“完美风暴”指1991年强烈冲击美国东海岸的风暴，因多种天气条件汇聚在一起，为这个风暴的形成创造了“完美”的条件而得名）。风暴来袭当席卷全球的新冠病毒终于登陆南美大陆，人们发现，在巴西暴发的疫情不仅有着此前所有重灾区共有的特征，还证实了人们一些最坏的担心。巴西疫情蔓延显示新冠病毒对于温度似乎并不敏感，疫情反而在“最热的地方情况最不好。”鲁本说。在鲁本认识的人当中，至少已经有两人死于新冠肺炎。他母亲的妹妹上个月确诊，现已不幸过世。在圣保罗——这座有着1200人口的南半球最大城市中，新冠病毒已经带来了沉重的打击。与里约一起，这两座巴西最大、人口密度最高的城市有着巴西三分之一的确诊病例，正经历着和意大利伦巴第、马德里和纽约相似的遭遇。圣保罗市长布鲁诺·科瓦斯（Bruno Covas）5月17日在接受英国广播公司（BBC）采访时表示，该市的公立医院已达到90％的容量，将在两周内饱和。随着疫情继续发展，其卫生系统可能随时崩溃。“新冠病毒在巴西找到了一个形成‘完美风暴’的环境——这里缺乏政府的明确应对策略；到处是没有采取保护措施的人们；大部分城市都有着密集的人口；许多人生活在非常困难的条件下，没有干净的水源，也不可能保持社交距离。”美国智库“美洲对话”（Inter-American Dialogue）中拉项目主任玛格丽特·迈尔斯（Margaret Myers）对澎湃新闻说。与欧美疫情重灾区国家不同的是，作为南美洲贫富差距最大的国家，巴西有着超过1300万贫穷人口住在4000多个设施简陋、卫生条件差、人口密度极高的贫民窟里。这些地方是病毒传播的“天堂”，却是遏制疫情的噩梦。对于生活在贫民窟的穷人而言，保持社会距离几乎是不可能的。为了生计，他们也无法待在家中，必须外出上班挣钱。对于他们而言，吃饭显然是更迫切的需求。联邦政府给予这些因为疫情没有收入的穷人每人每月600 巴西雷亚尔（约等于100美元）的补助，持续三个月，然而这只是杯水车薪。不仅在大城市，在偏远乡村、甚至是原始森林里，新冠病毒也没有放过。迈尔斯指出，在亚马孙河流域，沿岸有很多土著居民，他们原本与外界很少接触。但这也使得他们特别容易受到外来病毒的侵害。近年来，由于非法伐木和采矿导致的环境破坏，以及盗采工人入侵雨林深处，导致了病毒在原住民部落中的扩散。而这些原住民几乎没有任何医疗保健措施。当病毒在当地蔓延，几乎等同于一场人道主义灾难。在网上流传甚广的一组照片显示出了这种悲惨景况的冰山一角：大型挖掘机在位于亚马孙心脏地带的巴西亚马孙州首府马瑙斯市挖掘一排又一排的深坑，掩埋大量遗体。马瑙斯市的医生告诉巴西有线电视新闻网，新冠疫情使该市许多公立医院人满为患，病人无处可治。由于缺乏检测，官方公布的死亡人数大大低于实际情况。当地死亡人口记录显示，仅4月份，就有2435人被埋葬，而去年同期仅有871人被埋葬。据法新社报道，巴西原住民联合会表示，新冠肺炎疫情目前已经扩散至巴西38个原住民部落，至少446名原住民确诊，92人死亡，其中包括一名53岁的柯卡马部落酋长。这样的悲剧唤醒了人们的回忆。早在16世纪初，西班牙殖民者把包括天花病毒在内的众多传染病带到了美洲，成了美洲大陆土著居民噩梦的开始。到16世纪末，当地土著人口锐减，整个社会体系几乎处于崩溃的状态。“总统带领我们与一个不认识的敌人进行战斗。”马瑙斯市长亚瑟·维吉里奥·内托（Arthur Virgílio Neto）说道，“他必须承认自己错了，为了减轻医院负担和恢复社会运转，我们必须进行隔离。”内托的话暴露出了巴西疫情中另一个更致命的问题——政府领导人之间以及与卫生专家之间对待疫情的分歧。对于巴西总统博索纳罗（Jair Bolsonaro）而言，保持经济显然比防控疫情更重要。疫情开始以来，他与提倡严格社交隔离措施的卫生专家发生了多次冲突。4月初，他甚至解雇了自己任命的卫生部部长。继任部长也在一个月不到就宣布辞职。“总统与专家的分歧必然导致政府抗疫力量削弱。我们在美国也看到了这种情况，这是美国疫情下降很缓慢的原因之一。如果巴西也这样，同样会导致疫情防控效果不佳。”现居纽约的中国公共卫生和流行病学专家、中国疾控中心原副主任杨功焕对澎湃新闻说道。总统和卫生官员、地方政府和联邦政府不一致甚至相互矛盾的信息使得巴西人陷入混乱的境地，无所适从。一些人被催促着出门上班，另一些人则大声抗议。在一片吵闹声中，更多的人在感染和死亡，得益的或许只有新冠病毒。风暴如何形成作为全世界最晚受到新冠病毒影响的国家和地区，巴西与南美洲本有足够的时间做好准备。据鲁本的回忆，巴西的疫情是从2月末开始的。2月26日，里约著名的嘉年华游行结束后次日，圣保罗确诊了首例病例。巴西联邦政府虽然宣布进入紧急状态，可是各州州长都没有取消嘉年华，来自世界各地成千上万的游客来到巴西参与狂欢节，这导致很多巴西人感染病毒并扩散至全国。在首例病例出现后的近一个月里，巴西疫情增长缓慢。3月28日，全国仅仅有不到4000例。之后疫情开始爆发性增长，到4月28日，已骤升至7万多例。截至5月21日，累计确诊病例已经接近30万，死亡近2万人。。以巴西2亿多人口的体量而言，其每百万人口感染和死亡率相对美国和欧洲国家来说，并不算高。不过许多专家指出，由于漏报和缺乏检测，巴西的实际感染人数可能是目前公布数字的10到15倍。巴西目前的测试规模仅为美国的二十分之一，而美国的检测水平还没有达到一些欧洲重灾区国家的水平。从亚马孙的土著村庄到巴西城市的贫民窟，尽管许多州长和市长都采取了社会隔离措施。但是，将近一半的巴西人并没有遵守这些规定。顶级医学刊物《柳叶刀》在5月的一篇社论中直言不讳地指出——巴西总统博索纳罗对疫情轻视的态度是这背后最重要的原因。美国对外关系委员会全球卫生高级研究员黄严忠告诉澎湃新闻，在应对疫情上，巴西和美国有很多相似之处——都有一个对疫情大意轻视的总统；更偏爱民粹主义；与疫情最严重地区的地方政府领导人不合；对专家的建议和策略不感兴趣；坚持经济第一等。不过，黄严忠认为，博索纳罗的政策应该还是有一定的民意支持基础。“巴西有很大的贫民群体和非正式的就业人口。对于他们来说，疫情还是生存下去更重要这个问题是显而易见的。如果没有经济的话，饭都吃不了。”他说。而博索纳罗与地方政府的角力更是将疫情危机进一步复杂化。巴西最富有的州圣保罗采取了最严厉的措施来对抗大流行。州长若昂·多里亚（João Doria）公开批评了博索纳罗号召巴西人重新去上班的呼吁。他还表示，博索纳罗解雇卫生部长是一场灾难。“政府领导力的缺失以及联邦和州之间缺乏协调是巴西面对疫情危机的一大障碍。当下巴西政府迫切需要向大型公司与家庭提供经济援助并采取社会隔离的措施， 但是到目前为止，政府所采取的措施都是不稳定的。”巴西坎皮纳斯州立大学经济学教授佩德罗·罗西（Pedro Rossi）对澎湃新闻说。据罗西介绍，博索纳罗的主要权力基础部分来自于军队和民兵组织支持。就在5月20日，代理卫生部长的将军一口气任命了20名军人担任卫生部门的高级职务。而博索纳罗本人则表示，他不急于短时间内任命第三位卫生部长，以避免“重蹈覆辙”。在罗西看来，巴西正面临一场政治危机，这场政治危机正在助长疫情的危机。“因为我们有一位总统，他的主要策略是反对政府，反对自己的卫生部长。”他说。巴西此前有着曾被世卫组织称赞的全民医保体系。但罗西表示，医疗系统因为长期财政紧缩政策的影响，在如今的疫情下显得远远不够。“关键问题是我们无法了解疫情的发展趋势。现在巴西的疫情波动非常剧烈，我们不能确定我们到底处于什么阶段。”他说道。伦敦帝国理工学院的研究人员预测，巴西新增死亡人数将快速上升至仅次于美国，位居世界第二的规模。病毒的传染指数R，即每个患者平均感染的人数为2。而美国和其他主要疫情国家R值已经接近1。这意味着，在其他主要疫情国进入平缓和下降期之际，巴西疫情甚至还未达到最高峰。黄严忠表示，巴西面临最大的威胁在于，无论是防控疫情还是保持经济，当博索纳罗选择了一个极端，结果可能反而两个都抓得不好，被困在疫情中的时间只会拖得越来越长。面临疫情和经济的双重打击。被称为“热带特朗普”的巴西总统博索纳罗此前在被记者问及对巴西疫情日趋严重的看法时，他回应称：“那又怎么样？我很抱歉，但你还要我怎么样？”这一冷漠和傲慢的态度引起了民众的极大不满。风暴的影响这场疫情对于巴西和整个南美地区带来的影响无疑是巨大和深远的。巴西经济部近日发布的预测认为，今年巴西GDP将下降5%到10%。“像所有国家一样，服务业受到的影响最大。巴西经济的重要支柱大宗物品出口国际价格暴跌，对经济影响很大。我们将面临一个巨大的经济衰退，因为人们不愿意走出家门，不消费，就没有需求。人们不工作，所以没有供应。”罗西说。他继续说道，“2008年的危机来自金融系统，冲击了实体经济。现在我们正面临着一场来自实体经济的危机，我们还不知道金融系统和公司会受到多大程度损害。”在疫情来袭之前，巴西经济已经面临了巨大的压力。2015年到2016年间，巴西经历了25年来最严重的经济衰退。这场巨大的危机使得巴西经济两年间萎缩了 4%。2017 年勉强反弹了1%。而今年，当新冠大流行袭来之际，虚弱异常的巴西经济又将陷入“绝望的深渊”。罗西认为，目前博索纳罗的政策只是单纯呼吁人们工作，但是情况并不会变得更好。“GDP会更糟，因为人们外出将进一步传播病毒，而疫情加重将使得人们害怕外出。他的策略没有基于科学的论点，只是一种政治策略。”而罗西担心的是，巴西的情况会变得更糟。“最坏的情况是，病毒的传播率很高，死亡率也很高，加上政治和社会政策的不稳定。我们会开始看到暴力问题在巴西出现。它可以动摇政治制度，引发军事政变。我们已经看到这样的迹象。”他说。尽管前景不容乐观，罗西仍有着大多数巴西人骨子里的乐观精神。“虽然困难重重，然是我依然乐观，努力看到好的东西。我认为情况会变得更糟，许多穷人会死，但是人们必须明白，我们必须建立一个有效的社会体制与疾病斗争。不仅仅是在大流行时期，如果有人遭受贫穷和其他疾病的痛苦，我们必须帮助这些人。如果我们能够动员国家和人民战胜这次的疫情，我们就能够动员国家和人民团结起来，克服诸如巴西的贫困等社会问题。它可以向人们表明，我们的国家变得更好是可能的。我认为这是这种疾病会带给我们的好处。”他说。(本文来自澎湃新闻，更多原创资讯请下载“澎湃新闻”APP)	2020-05-21 14:28	澎湃新闻	pp	20200521160315
2020052116031581	整治非法VPN、数据买卖等网络黑市，北京警方开展净网行动	央视新闻客户端5月21日消息，为深入贯彻落实全国公安机关网上秩序，打击整治“净网2020”专项行动工作部署，北京市公安局自5月起至12月底，在全市集中开展“净网2020”专项行动，进一步营造安全、清朗、有序的网络环境。据了解，此次专项行动将重点围绕持续深化网上违法犯罪打击、强化网上违法有害信息治理、督促网络运营单位落实网络安全义务三个方面开展打击整治。持续深化网上违法犯罪打击，即严打黑客攻击破坏、侵犯公民个人信息、电信网络诈骗、套路贷等新型网上违法犯罪，严打网上贩枪、涉毒、色情、赌博、传销等传统违法犯罪。同时，依法打击为各类网络犯罪提供推广营销、技术支持、网络账号买卖、支付结算等非法利用信息网络、帮助信息网络犯罪活动的行为。强化网上违法有害信息治理，即依法对违法有害信息突出的IDC（互联网数据中心）、云平台和App等各类网络应用服务进行清理整治，完善信息安全管理责任制度和技术防范措施，切断网络违法有害信息的传播渠道。督促网络运营单位落实网络安全义务，即推进“一案双查”制度，整治非法VPN（虚拟专用网络）、网络数据买卖、账号买卖等网络黑市，大力整治重点领域和网络乱象，督促网络运营单位落实安全措施、管理制度及应急机制，依法从严查处不履行网络安全义务的行为。深化网上秩序打击整治，健全网络社会综合治理体系是首都公安机关义不容辞的职责。下一步，北京市公安局将严格按照《中华人民共和国网络安全法》《中华人民共和国反恐怖主义法》等法律法规，创新完善“部门协同、警种协作、企业配合、群众参与”的网上秩序打击整治长效机制，最大限度挤压违法犯罪空间，全力维护首都安全稳定的网络空间。（原题为《北京市公安局部署开展网上秩序 打击整治“净网2020”专项行动》）(本文来自澎湃新闻，更多原创资讯请下载“澎湃新闻”APP)	2020-05-21 14:26	央视新闻	pp	20200521160315
