id	title	txt	datetime	source	web	batch
202005122008171	图集丨十二年了，这些画面仍催人泪下	12年、24年甚至数百年之后，我们都会铭记——那一时刻，2008年5月12日14时28分。那一坐标，北纬31.0度，东经103.4度，中国，四川，汶川。那一场殇，8.0级地震，近7万人丧生，1.8万人失踪，37万余人受伤……那一抹绿，地震发生后至2008年9月11日，全军14.6万名部队官兵、7.5万名民兵预备役人员出动。满目疮痍，涕泗横流，治愈悲伤的，是另一些勇敢的故事。不说震撼，不说泪目，请相信：在我们看到的听到的之外，还有文字与言语远远形容不了的感触。第一支挺进汶川县城的救援部队前方等待官兵的，是无数的塌方、断桥和泥石流，一条险象环生的生死之路。被砸烂的汽车横七竖八地翻在路边，像捏瘪了的易拉罐，遇难者的遗体惨不忍睹……与之抗衡的，只有一个决心，“就是爬，也要爬到汶川；就是倒下，头也要朝着汶川的方向！”5月13日23时15分，武警某师参谋长王毅带领200名勇士，历经31个小时的生死挺进，徒步强行军90多公里，成为第一支到达汶川县城的救援部队。与外界隔绝33个小时的汶川，灾情终于被传出。踏入汶川县城的那一刻，他们听到了“一生中最难忘的掌声”。黑暗和寂静中，到处都是露宿街头的群众，由于极度的恐惧、悲伤和疲惫，已经发不出欢呼声了，但还是站着、坐着，用力地鼓掌。4999米高空的“惊天一跳”机上的15名首批伞降队员，没有人知道跳下去等待自己的会是什么。因为这是在4999米的高空，没有地面指挥引导、没有地面标识、没有气象资料……当时，他们已做好了三分之一伤亡的准备。瞬间，完成惊天一跳，雪白的伞花朵朵绽放，飘向震中孤城茂县。事前，他们写下了等于是遗书的请战书：“我愿意付出自己的一切，去挽救灾区人民的生命，实现我们军人的价值。”一片混沌里，他们的身影出现了，当地百姓跑向他们，颤抖地哭喊着：“我们终于有救了！”▲图为“空降十五勇士”从震区归来后在机场的合影：从左往右、从后到前依次为——刘文辉、李玉山、王磊、赵海东、刘志保、雷志胜、殷远、赵四方、王君伟、任涛、李振波、于亚宾、郭龙帅、李亚军、向海波。一名空降兵留给女友的短信“我去灾区了，别为我担心，看到那么多人被灾情折磨着，作为军人我义不容辞，虽然我可以不去。我没有告诉家里任何人，只告诉你了，那里情况不容乐观，抢险救灾有着一定的危险。记住，如果我留在那里了，别哭，你失去的是一个亲人，那里很多人失去的不止一个亲人，那里建好了去那里看看，别问我留在什么地方。”这是十五军空降兵部队的一名战士在前往地震灾区前，留给自己女友的短信。“宝贝，我爱你！别恨我，我是军人！”这是抗震救灾中一位军官的怒吼。战友不让他进一座废墟中抢救伤员，他指着身上的迷彩服，“你记住！一个兵，穿上军装的时候，就不再是你老子的儿子，你老婆的男人！你是老百姓的儿子，是国家军人！我今天就对不起她了！”然后，他向着妻子所在的城市方向敬礼，“宝贝，我爱你！别恨我，我是军人！”进入废墟后，余震造成废墟二次坍塌，他把伤员护在身下，自己受伤。七小时后，他醒了过来，拔下针头再次冲进了救援队伍……“求求你们，让我再去救一个吧！”绵竹的武都小学教学楼坍塌，至少埋压了100多个师生。钢筋和楼板摇摇欲坠，残存的墙体时不时往下掉，19岁的战士荆利杰全然不顾。手掌磨破了，没有想到去消毒；手指头出血了，没有想到去包扎；脚底被钢筋刺破了，根本没有停下来的意思……余震再次来袭，他听到有个男孩在呼救，转身就要奔向废墟，几个战友和群众将他死死拉住，拖到了安全地带。可情急之下，荆利杰双腿一软，跪了下去，大声哭喊：“我知道很危险，我知道进去了就可能回不来，但是求求你们，让我再去救一个吧！我还能再救一个！”就问一句：这世间，有没有可能，一个人的每一个举动都可歌可泣？刨挖，他重复最多的动作。▲2008年5月16日，汶川县水磨镇的公路被毁，上海公安消防救援队徒手在地震废墟中搜救幸存者。▲2008年5月15日，在北川县城参与救助的解放军官兵发现儿童的照片，忍不住痛哭。托举，他保持最久的姿势。▲令人难忘的照片《众志成城 托举生命》。山体垮塌，乱石滚成了陡坡，一条转移被困人员的必经之路被埋，再加上泡了一天一夜的雨，泥泞难行。在转移被困人员时，救援官兵用身体搭起人梯，把生命高高举过头顶。▲2008年5月13日，四川北川，刚刚从废墟中被营救出来的3岁儿童郎铮，向解放军敬礼表示感谢。这一次敬礼，以生命的名义。▲重灾区北川，官兵们抬着一位伤员走在满是瓦砾的大街上。▲战士用4个小时将86岁老人背出山外。▲2008年5月15日，绵竹市汉旺东汽中学，灾难过去80个小时，男孩终于被救援人员抬出废墟。他说，“叔叔，我想喝可乐”。▲2008年6月，四川省地震灾区彭州市湔江河边，战士趴在还没有修完的铁索桥上，组成临时的“人桥”，让小学生们从自己的脊背上爬过。逆行，他条件反射般的选择。▲2008年5月13日，四川绵阳北川县，武警战士奔向房屋坍塌现场，抢救被困伤员。▲2008年5月15日，北川县城，一位医护人员站在倒塌的废墟顶部望着整个县城，背对着镜头的他已是眼泪纵横。▲2008年5月17日，部队官兵正在向汶川映秀输送救援物资，艰难行走在沟壑纵横的道路上。▲2008年5月18日11时，直升机降落在绵竹市金花镇三江村临时停机坪，开始营救被困村民，这里是灾区最后一个孤岛。▲一位头部受伤、满脸血迹的救灾人员在四川德阳地区的绵竹市救灾现场。就连就地而眠，也是一种随时战斗的状态。▲2008年5月15日凌晨，参加抗震救灾的济南军区某部战士在汶川县映秀镇街头休息。再敬一次军礼，无怨无悔。后来的你我后来的我，长大后，成了你。▲2008年5月12日，正在丹巴县二中读高中的张国全，经历了汶川地震。2017年8月11日，九寨沟地震灾区一张军人在乱石飞泻处涉险逆行的照片刷屏，照片的主人公就是他。▲程强，12年前在送别救援官兵时，他高举横幅”长大我当空降兵”。2014年已经拿到大学通知书的他选择参军入伍，成了一名空降兵，圆了儿时梦想。▲2008年5月13日，北川中学学生李阳在武警官兵的帮助下救助自己的同学。大三时李阳选择参军入伍，他说要当个好兵，为家乡人民争气。▲蒋宇航，在废墟中被压5天5夜后，被官兵成功救出。他说：“他们给了我第二次生命，我渴望成为他们那样的人。”▲夏雪晗，亲眼见到弟弟被救，从此心生参军梦，大二入伍，苦练成为军舰操舵手。▲余会武，地震中看到官兵们奋不顾身用双手刨土救人时，深受震撼。16岁就报名参军，因年龄小被退回，大学毕业后，终于如愿成为一名特战尖兵。后来的你，揣着他的照片走过天安门，接受检阅。后来的我，前来报恩。▲疫情期间，来自四川汶川县三江镇龙竹村村民，驾驶6辆卡车日夜兼程奔赴武汉。卡车上100吨新鲜蔬菜，是当地村民的自发支援。“作为汶川人，最应该感恩！”6辆卡车上都贴着同一句话：汶川感恩您武汉要雄起！▲这是四川省第四人民医院内科四病区护士佘沙两次请战出征武汉的理由。后来的你，逆行如昔，义无反顾。▲今年除夕夜，下着雨的上海，第二军医大学150名人民解放军医护人员告别家人，从虹桥机场乘军机赴武汉参与防疫救援任务。穿过5·12 不负每一个太阳升起的日子有人说过，以前觉得国家就是一个很宽泛很抽象的概念，就像星空一样，永远存在，但遥不可及，可突如其来的灾难，让我们深切地真实地感知到国家之于一个人的意义：国家是什么？国家就是母亲，就是无论什么时候，都不会抛弃你给你托底的人。而我们的同胞就是“最可爱的人”，就是在万分沮丧绝望、孤立无援的情况下，依旧会向你伸出手的人。▲他们的名字一样，叫“震生”。那年他们对那场灾难还一无所知，但在长大后的某一天，他们会明白，自己的每一个微笑、成长中跨出的每一步，对历经苦难的家人意味着什么。5月12日，汶川地震12周年纪念日，也是护士节。这一天，注定要为生命的逝去感伤，也注定要感恩守护生命的那抹“迷彩绿”与“天使白”。在恩与痛中刻写时日，也在伤与勇中重新出发。请别忘了，是谁，给了我们重新出发的底气。内容丨央视新闻整编自军报记者 等配图丨视觉中国 中国军视网 等，如有侵权，请联系删除 编辑 | 董兴生原标题：《十二年了，这些画面仍催人泪下》阅读原文	2020-05-12 19:51	澎湃新闻·澎湃号·媒体	pp	20200512200817
202005122008172	7年前杭州置业送俩车位因拖欠物管费被二卖，法院：霸王条款	早在2013年，浙江金华永康小雷就在杭州滨江某楼盘购置了一套270平方米的房产，总价1200万，当时开发商赠送了两个车位，就在小雷购置房产的进门处。这些年，小雷一直在永康做生意。直到今年，小雷打算装修入住，才发现家门口车位被他人长期占据。别人是从开发商这里将车位转让而来的。也就是说开发商把赠送的车位二次销售了。近日，杭州滨江法院一审审结了一起车位纠纷案。图片来源：视觉中国7年前买房送配套车位当初开发商承诺的买房送配套车位，让小雷很是心动。2013年3月8日，小雷与开发商某公司签订合同，购买270平方米房产一套，总价1200余万元，附件三约定赠送地下车位2个。2014年4月20日，某公司与小雷就车位使用权转让事宜签订两份协议。因小雷长期在永康生活，该处房产一直空置。直到今年，小雷打算装修入住，才发现家门口车位被他人长期占据。一头雾水的小雷前往物业了解情况，原来他家门口本是赠送的BXX8、BXX9车位使用权已于2018年12月29日转让给他人。两个车位位于小雷房子地下的唯一出入门前，现车位受让人亦不愿意腾退车位，且长期停泊车辆，严重阻碍了小雷进出，甚至导致无法对房屋进行装修。多次协商未果，无奈之下小雷向法院提起诉讼。开发商说协议上有约定拖欠物管费就收回车位开发商在法庭中说，收回车位再度出售也是有协议约定的。在协议中约定，某公司赠送BXX8、BXX9车位使用权，房产合同中包含该地下车位使用权的转让金。协议中还约定，如小雷未在10个工作日内在指定地点办理交接手续，那公司有权终止车位使用权协议，并追索一切损失。或者拖欠车位管理服务费或其他有关费用超过6个月的，公司亦可无条件收回车位。因小雷未按照规定完成交接手续且五年内未交车位使用费6000元，所以公司才于2018年12月29日，将案涉两个车位以521000元的价格出售给案外人并已实际交付使用。图片来源：视觉中国拖欠少量物管费就能无条件收回车位是霸王条款法院认为，小雷取得对讼争车位的占有系依生效合同取得，有合法的占有权源。虽合同约定车位使用人拖欠车位管理服务费或其他有关费用超过6个月的，某公司有权终止协议、无条件收回车位，但小雷取得车位的占有、使用权利实质系通过支付购房款的方式支付某公司车位对价共42万元获得，小雷纵然无正当理由拖欠两个车位的物业服务费，每年费用也只需总计支付1200元，某公司提供的格式条款显然并未遵循公平原则确定当事人之间的权利和义务，排除了原告占有、使用车位的主要权利，应当认定为无效条款。故法院不予采信某公司的该抗辩意见，遂依法判决确认原告小雷有权占有、使用杭州市滨江区某苑地下BXX8、BXX9车位。来源：钱江晚报·小时新闻首席记者 肖菁 通讯员 滨法原标题：《小伙来杭州砸1200万买了套房，送2个车位！7年后到家门口一看，彻底怒了》阅读原文	2020-05-12 19:49	澎湃新闻·澎湃号·媒体	pp	20200512200817
202005122008173	上市券商4月成绩单：中信证券稳坐第一，14家净利环比翻倍	在4月A股市场回暖的带动下，上市券商交出了一份不俗的成绩单。截止到5月12日下午，38家A股上市券商中，有37家的4月经营业绩数据已经出炉，其中，共有13家券商营业收入超过10亿元，12家券商净利润超过5亿元，此外，有14家券商在4月份出现净利润同比翻了不止一倍的情况。据Wind统计，上市券商4月份的平均营业收入环比（较上月）增幅为137.19%，平均净利润环比增幅则高达216.88%。需要指出的是，券商行业内部分化出现加剧，不同于此前年报公布时的集体增长，也有多家券商在4月份业绩大幅滑坡。以营业收入和净利润排名双第一的中信证券，和排名双倒数第一的太平洋证券为例，中信证券的营业收入规模是太平洋证券的45倍，净利润更达到太平洋的145倍。12家券商营收翻倍，中信证券规模位列第一从营业收入看，4月份有13家券商营收超过10亿元，分别是中信证券、申万宏源证券、中信建投、海通证券、招商证券、国泰君安、中国银河、国信证券、广发证券、华泰证券、东方证券、兴业证券和光大证券。其中，中信证券以33.16亿元的营业收入位居首位，环比增长18.23%，同比（较上年同期）增长150.03%。申万宏源和中信建投分别位列第二、三名，4月营业收入为22.81亿元及21.10亿元，环比增长37.04%及81.97%。在上市券商中，多达12家实现单月营业收入翻倍，增幅最大的是红塔证券，4月营业收入3.75亿元，环比增长1559.92%。此外，兴业证券营业收入11.48亿元，环比大增860.48%；财通证券营业收入3.96亿元，环比增长581.66%，增幅都颇为强劲。不过，有10家券商出现了营业收入的环比下滑，下降幅度最大的是太平洋证券，该机构同时也是营业收入规模最小的上市券商，4月营业收入仅为7373万元，环比大降50.14%。14家券商净利润环比翻倍，方正证券进步最大增39倍要论赚钱能力，中信证券依然稳坐第一把交椅，4月份净利润为15.57亿元，环比增长26.65%，同比增长195.78%。Wind统计显示，4月份净利润超过5亿元的A股上市券商有12家，除了中信证券，依次为申万宏源、中信建投、海通证券、中国银河、招商证券、国泰君安、华泰证券、广发证券、国信证券、光大证券和东方证券。其中，中信证券、申万宏源和中信建投这前三甲的营业收入在10亿元以上。值得一提的是，中信建投的营业收入环比增速高达96.16%，接近翻倍。中型券商的净利润增幅明显更胜一筹，方正证券4月净利润环比激增3947.49%，长江证券的增幅也高达1009.65%。此外，红塔证券、西部证券、中原证券、财通证券等中型券商的净利润环比增幅都在300%以上。共有14家上市券商的4月净利润环比增幅超过1倍。与此同时，净利润相比3月份出现下滑的同样有10家券商，其中，太平洋证券依然表现最为逊色，净利润规模仅为1074万元，环比大幅缩水84.58%。股市回暖是业绩改善的因素之一天风证券的研究报告指出，4月券商整体业绩环比改善，除了3月份低基数的因素之外，主要是因为两方面。一是4月主要股指反弹，带动券商自营业绩回暖。二是投行业务中，IPO承销规模翻倍，债券承销略有放缓。从二级市场来看，沪指4月份累计上涨3.99%，深证成指累计上涨7.62%，创业板指累计上涨10.55%。二级市场的回暖，一方面能够活跃投资者的交投情况，带动券商经纪业务收入增长，另一方面也将直接改善券商自营收入表现。而从一级市场的情况来看，IPO业务也出现明显回暖。据方正证券统计，IPO业务在4月份结束了疫情期间连续两个月的环比负增长，4月IPO规模143亿元。不过，受3月高基数影响，4月再融资规模522亿元，环比下降57%，行业债券承销规模单月8472亿元，环比下降24%。从政策环境来看，券商行业近期利好频发。方正证券认为，创业板注册制改革是资本市场改革中最值得关注的政策之一，预计将带动全年IPO规模的高增长。2020年直接融资政策不断落地，包括再融资新政、并购重组松绑、公司债与企业债的注册制等，预计随着疫情缓和、投行项目进度恢复，全年再融资、债券承销业务规模有望重回正增长。天风证券则认为，近日境外机构投资者新规落地，有利于外资参与国内金融市场；创业板注册制改革配套政策衔枚疾进，后续各类衍生品业务推出等利好政策有望陆续落地，政策利好叠加流动性改善有望继续提振券商股估值。据该机构金融行业分析师罗钻辉判断，2020年一季度，证券行业受到高基数的影响，业绩同比出现下滑，后续随着基数效应影响逐步消除，预计行业业绩增速有望逐步回升。券商股将再次进入政策利好期叠加流动性改善期，从投资的角度看，推荐华泰证券、中信证券、国泰君安、海通证券，同时建议关注中信建投H股。(本文来自澎湃新闻，更多原创资讯请下载“澎湃新闻”APP)	2020-05-12 19:45	澎湃新闻	pp	20200512200817
202005122008174	西安饭店与餐饮行业协会：将联合政府和媒体开展食品安全检查	5月12日，就媒体报道的“苏福记城市立方店菜品出现烟头、后厨员工操作台违规吐口水现象”一事，西安饭店与餐饮行业协会在其微信公号发布通知，表示将联合政府相关部门和媒体在会员企业中进行为期一个月的食品安全宣传、检查。据媒体报道，5月10日下午两点，市民郑先生在西安城南城市立方5楼的苏福记吃饭时，觉得有一道菜口味有些重，并要求服务员重新上一份。等看到重新端上的菜品时，郑先生吓坏了，发现里面竟然有一个烟头。随后郑先生查看了监控，发现厨师在后厨不仅没有佩戴口罩，还疑似弯腰朝炒菜的锅里吐口水。当晚，事发商场发布通知对苏福记餐厅进行停业整顿。11日，雁塔区市场监管局责令西安逸雪餐饮服务有限公司（西安“苏福记”城市立方店）立即停业整改，拟处以10万元罚款并吊销其《食品经营许可证》的处罚。西安饭店与餐饮行业协会表示，此次事件虽是极个别厨师所为，但在社会上造成了一定的负面影响，并引起政府部门高度重视。在西安市饭店餐饮业艰难复苏关键时期，西安饭店与餐饮行业协会要求会员企业和相关从业人员要加强行业自律，保障饮食安全，提高职业素养，为此协会联合政府相关部门和媒体在会员企业中进行为期一个月的食品安全宣传、检查工作。检查结果将在协会公众微信号里向大众进行通报，对优秀的企业在相关媒体予以表扬和宣传报道，对做的欠缺的企业现场提出整改意见，并后期进行监督检查，向公众报道检查结果。(本文来自澎湃新闻，更多原创资讯请下载“澎湃新闻”APP)	2020-05-12 19:44	澎湃新闻	pp	20200512200817
202005122008175	网恋新骗局，这次是所谓的“联合国医生”	近期，上海浦东警方成功劝阻一起电信网络诈骗案件，避免经济损失36万元。李女士的“联合国医生”男友给她130万美金，但需先支付36万费用，姑妈知道后紧急报警求助。	2020-05-12 19:41	澎湃新闻	pp	20200512200817
