id	title	txt	datetime	source	web	batch
2020052116031535	CARES法案：美国的货币化救赎与中国的全球化应对	一、无限量化宽松：不计代价的“流动性救市”政策为了应对突如其来的新冠肺炎疫情而可能产生的金融危机，美联储再次启动非常规货币政策工具：3月15日，美联储决定将联邦基准利率目标区间降至0-0.25%，并启动无限量量化宽松计划（QE），首批启动7000亿美元量化宽松计划，以为金融市场注入流动性；3月17日，美联储宣布设立得到100亿美元财政部信用保护的商业票据融资机制（CPFF）；3月23日，美联储宣布将购买“必要规模”的国债和抵押贷款支持证券，以支持市场平稳运行和货币政策的有效传导，并把机构商业抵押贷款支持证券纳入购买范畴。同时，美联储还宣布了将会进一步扩大对于货币市场共同基金流动性便利工具（MMLF）的规模。量化宽松政策的根基，是央行要有能够提供流动性支持的充足“弹药”，这些“弹药”可以是国库的盈余，也可以是央行的“储备现金”（广义概念），当然还可以是通过“印钞”的手段增加货币供应量。而就美国自身的财政现状而言，能够供美联储实施货币宽松政策的库存“弹药”并没有多少，只能选择新造“子弹”方式以实现量化宽松的目标。也正是基于此，才有了3月26日美国参议院在“扶贫”“扶困”“扶难”名义下发起的美国史上最大规模的财政刺激计划，即通过新发2万亿美元规模的国债以向特定人群进行定向资助。3月27日，特朗普在众议院通过当天就签署了这个《冠状病毒援助、救济、经济保障法案》（Coronavirus Aid, Relief, and Economic Security Act，简称《CARES法案》）。二、美元的货币化救赎：美联储的秘密与超发的溢出路径与全球其他国家法定货币的发行方式不太一样，美元的发行并不是直接来源于所谓的“央行信用”，也就是说，它并不是通过作为政府附属部门或者代理的中央银行直接发行货币而产生政府“负债”，其是美国政府通过提供支付担保物（比如金属货币或者政府债券）再加上美联储的“票据兑换”这一环节而完成美元的发行。从法律本质上，美联储的地位会可能出乎大多数人的意料：美联储既没有储备，甚至其连银行都算不上。美联储的初衷原本是少数几个金融寡头为了将特定卡特尔成员之间的竞争最小化而试图动用政府的政治力量来维护卡特尔利益的协定，而非现在这样充当“货币政策”“银行的监管”和“向银行系统及美国政府提供金融服务”这三种基本职能的中央银行角色。其是寡头银行家们为了避免竞争而试图成立的一种另外的“金融卡特尔”。虽然美联储以“英格兰银行”模式作为样本，但在“欧规美随”的过程中，为了避免在联邦体制下对于联邦铸币权的违宪性争议，《1913年联邦储备法案》特意回避了“银行”或者“中央”的字眼，设计出一种既规避“银行”字眼但又暗含联邦政府形象的新型机构，由此美联储这一名词才横空出世。早期的美联储发钞也是遵循纯粹的“金本位”制度。作为应对1929年经济大萧条的经济刺激政策的一个组成部分，美联储在1934年的《黄金储备法》后降低了对于发钞的黄金储备要求，对美元发行采取了40%的黄金储备比例要求（后来进一步降到25%）。而1944年后的布雷顿森林体系确立了西方各国“以美元为锚”的联系汇率制度，美元则以每盎司35美元的固定价格盯住黄金，从而将西方主要国家货币变为通过美元挂钩黄金的间接金本位制，美元至此开始成为“世界货币”。1971年，因为无法继续承受超发美元挂钩黄金的备兑担保义务，尼克松政府宣布美元与黄金储备的脱钩，从而使得美元成为100%的纸币制度，完全成为美国政府的主权信用。如果按照传统货币经济学理论，美元脱钩金本位后，美元的发行量应该有一个上限，该上限应该跟美国国家的财政能力紧密相关。但在“马歇尔计划”的加持下，北约国家愿意以相对稳定的美元作为美欧、欧欧之间的贸易结算单位，美元成为了西欧各国可被广泛接受的“稳定币”，并逐渐因为美国的国际影响力成为国际市场石油、黄金、有色金属、农产品等大宗商品交易的基本计价和结算工具。在此背景下，以伦敦为中心的欧洲离岸美元市场的迅速增长促进了美国本土以外的境外美元数量，这大大减轻了美元回流美国本土而导致通货膨胀的压力。而随后以亚洲四小龙和中国崛起为标志的亚太经济共同体也承接欧洲吸纳了越来越多美元资产，这使得尽管以美国国债为基础的美元发行已经远远超过美国本土对于货币的总体需求（即货币超发），但却并没有因此引起美元货币在其境内的大规模贬值，这其实也就是“美元霸权”的最大好处与核心秘密。 三、中国的应对：“大水漫灌”的美元与“小火慢炖”的人民币按照美联储前主席伯南克的说法，因为中美经贸关系和美元作为世界主要结算货币的地位，人民币与美元之间的关系是几乎呈现“绑定”的状态。尽管2008年次贷危机时美联储的三次量化宽松政策导致美元持续贬值，但美元贬值（对应人民币的升值）的过程反而促进中国进口贸易质量的转型，中国得以进口大量质优价廉的境外产品，从而有助于中国经济的从量到质的提升。而大量的外汇储备也促进了中国企业“走出去”成为瞩目的全球买家。而美元的贬值则进一步促进了跨国企业对于中国的投资力度，助力我国外商投资（特别是外资并购）规模和质量再上新的台阶。总体上看，中国可以算是有惊无险地应对过了2008年次贷危机所引起的美元量化宽松政策。但如今的局面与十年前不同：一方面，特朗普上台后中美关系持续紧张，美元在本轮量化宽松的贬值不仅会直接影响到我国对美出口的贸易数量，而且将持续影响到中国产品在国际市场的竞争力，进而影响外贸型经济对于中国经济发展的拉动力；另一方面，改革开放四十余年来我国累积了大量的美元外汇储备，这些美元储备既是我国经济发展的重要推动力，又会成为我国宏观经济调控的不稳定因素：美元储备的变化会直接影响到国内货币供应的增加（以新发人民币进行美元结汇）或减少（以存量人民币进行美元结汇），由此在采取货币政策措施时可能产生对于“通货膨胀”或者“通货紧缩”的两难选择问题。除此以外，美联储新一轮量化宽松政策会进一步拉低美国国债的收益率，造成我国所持有的巨额美国国债的投资损失。在中国已经成为全球第二大经济体的背景下，作为应对本次美元量化宽松政策全球溢出威胁的策略，我们认为，在战略上，应该更加重视“一带一路”政策在我国经济发展、国家安全上的重要地位，举国上下应该正确理解“一带一路”的意义和目的；在战术上，应该利用我国现有“世界工厂”的地位，在帮助“一带一路”国家进行抗疫的同时，要想尽办法扩大与“一带一路”国家的进出口贸易量，通过对“一带一路”国家贸易的“增”来化解欧美贸易量的“减”，全力在“一带一路”沿线国家推动以人民币为结算货币的贸易方式。同时，在对外援助上改变“无偿捐助”方式，转向无息“人民币贷款”方式，以“一带一路”国家多点的人民币离岸市场发展的“小火慢炖”方式，化解美联储“大水漫灌”所导致的美元通胀对全球的溢出效应。无论是对于美元，还是人民币，抑或是其他国家的主权货币而言，“今天的星球不仅相互联系，而且相互依存，甚至是在很多方面的相互融合。这已经带动了相当多的经济增长。但这同样意味着，当某一地区出现问题时，比起从前任何时候，麻烦都能传播地更远、更快、更深入、并且更容易”。在此，引用《规则制定者，规则破坏者：紧密和松散的文化如何连接我们的世界》一书作者Michele Gelfand教授的一个看法，“在所有的不确定性当中，我们需要牢记的是，病毒的发展轨迹不仅同冠状病毒的性质有关，而且也同文化有关系。在接下来的日子里，我们的松散文化需要一次大转型”，衷心希望包括中美在内的全世界的命运共同体，在本次疫情的影响下都能转型成功！（作者郑彧为华东政法大学国际金融法律学院教授）(本文来自澎湃新闻，更多原创资讯请下载“澎湃新闻”APP)	2020-05-21 15:27	澎湃新闻	pp	20200521160315
2020052116031536	苏宁体育携手中学生体育协会，借助国米青训资源提升中国足球	本周，中国中学生体育协会与苏宁体育召开“云”发布会，正式宣布双方达成战略合作，未来双方将从校园公益、赛事推广和青少年培训等方面展开深度合作。一方是中国中学生运动的唯一全国性群众组织，一方是国内著名的体育产业公司。很显然，这次携手对于推动中国校园体育、刺激体育产业发展都将带来积极作用。 “苏宁体育深耕足球领域多年，中体协希望与苏宁体育携手，充分利用苏宁生态的实力以及苏宁体育的经验，共同探索一条校园足球与职业足球共荣的教体融合新思路，让足球教育深入校园，扎根校园。”“未来双方还将一起探讨并开拓更多校园体育领域的合作，合力促进中国校园体育事业的发展。”会上中体协主席薛彦青对于合作给予了高度肯定。 事实上，苏宁体育创立之初就致力于体育公益和青训来帮助青少年足球发展，截至目前推出的足球公益项目捐建了爱心体育教师2000多所，组建农村小学足球队100多所，举办公益联赛537场，培训教练759人次，捐献足球设备11070套，并通过旗下PP体育大力推广青超联赛、足球小将等青少年足球赛事。 据悉，随着战略合作的达成，苏宁体育将正式成为中体协“我是体育教师”公益项目的官方新媒体合作伙伴，并以“我是体育教师”、“苏宁体育公益行”为主线，大力推广校园公益体育。此间， 苏宁体育集团常务副总裁王冬表示：“合作可以通过师资力量的加强、大数据的应用、培养模式的优化来完成，让青少年在满足文化知识学习的教育环境下接受更全面科学且专业的足球训练……苏宁也希望调动更多的社会力量、市场力量，让校内下外形成合力培育出一个良好的校园体育文化。” 在中国足球的发展中，青少年足球发展被认为是重中之重，而国务院办公厅在2019年印发的《体育强国建设纲要》中，“青少年体育发展促进”位列九大工程之一，这意味着无论从体育强国的目标还是从项目发展以及市场的需要来看，青少年体育都被赋予了重要意义。 值得一提的是，发展青少年体育除了政策扶持、协会牵头组织之外，也需要借助社会和市场的力量，从这个角度看，眼下苏宁体育的入局无疑带来了诸多期待。众所周知，苏宁体育旗下拥有中超江苏苏宁俱乐部和意大利国际米兰俱乐部，拥有大量的青训资源及出国深造的机会，不仅可以从广度上覆盖大量中学生足球运动员，还可以为其中的佼佼者提供了一条清晰可见的上升通道。此外，得益于旗下媒体平台PP体育，苏宁体育也将为校园体育的推广实现升级。 王冬透露：“与中体协合作后，PP体育不仅会直播报道中学生足球联赛，推出线上足球推广课程，共建中学生足球媒体矩阵，更重要的是作为媒体，与中体协一起进行校园体育的公益推广，其中会加入全国苏宁所有生态的资源，打破原本校园体育的推广壁垒。”听上去，因为苏宁体育的助力，青少年体育在各个细分领域都将得到强大的支撑。 当然，服务青少年体育除了公益之外，也符合苏宁体育作为一个市场化公司的发展思路。此前PP体育已经在泛体育、泛娱乐领域进行布局，疫情爆发、赛事停摆对于各行各业都有打击。非常时期，依赖赛事内容的PP体育也在加速拓展新的业务，健身、电竞、直播等板块进一步走向前台，PP体育不再仅仅是围绕版权的直播和赛事报道平台，也将成为提供综合性体育服务的平台，这意味着用户年龄有进一步下沉的空间，用户群体有进一步拓展的空间。而校园人群是一块相对洼地，通过携手中体协、涉足青少年体育，苏宁体育找到了新的突破口。简而言之，对于双方，这是一个共赢的合作，未来合作能够呈现出怎样的效果，则取决于双方能否长期发展，如何精细化、专业化地运营。(本文来自澎湃新闻，更多原创资讯请下载“澎湃新闻”APP)	2020-05-21 15:24	澎湃新闻	pp	20200521160315
2020052116031537	受新冠疫情影响，日本累计失业人数接近1万	央视新闻5月21日消息，当地时间21日，日本厚生劳动省消息称，截至20日，日本因新冠肺炎疫情相关情况遭到解雇或停止续聘的人数已达9569人。自从4月初日本政府发布“紧急事态宣言”以来，随着企业停业，日本失业人数剧增，累计失业人数已接近1万人。尤其是经营基础薄弱的中小企业纷纷采取解雇员工或停止续聘的措施，日本厚生劳动省认为，解雇风潮可能还将继续扩大。根据日本厚生劳动省发布的统计数据，按月份来看，遭解雇或停止续聘的人数分别为：2月282人，3月835人，4月2654人，5月5798人。按行业来看，宾馆住宿、旅游大巴、出租车等旅游相关行业和餐饮业居多。目前，日本政府推出“雇用调整补助金”等降低失业率的政策。（原题为《受新冠肺炎疫情影响 日本累计失业人数接近1万》）(本文来自澎湃新闻，更多原创资讯请下载“澎湃新闻”APP)	2020-05-21 15:23	央视新闻	pp	20200521160315
2020052116031538	全国政协常委会工作报告：动员政协各级组织等参与疫情防控	在全国政协十三届三次会议开幕会上，全国政协主席汪洋代表政协第十三届全国委员会常务委员会作工作报告。 ​​​​全国政协常委会工作报告说，动员政协各级组织、各参加单位和广大委员参与疫情防控斗争。发挥委员移动履职平台、小范围协商座谈、提案办理、反映社情民意信息等作用，就疫情防控、复工复产、稳定社会预期、加强依法治理等积极建言，报送情况反映、意见建议1300多条。 ​​​​(本文来自澎湃新闻，更多原创资讯请下载“澎湃新闻”APP)	2020-05-21 15:23	新华视点	pp	20200521160315
2020052116031539	全国政协常委会工作报告：邀请党外委员谈心交流316人次	全国政协常委会工作报告说，在过去一年多的工作中，坚持寓思想政治引领于团结民主之中的谈心谈话等制度，全国政协党组成员分别邀请党外委员谈心交流316人次。开展学习塞罕坝精神等11次党外委员专题视察，召开10次重点关切问题情况通报会，举办16期委员讲堂，组织26场重大专项工作委员宣讲，举办2次全国政协机关公众开放日活动。(本文来自澎湃新闻，更多原创资讯请下载“澎湃新闻”APP)	2020-05-21 15:22	新华视点	pp	20200521160315
2020052116031540	午后跳水：市场量能不足，三大股指收跌，茅台股价再创新高	A股市场5月21日量能不足，震荡依旧。受隔夜外围市场影响，A股市场5月21日双双高开，但沪指受到2900点整数关压力停滞不前。由于成交量的不足，近期市场热点的持续性相对不佳，因此沪深两市涨跌不一。午后，两市震荡下探最终低收。至5月21日收盘，上证综指跌0.55%，报2867.92点；深证成指跌0.94%，报10845.4点；创业板指跌0.88%，报2099.43点。5月21日，沪深两市成交总额6262亿元，较前一交易日的6867亿元减少605亿元。其中，沪市成交2506亿元，比上一交易日2692亿元减少186亿元，深市成交3756亿元。沪深两市共有67只股票涨幅在9%以上，21只股票跌幅在9%以上。北向资金5月21日合计净流入21.31亿元，为连续5日净流入。其中，沪股通净流入21.58亿元，深股通净流出0.27亿元。科创板18涨1平86跌。涨幅最大的为新上市的奥特维（688516），收涨167.18%；跌幅最大的光云科技（688365）收跌9.12%。广电系领涨，茅台股价再创新高在板块方面，受中移动联手中国广电共建5G无线网络消息的影响，广电系板块领涨两市，湖北广电（000665）、广电网络（600831）、广西广电（600936）等涨停，贵广网络（600996）一度涨停。白酒股涨幅靠前，贵州茅台（600519）股价再创历史新高，最高摸至1371.96元/股。此外，金徽酒（603919）一度涨停，酒鬼酒（000799）涨逾6%。半导体板块出现深幅调整，晶方科技（603005）、富满电子（300671）、晓程科技（300139）等跌逾5%。光刻胶板块更是领跌两市，晶瑞股份（300655）、飞凯材料（300398）、江化微（603078）、上海新阳（300236）等跌逾5%。短期成交量维持低位，制约了反弹空间国泰君安认为，市场围绕当前位置反复震荡，短期成交量维持低位，制约了反弹空间。操作上建议保持一份谨慎，在明确的政策机会出来之前，建议稍安勿躁，切勿追涨杀跌。华鑫证券认为，本轮反弹行情已经处于尾部阶段，能否打开新的反弹行情，量能是至关重要的一步，当然可以是强有力的外部利好推动，不过目前市场均不满足，而指数近一阶段的窄幅震荡，也暗示出变盘时间点已经临近。东莞证券认为，大盘技术面适度回补前期跳空缺口，短线略有走弱，不过中线趋势仍较强，加上北向资金持续净流入，预计短线震荡后仍有逐步企稳机会，关注成交量变化及2900点压力。操作上建议关注金融、基建、机械设备、军工、TMT等行业。　山西证券认为，短期市场料将延续震荡走势，债券收益率上行风险对短期权益市场估值形成一定压力，同时市场缺乏明确主线行情，资金抱团取暖导致个别板块资金拥挤、估值显著偏高，短期存在回调压力。此外，有关政策预期将对后期市场运行方向、行业分化、主题演绎产生强烈影响。预计国债和地方债发行将进一步放量，财政发力有望对下半年经济产生更显著的拉动效果。行业配置方面，建议持续跟进大基建（建筑、建材、机械、钢铁）、部分新基建（5G、云计算、大数据中心等），以及促消费（汽车、小家电、国内旅游）等领域的相对确定性较高的投资机会。(本文来自澎湃新闻，更多原创资讯请下载“澎湃新闻”APP)	2020-05-21 15:22	澎湃新闻	pp	20200521160315
2020052116031541	天津建省部共建组分中药国家重点实验室，张伯礼任主任	5月20日，科技部网站发布《科技部 天津市人民政府关于批准建设省部共建组分中药国家重点实验室的通知》。根据通知：天津市科技局为实验室的主管部门，建设运行期内，在中央引导地方科技发展专项资金中优先支持实验室发展，在市重大科技计划项目申报中给予优先立项支持，在实验室团队建设、高端人才引进、领军人才培养和科研条件建设等方面给予重点保障。天津中医药大学是实验室的依托单位，须为实验室建设提供实验用房、科研仪器设施、科研经费等必要的基础条件，并在人才引进和培养等方面给予重点支持。实验室建设运行期内，天津中医药大学5年提供不低于5500万元基地建设和运行经费，主要用于实验室设备购置、条件保障、日常运转、自主研究和对外合作交流，支持实验室探索建立符合科技创新规律的管理模式和制度，给予相对独立的科研自主权和人事决定权。张伯礼为实验室主任。组分是什么？这个实验室又有哪些特色？日前，记者探访实验室一起来听听张伯礼院士的介绍。中医药大学世界最大中药组分库世界最大中药组分库，储备6万多份中药组分据了解，作为该实验室一大特色，天津中医药大学拥有目前世界最大的中药组分库，现已储备了6万多份中药组分。抗击疫情中，有它一份功劳！在天津中医药大学中药组分库，记者见到了保存在恒温恒湿柜中的一瓶瓶粉末状的中药组分。“中药组分，就是从传统中药中提取出有效的成分群，可在细胞、分子药理水平相对清楚地揭示中药的药效物质基础及作用机制，并能根据不同病症重新配伍成方，可制成胶囊、压片、注射剂等。”中国工程院院士、天津中医药大学校长张伯礼介绍说，“在此次抗击疫情的临床实践中，我们发现虎杖这味药的中药组分对新型冠状病毒有较强抑制作用；马鞭草组分对肺小支气道具有明显抗炎功效，可阻止形成包裹沉寂病毒的痰栓，从而有效避免患者‘复阳’。我们将这样的有效组分提取出来，制成‘宣肺败毒方’，实践证明，其治疗新冠肺炎疗效确切，药理证实，可对新型冠状病毒引起的炎性风暴起到有效抑制作用。”张伯礼院士介绍中药组分数据库检索事半功倍，为现代中药提供资源平台“中药组分库有目前国内包含中药组分数量最多、中药有效成分数字化模型最多、检索速度最快的数据库。过去筛查中药有效成分往往需要约半年时间，如今通过关键词在数据库中检索，很短时间便可得出结果，指导有针对性的实验研究，事半功倍。”张伯礼说，中药组分库把传统中药赋予现代科技内涵，有助于加快我国中医药现代化的进程，对开发新药、改造老药、提高中药制剂水平以及给我国自主创制疗效明确、质量可控、服用量小的“精致型”现代中药提供了重要的资源平台。（原题为《天津将再添省部共建国家重点实验室！张伯礼任主任》）(本文来自澎湃新闻，更多原创资讯请下载“澎湃新闻”APP)	2020-05-21 15:21	“天津日报”微信公号	pp	20200521160315
