id	title	txt	datetime	source	web	batch
2020051220081771	清华“强基计划”启动，五个新书院首任院长正式任命	5月12日下午，清华大学举行“强基计划”启动会暨书院院长聘任仪式，正式任命李艳梅、王中忱、梁曦东、刘铮、李俊峰五位教授分别为致理书院、日新书院、未央书院、探微书院、行健书院首任院长。澎湃新闻（www.thepaper.cn）记者从清华了解到，为实现“强基计划”人才选拔与培养的一体化管理，推进完善以通识教育为基础、通识教育与专业教育相融合的本科教育体系，清华新成立致理、日新、未央、探微和行健五个书院。五个书院的名称取自“人文日新”和清华校歌。清华今年“强基计划”招生专业被分为基础理科学术类专业、基础理科工程衔接类专业和基础文科类专业三类。其中，基础文科类专业的培养单位为日新书院，基础理科类专业的培养单位为致理书院。理工衔接类专业的培养单位为另外三个书院。作为国家长远发展的重要战略部署，“强基计划”要为国家若干关键领域的重点突破培养拔尖创新人才。清华党委书记陈旭表示，清华将把“为国选材、厚植强基、拔尖领军、创新未来”作为人才选拔培养的定位，在优中选优的基础上深耕培育、多措并举，坚定不移推进各项工作，并以此为契机，加大教育教学改革，开展高水平通识教育，持续探索因材施教、科教融合、本硕博衔接的培养模式，推动本科育人质量全面提升。陈旭希望五个书院作为学校本科人才培养改革试点单位，坚持正确办学方向，坚守立德树人初心，坚定为国育才信念，继承和弘扬清华大学人才培养的成功经验，积极探索创新体制机制，面向国家重大需求，立足关键核心领域，高起点、高标准、高质量地全面开展本科人才培养和书院建设各项工作，促进学生德智体美劳全面发展，培养文理基础扎实、创新本领突出的未来拔尖领军人才。清华校长邱勇还介绍，新设立的五个学院不会有自己的学科和专任任课教师，书院的根本任务是以学生为中心，切实提高人才培养的成效，使学生在本科学习期间获得广阔的成长空间和更大的成长幅度，为将来成才、报国打下坚实基础。关于“强基计划”理工双学位的设计，邱勇表示，学科交叉融合是获得重大创新成果的重要途径，也是培养高层次创新人才的重要平台。理学侧重探究事物原理，工学侧重解决实际问题，理论创新为实践创新奠定重要基础，实践创新为理论创新提供强大动力。理工双学位的设计，通过多学科之间培养方案的有机融合，强化学生基础学科的知识和能力，引导学生自觉面向国家重大战略领域进行钻研探索，同时为学生提供跨学科、多样化的学习和发展计划，在学科交叉基础上培养更高水平的拔尖创新人才。“理工双学位的设计符合‘强基计划’的理念，也符合创新人才培养规律，突出了基础学科的支撑引领作用，有效强化学生科研创新能力，是结合国家需求和清华特色精心设计的培养项目。”邱勇说。(本文来自澎湃新闻，更多原创资讯请下载“澎湃新闻”APP)	2020-05-12 18:32	澎湃新闻	pp	20200512200817
2020051220081772	中新网评：为什么美国新冠病亡数远超越战、朝鲜战争阵亡数？	中新网5月12日消息，美国总统特朗普近日在白宫受访时表示，新冠病毒大流行是美国所遭受的最沉重打击，比珍珠港或“9·11”恐袭事件都更为严重。特朗普所言不虚，但情势发展可能更糟。截至5月12日，美国新冠肺炎确诊病例超130万，死亡人数超8万。自2月6日美国出现目前已知的首例本土新冠死亡病例后，因疫死亡数字在3月31日突破3000人，超过“9·11”恐袭遇难人数。此后近一个月，该数字在4月28日达到58356人，超过美国人视为“噩梦”的朝鲜战争和越南战争。白宫抗疫工作小组专家博克斯(Deborah·Birx)此前预测，即使民众严格遵从指引，死亡人数仍将介乎10万至24万人，预估最低死亡人数将是朝鲜战争与越战美军阵亡人数总和，与一战阵亡美军数相同，14倍于在伊拉克和阿富汗阵亡的美军。若政府不限制民众社交，最糟情况下美国新冠病亡数将达150万至220万人。自第二次世界大战以来，美国一直稳居全球军事、经济和科技霸主，且坐拥最先进的医疗资源。外界不解，美国缘何握着一手好牌，却交出了病亡数远超两大“噩梦”般战事的抗疫答卷？表现为何甚至不如一些发展中国家？究其根本，美国令人痛心的病亡数字背后，错在“人祸”。战争中面对看得见的敌人，撤军商停尚可止损；但面对杀人无形的病毒，人类本就无路可退，遑论在天灾之外背负人祸，后果可想而知。自疫情暴发以来，华盛顿首先错在始终与科学逆向而行，导致防疫局面混乱失序，患者性命缺乏可靠保障。从“强光照射治新冠”到“体内注射消毒水疗法”，再到“疫情在夏季奇迹般消失”，误人性命的官方调侃常有。官方发布沦为政治秀场，备受民众信赖的传染病专家和药品官员被排挤、解职。白宫冷对科学，让政治先行，专业让路，皆因半年后至关重要的大选议程。当下，疫情的不断发酵已给美国经济、社会带来重创，一旦失业率持续居高不下，引发企业倒闭潮，进而危及金融稳定，主打“经济牌”的本届政府或将失去选民支持，增加连任不确定性。巨大的选举利益面前，病患性命在政客眼中微不足道。因为选情，美国政府从疫情伊始便不断渲染隔岸观火的乐观情绪，淡化疫情严重性和可能的危害。美国内外的观察人士普遍认为，华盛顿的怠慢浪费了中国抗疫争取来的6周黄金备战期，导致美国病亡人数激增，成为疫情震中。也正因选情，白宫以抬高预估病亡数字的方式，降低选民心理预期，减轻民怨对选情的影响。更因选情，现届政府不顾专业意见质疑，忽略疫情二次打击可能付出的生命代价，冒巨大风险重启经济。更严重的是，美国政府看待这场疫情的态度和对战争的定性至今仍偏离正确轨道。虽然特朗普6日再对病毒宣战，否认中国是美国敌人。但疫情以来，无论白宫还是国会山，都始终将中国视为敌人，而非病毒。政客们在炮制“甩锅”中国谣言上费尽心机，却在防控疫情上领导缺位。在其影响下，皮尤研究中心上月民调显示，尽管有三分之二美国人对中国有负面看法，但受访者中有相似比例的人认为，美国在疫情控制方面行动得太慢。可见，散播政治病毒的效果未必损人利己。面对这场损失惨重的“隐形战争”，美国不仅应看到自己的敌人并非中国，而是病毒；更重要的是要拿出实际行动敬畏生命，停止散播“政治病毒”，与国际社会一道集中精力、全心抗疫。（原标题《为什么美国新冠病亡数远超越战、朝鲜战争阵亡数？》）(本文来自澎湃新闻，更多原创资讯请下载“澎湃新闻”APP)	2020-05-12 18:32	中新网	pp	20200512200817
2020051220081773	让红色党课“潮”起来，上海一街道建起家门口的“四史”学堂	宣讲人员向居民宣讲“四史”。   本文图均为 虹口区四川北路街道 供图5月12日中午，一场线上学“四史”云党课在山阴路69弄恒丰里开课。开课当天，澎湃新闻（www.thepaper.cn）记者从上海市虹口区获悉，1926年，中共中央党校曾设在恒丰里，这里也是上海工人第三次武装起义指挥部联络点、中共江苏省委机关所在地。而在四川北路街道辖区内，像恒丰里这样有着红色印迹的里弄有数十个，是“四史”教育丰富的学习资源。宣讲人员向居民宣讲“四史”。为此，该街道党工委将开展党史、新中国史、改革开放史、社会主义发展史“四史”学习作为工作重点，依托区域内丰富的红色资源，打造“一幅红色党建地图、一条红色文化线路、一张网格党建网络、一批身边党群服务阵地、一套海上初心精品党课、一系列党建引领社区治理品牌项目”等“六个一”党建工作运行机制，整合57处红色文化资源，建起家门口的“四史”学堂，开展“四史”教育全覆盖。在“四史”教育中，四川北路街道还充分挖掘社区内的海派建筑、石库门里弄、历史文化风貌区内的红色人物、红色基因、红色故事，制作了“走街川巷——一幅红色党建地图”。该地图不仅标注出了区域内的红色文化点位，还将地区内的各类党群服务阵地、网格党建体系标注其中，形成红色资源、党群服务、公共文化相互对接的新时尚。学“四史”云党课同时，虹口借助该区区委党校、中共四大纪念馆、海派文化中心、左联会址纪念馆等丰富资源，推出“海上初心—行走中的党课”、“川城青流—青年党员讲好红色故事”、“川晶秀俪——向文化名人学习家风”、“红色文化与历史建筑文韵相册”等活动项目，赋予其学习“四史”新的内涵。四川北路街还与上海移动、虎扑文化、一直播等企业合作，组织开展“电波不逝、信念永存”、“三香弄堂红色血脉”等主题党课直播活动，获得了社会广泛好评。学“四史”云党课四川北路街道党工委负责人表示，为了更好地从不同维度开展好“四史”教育，街道将社区党群服务中心、市民驿站党群服务站、居民区党群服务站与街区党群服务站的升级建设与家门口的“四史”学堂同规划、同构建，重点在山一、山二、山三等“茶香、书香、花香”于一体的“三香弄堂”党建引领下的里弄共治平台中形成系统学习安排、各类书单、课程菜单、资源清单、任务要求，将这些居民区党群服务站逐步打造为主题突出、内涵丰富、具有原貌的“四史”学堂和坚守初心、奋发作为的社区议事共治场所，让红色文化“火”起来、让红色资源“活”起来、让红色党课“潮”起来。(本文来自澎湃新闻，更多原创资讯请下载“澎湃新闻”APP)	2020-05-12 18:31	澎湃新闻	pp	20200512200817
2020051220081774	舒兰疫情形势严峻，市民自发上街消杀	5月11日，吉林舒兰疫情防控进入战时状态，当地农机电老板自愿出动3台农用喷药车，并将车辆装上消毒液，对市区街道进行消杀。	2020-05-12 18:30	澎湃新闻	pp	20200512200817
2020051220081775	伊朗新增确诊病例1481例，累计确诊110767例	央视新闻5月12日消息，根据伊朗卫生部最新消息，过去24小时，伊朗新增新冠肺炎确诊病例1481例，新增死亡48例。截至当地时间12日中午，伊朗累计确新冠肺炎病例110767例，其中88357例康复，6733例死亡，2713例重症。截至12日，伊朗累计进行了615477次检测。（原题为《​伊朗新增新冠肺炎确诊病例1481例 累计确诊110767例》）(本文来自澎湃新闻，更多原创资讯请下载“澎湃新闻”APP)	2020-05-12 18:30	央视新闻	pp	20200512200817
2020051220081776	法国解封日，中国女孩戴1米帽上街引围观	当地时间5月11日，法国逐步解除“封锁令”。解封首日，一名中国女孩戴着自制的“一米帽”上街，吸引了路人的注意。她希望以此提醒民众保持安全距离，同时保护自己。	2020-05-12 18:29	47	pp	20200512200817
2020051220081777	上海中环花苑暂停丰巢快递柜，居民商户这样说	5月12日，在中环花苑的丰巢快递柜被喊停之后，澎湃新闻记者来到中环花苑走访居民与快递驿站经营者，采访他们对于小区业委会抵制丰巢的看法。	2020-05-12 18:29	澎湃新闻	pp	20200512200817
2020051220081778	登峰测极｜因珠峰天气原因，修路队员撤回6500米前进营地	记者12日从2020珠峰高程测量登山队了解到，受天气影响，修路（即在山体上铺设保护路绳，后续登山者可借此攀登）队员当天从海拔8300米的突击营地出发，但未能修通至顶峰的路，现正往海拔6500米的前进营地下撤。修路队员将等待天气窗口，择日修通顶峰路线。（原题为《因珠峰天气原因，修路队员撤回前进营地》）(本文来自澎湃新闻，更多原创资讯请下载“澎湃新闻”APP)	2020-05-12 18:29	新华视点	pp	20200512200817
2020051220081779	首都医科大学副校长建议：加快推进建立专科医师培训制度	各民主党派和全国政协委员们以多种方式投身疫情防控和稳定经济社会运行工作，并提交相关提案，全国政协提案委员会已将这些提案以参阅件形式送承办单位参考，确保提案发挥作用。5月12日，《人民政协报》刊发的《凝聚起抗击疫情的强大合力——全国政协提案委员会关于新冠肺炎疫情防控和经济社会发展相关提案摘编》中，包括全国政协委员、首都医科大学副校长王松灵提交的提案《从新型冠状病毒肺炎审视我国临床医学人才培养体系》。在提案中，王松灵建议理顺临床医学教育学位体系：“建立以‘5+3’一体化培养全科医生为主体的临床医学人才培养体系。扩大‘5+3’招生人数，合格者授予临床医学博士学位；完成‘5+3’培养后，部分（50%以下）可申请专科医师培训，培养高水平复合型临床医学人才，尤其紧缺的传染病、呼吸疾病、公共卫生、危重症急诊专科人才，合格者授予专科医师资格证书，不再与学位教育挂钩。如对学术研究感兴趣，可申请医学科学博士学位，授予医学科学博士（PhD）。目前招收8年制、9年制（授予博士）学制可纳入此MD+PhD培养体系，适当缩短攻读医学科学博士学位学制。”另外，王松灵还在提案中建议，进一步完善我国临床医学人才培养的结构体系。1、重构临床医学知识结构体系，加强培养复合型医学人才。打破临床学科间的壁垒，进行临床课程整合，紧紧围绕临床医生职业需求构建知识结构，以器官系统为基础以疾病为核心重建知识结构，培养医学生临床思维和以多学科整合理念进行疾病诊疗的能力。2、加强应急防控知识体系及专科人才队伍。在临床医学本科及住院医师规范化培训课程体系中加大应急防控体知识体系，确保在全科医生培养为目标的知识体系中应急防控能力培养。加快推进建立专科医师培训制度，设立传染病学、急诊医学、内科学（呼吸科等）、临床检验诊断学等专科医师培训，确保领域中高水平复合型专业人才培养，增强国家防控重大突发传染病的水平和能力。(本文来自澎湃新闻，更多原创资讯请下载“澎湃新闻”APP)	2020-05-12 18:27	澎湃新闻	pp	20200512200817
2020051220081780	对谈 | 《姜亮夫论学集》首发：国学大师的机缘与定力	为纪念5月19日国学大师姜亮夫先生诞辰119年，5月9日海上博雅讲坛邀请姜亮夫先生之女、浙江省社科院文学所研究员姜昆武，上海世纪出版集团副总裁彭卫国，商务印书馆上海分馆总经理贺圣遂，姜亮夫先生晚年的学生与助手、浙江大学马一浮书院特聘教授傅杰，借傅杰编选的《姜亮夫论学集》刚刚出版之机缘，在上海古籍书店就姜先生的学养和学识以及对后辈的影响同读者进行了交流。活动现场姜亮夫先生1902年生于云南昭通，青年时代求学于成都高师和清华国学院，师从林山腴、廖平、王国维、梁启超、陈寅恪、赵元任、章太炎等多位先生。毕业后曾在无锡中学、持志大学、复旦大学、云南大学等多所学校任教，并曾任云南省教育厅厅长、云南军政委员会文教处处长。1983年组建杭州大学古籍研究所，任所长。一生最擅长的领域为敦煌学和楚辞学，著有《莫高窟年表》《敦煌学概论》《敦煌学论文集》《楚辞通故》《屈原赋校注》等多部著作，汇录为24卷本《姜亮夫全集》，2002年由云南人民出版社出版。姜亮夫先生晚年留影姜亮夫先生的师承、定力与天分姜昆武总结了父亲一生中取得如此成就的三个原因。首先是命运的安排让姜亮夫遇到了今人无法企及的良师。“1921年，我父亲赴昆明，以云南省官费生的身份参加大学入学考试，最初报考的是南京高师的物理专业，但不知道为何没被录取，所以才进入成都高等师范学校国文部学习。”在那里，姜亮夫得到了林思进、龚道耕、廖平等先生的指导，为日后的国学研究打好了基础。“后来我父亲去北京，原本是游玩，结果得到机会在北师大研究科念书。没想到半年后遇到清华国学院补录，因为其中被录取的两位已出国，正好有名额空出，我父亲写信向梁启超申请补考，考试后被录取。”在清华国学院，姜亮夫有幸师从四大导师：王国维、梁启超、陈寅恪和赵元任。姜亮夫在清华国学院的毕业证书1928年，姜亮夫到上海工作，期间成为章太炎的入门弟子。另外，姜亮夫还有出国游学的经历，在欧洲结识了一批重要学者，比如伯希和、马伯乐、戴密微、叶慈、翟理斯等，又亲身接受了西方社会科学和人文科学的洗礼。傅杰讲道：“因此虽然他是国学大师，即使到了晚年却一点也不迂腐守旧。”姜昆武总结的第二点是勤奋和定力。姜亮夫一生经历了中国近代最动荡的岁月，战争不断，时局变幻莫测。日本的轰炸机在头上飞，他也能安下心来读书写作。“文革”中姜亮夫的巨著《楚辞通故》因红卫兵抄家丢失了50万字，“他便规定自己每天写作500字，雷打不动。完成目标就去散步一次，如果一天写了1000字，那就散步两次。他时常说自己是‘笨鸟先飞’，笨不笨先不论，但他确实做到了‘先飞’，人生需要机遇，但也须付出努力。因为及时补齐这部分内容，‘文革’结束后，180万字的著作才得以出版。”1985年齐鲁书社出版的《楚辞通故》“这样的学者在上个世纪有很多，比如和父亲相熟的顾廷龙、胡道静等等。”顾廷龙和胡道静都是彭卫国的老师。当年他在华东师范大学学习古典文献学时，顾廷龙布置作业，让他抄写《清史稿》中的“儒林传”和“说苑传”。“当时虽不解，但仍然每天到图书馆抄写。抄完后感觉有清200多年中有学问的人我都认识了。后来凡是文献中出现这些人的名字，我都能认出来。”姜亮夫在成都高师读书时，林山腴先生让他将姚鼐的《今体诗钞》好好读过。这本书当时买不到，姜亮夫向林先生借书抄了一部，这是他一生整部抄书的开始。彭卫国认为现在不会因为买不到书而抄书，但老先生们肯下苦工夫的治学精神不应该被遗忘。对于姜先生的好学和勤奋，曾在他身边学习和工作共九年的傅杰也深有体会。“姜先生在90岁高龄时仍然在不停读书，他最常问我的一个问题就是书店里现在有啥子好书，我将书名报上，他便指点哪些要买，哪些要不得。这样的榜样力量对于一个人的影响是一辈子的。”姜昆武讲到父亲的第三个特点是悟性高。“当年我想增加文采，父亲推荐我读《古文观止》。他说读一篇文章要总结出三五处收获才行。”“父亲当年并没有系统地论述治学方法，现在这些论学文章收集在傅杰编的这本书中，老一辈的体悟和心得就这样传承下来，对后学是十分有意义的。”关于姜先生的天分，傅杰又补充了两点。一是《姜亮夫论学集》中收入的《诗切序》是姜先生83岁高龄时写就的三万字长文，“从忆旧事开始，到陈述《诗经》学史，再到条分缕析讲《诗切》这本书好在什么地方，思维之绵密、笔力之雄健，着实惊人。这不是一般人能够做到的。”《姜亮夫论学集》第二点是先生的记忆力即使到晚年也很好。当时傅杰协助姜昆武解决《楚辞通故》一书中编校的疑难问题。其中一个名词，出版社审校时打了问号，傅杰便去问姜先生。姜先生说没有错，不过是他不好，承用了严复翻译《穆勒名学》时用的一个名词，意思一般人不知道，但仍可保留。那时教育部曾请老先生办讲习班，让各高校讲师以上的教师来进修。傅杰听过姜先生讲敦煌学，两个小时的授课，不看讲义，引经据典，提到的书名人名都没有错。为人师表的国学大师姜亮夫先生不仅在治学研究方面对自己严格要求，对于学生的培养也是一丝不苟。傅杰是姜先生负责的杭州大学古籍研究所第一届硕士研究生。当时先生80多岁，还亲自制定培养方案，手写下来，再请人打印出来。其中由他选定十二种中国古典基本典籍，根据篇幅分为六大六小：前者是《诗经》《尚书》《左传》《荀子》《庄子》《韩非子》，后者为《周易》《老子》《论语》《礼记·曲礼》《礼记·大学》《屈原赋》，让学生选择一大一小精读。“每门课如何教，每种书如何读，都写得详详细细。除了专业课，先生还为我们请来很多其他专业的老师上课，尽量扩大我们的知识面。并且请哪些老师来讲什么，先生都是通盘考虑过的，并非随意指定。比如当时请中国美术学院的王伯敏教授讲古代绘画，杭大数学系沈康身教授讲古代建筑，地理系陈桥驿讲历史地理等等，他们都是各自领域的顶尖学者。”“姜先生对待古籍所的研究生十分用心，在家里亲自讲授《说文解字》，关注每一位学生的读书和论文情况。”傅杰还讲道：“先生几乎什么书都知道，问不倒。偶尔碰到一本不知道的，也会实事求是承认。更重要的是，他对于哪些书精读、哪些泛读、哪些要不得，直言不讳，保证了学生治学的路数是正确的。”姜先生还曾请自己在1950年代教过的学生、著名书法家章祖安来为研究生讲《周易》专题。因为中国美院到杭大路程远，原本答应章先生每次课前派车去接，结果接送一次后负责人爽约，章先生一怒之下宣布中止授课。姜亮夫写给章祖安那封“为了孩子”的书信姜先生为此事派人专送手书至美院，写道：“专题周易报告，无论如何请你讲完，为了孩子们，非为吾辈计也。”多年后，信中的孩子之一傅杰看见刊登在章祖安文章中的这封手书，禁不住泪水夺眶而出。贺圣遂在复旦大学古籍研究所工作时，曾赴杭州拜访过姜先生。他也曾跟随同样毕业于清华国学院的蔣天枢研读《说文解字》。“当年老先生见到我们这些年轻人，总觉得充满希望，希望我们能够传承中国的传统文化，求学问道得真知，最终成为知行合一的真人。”(本文来自澎湃新闻，更多原创资讯请下载“澎湃新闻”APP)	2020-05-12 18:25	澎湃新闻	pp	20200512200817
2020051220081781	女子拍风景意外拍下路人跳江瞬间，人已失踪	5月11日，湖北宜昌。夷陵长江大桥上一女士用手机拍风景时，意外拍下一路人疑翻越护栏跳江，车上狗狗看到这一幕顿时惊呆。12日，民警称跳江者已失踪，生还可能性不大。	2020-05-12 18:24	澎湃新闻	pp	20200512200817
