id	title	txt	datetime	source	web	batch
2020051222430715	光大证券MPS事件两起仲裁结果出炉：孙公司需付5.5亿元	光大证券（601788）正在一步步走出MPS事件的泥淖。近日，光大证券先后发布了两则仲裁结果，均涉及当年“踩雷”的MPS事件。在两份仲裁决定书出炉后，光大证券孙公司需支付共计5.5亿元及仲裁费等相关费用。光大证券方面在5月12日对澎湃新闻记者表示：“公司尊重法律结果，将督促光大浸辉按照司法程序积极应对，履行好相关职责，尽最大努力维护公司及投资者权益。公司对相关事项高度重视，尽最大努力积极处理MPS项目处置相关工作，督促光大资本及其子公司开展境内外追偿等处置措施。与此同时，进一步完善公司合规风险体系建设，全面加强对子公司的管理。后续如有MPS项目相关诉讼或仲裁事项，公司将及时依法合规予以披露。”5月上旬两起仲裁结果出炉5月11日晚间，光大证券发布公告称，下属孙公司光大浸辉投资管理（上海）有限公司于近日收到上海国际经济贸易仲裁委员会裁决书，裁决被申请人光大浸辉支付申请人上海华瑞银行股份有限公司投资本金4亿元及相应预期收益、律师费、仲裁费等相关费用。在公告中，光大证券表示，公司将督促光大浸辉按照司法程序积极应对，履行好相应职责，切实维护公司及投资者权益。基于谨慎性原则，公司2019年度计提了相应预计负债，目前，我公司经营管理情况一切正常，财务状况稳健，流动性充裕。公司对相关事项高度重视，积极应对，并将及时披露相关后续进展情况。此前的5月1日，光大浸辉牵涉的另一起仲裁也迎来结果。上海国际经济贸易仲裁委员会裁决，被申请人光大浸辉、暴风（天津）投资管理有限公司、上海群畅金融服务有限公司支付申请人深圳恒祥股权投资基金企业（有限合伙），投资本金1.5亿元及相应预期收益、律师费、仲裁费等相关费用。过去两年已计提预计负债超30亿元2016年，光大浸辉联合暴风集团股份有限公司等设立了浸鑫基金，并通过设立特殊目的载体的方式，收购境外MPSilvaHoldingS.A.（MPS）公司65%的股权。据光大证券2018年年报披露，浸鑫基金的资金来源是，优先级有限合伙人出资人民币32亿元、中间级有限合伙人出资人民币10亿元、劣后级有限合伙人出资人民币10亿元。而上文中获赔4亿元的华瑞银行，正是优先级合伙人之一。然而，由于 MPS公司后续经营陷入困境，浸鑫基金未能按原计划实现退出。尽管与暴风方面签订了回购协议，但暴风在大受打击之后风雨飘扬，无力履行协议义务。不久前的3月30日晚间，暴风集团发布公告表示，暴风集团对员工的薪酬支付困难，公司人员持续大量流失，除冯鑫外，公司的高级管理人员已全部辞职，协助信息披露事务的证券事务代表也已经辞职。 公司目前仅剩10余人，同时存在拖欠部分员工工资的情形。而当年出资投入浸鑫基金的合伙人们，纷纷向光大证券伸出了手。可见的是，光大证券为此进行了充分的计提。先是在2018年度计提预计负债14亿元，拖累光大证券当年度净利润大幅缩水。再是在2019年度计提了16.11亿元预计负债，当年合并净利润由此减少12.52亿元。4月份营业收入跻身“10亿俱乐部”“公司作为央企控股的上市证券公司，定会以高度责任心积极妥善处理，以维护投资人的合法权益。”光大证券对记者这样表示。正逐渐走出MPS事件阴霾的光大证券，近期公布的业绩报告都颇为抢眼。2019年年报显示，光大证券在2019年实现营业收入100.57亿元，同比增长30.41%；归属于母公司股东的净利润5.68亿元，同比增长449.68%。5月12日出炉的4月业绩数据显示，光大证券母公司口径在4月份实现营业收入10.25亿元，环比增长66.05%，实现净利润5.38亿元，环比增长5.40%。光大证券相关负责人对澎湃新闻记者表示，2019年以来，公司深刻剖析风险事件反映出的问题，重点从健全风险管理制度、实现风险管理全覆盖、落实各级相关人员责任、强化专业管理和专家决策等方面全面再造风控合规体系。公司进行了一系列的风险排查和整改，全面加强对子公司的管控力度，进一步构建稳健、审慎的风险文化，完善风险合规体系，提高风险防范化解能力。据介绍，光大证券正全面转型，按照新战略优化业务策略，逐步构建财富管理、企业融资、机构客户、投资交易、资产管理、股权投资六大业务集群，打造业务协同生态圈和光大特色，回归业务本源。(本文来自澎湃新闻，更多原创资讯请下载“澎湃新闻”APP)	2020-05-12 21:55	澎湃新闻	pp	20200512224307
2020051222430716	美航班乘客抱怨：美联航客机满载座无虚席	5月10日，一名乘客上传了美联航一架由纽约飞往旧金山客机的照片。客机满载乘客，座无虚席，未遵守安全社交距离规定。据悉美国只有少数航空公司能保证留出安全距离。	2020-05-12 21:54	澎湃新闻	pp	20200512224307
2020051222430717	透视丰巢：快递最后100米，咋就这么难打通	人民日报客户端5月12日消息，开始收费的丰巢，你还用吗？5月开始，在丰巢存放快递超过12小时需要收取0.5元保管费，同时还有“5元包月会员套餐”……丰巢的电子屏上显示出最新的收费标准。图片来自网络一石激起千层浪，“凭什么收费，本来就是公共领域。”“收费可以，但12小时太短了”……不同的人对丰巢的感受不一样，但这一变化更像个导火索，引发了一场大讨论。那么，快递柜到底应该“姓”什么——姓“公”还是姓“商”？4月17日，商务部办公厅、国家邮政局办公室发布《关于深入推进电子商务与快递物流协同发展工作的通知》，明确智能快件箱、快递末端综合服务场所的公共属性，将智能快件箱、快递末端综合服务场所纳入公共服务设施相关规划，提供用地保障、财政补贴等配套措施。国家层面已对快递柜的公共服务设施属性定调了，但在具体落实层面，从消费者、快递小哥到物业，都是满肚子苦水……快递最后100米，咋就这么难打通？消费者苦快递柜久矣近日，家住杨浦区的林女士网购了一箱血橙，由于工作忙碌，隔了好几天才想起来，原本早该收到的血橙迟迟没有收到。打开购物APP，商品物流信息显示2天前已经签收。原来，快递小哥直接将物品放入了小区的快递柜中，而取件的提示短信早已淹没在林女士的手机消息中。结果自然是大部分血橙已经腐烂变质，愤怒的林女士直接向上海市消保委进行了投诉。最后经协商，快递公司对毁坏的物品进行了赔偿，并向林女士道歉。爱较真的林女士只是少数人群。大多数人遇到这种烦心事，普遍选择“忍一时风平浪静”。“一周要收那么多快递，哪儿有时间去维权”“快递小哥也不容易”是普遍的心态。上海市消保委统计，2019年上海市消保委共收到反映快递送达不到位投诉624件，占快递类投诉的13.9%。其中反映较多的就是未经消费者同意，快递员擅自将快递件放入寄存柜。快递柜提高了送件效率。图片来自网络“有时候明明人就在家，结果收到一条短信让我下楼去快递柜取快递！这是逼我多运动吗？”“我的快递经常被放到别的小区快递柜我说什么了”……在各社交媒体留言区，几乎都是用户层出不穷的抱怨。有消费者是被迫使用了快递柜服务，但另一方面，有快递柜使用需求的消费者却被拒之门外。住在浦东某小区的杨先生上班时间被快递小哥打电话告知，他小区的快递柜已经满了。在有些小区，快递柜包裹滞留现象也很普遍。“那你把快递放门口吧。”杨先生只好退而求其次，愿意承担包裹放门口可能丢失的风险。“电子门禁关着，上不去楼，我把包裹放小区超市里了。”说完这句话，快递小哥“啪”就把电话挂了。放超市，意味着不仅下班后要专程去拿，还得付1元保管费，“网上下单的时候我已经付过邮费了，为什么到了末端，我还得多支付1元。”杨先生很郁闷。此次丰巢超时收费事件中，争议的焦点也集中在超过12小时开始收费上，以及，在丰巢最新的致用户信中也提到，如果放入快递柜2小时内取出包裹，则可获得鼓励金额。这些新规都在致力于提高快递柜的“翻桌率”。撤走快递柜，然后呢？一些小区已经在行动了。硬核如上海中环花苑小区，一封致丰巢的公开信，连说理带算账，最后得出结论，“你不是弱者”，引发全网讨论。经中环花苑小区业主投票调查，小区决定在5月11日起暂时停用丰巢快递柜。中环花苑小区致丰巢公司的公开信。目前，上海已有约100家小区发声抵制丰巢随意定价收费。单以中环花苑小区为例，丰巢停用后，每天约有700件快递需要送上门。快递柜停用了，后续问题又随之而来：暂时无法接收的包裹要暂存在哪里？突然增加的工作量，对于快递小哥来说送得过来吗？会不会进一步造成包裹的滞留？快递员小郭一天工作10个小时。以前没有快递柜时，他几乎每单都送货上门，一天大概能送100单。目前快递行业送件收入普遍较低，单件收入在1元上下。现在，小郭的工作模式是上门和入柜相结合，一天能送300单。虽然使用快递柜每件需要支付0.3到0.45元不等的费用，但快递柜极大地提高了他的送件效率，最后的收入可以覆盖快递柜使用费用。几天前，小郭的公司就发出通知，要求快递员规范送件流程，每件要和收件人确认后，送件到家。可以预见的是，小郭的任务将会加重。而近几年，快递员流失成为业内普遍现象。送件效率高的外卖骑手显然是比快递员更吃香的工作。5月11日，上海市消保委发出倡议，居民小区可以设立一些免费的公共快递架，满足消费者寄存快递的需求。这个场景似乎很熟悉。防疫期间，大家的快递不都是这么取的吗！但这有个前提，防疫期间人人宅家，很多人把下楼取快递作为难得的透风时间。生活恢复正常后，大家都出门上班了，大部分包裹都要在露天、无人看管的情况下放置超过10个小时。放到快递柜里显示“签收”和放到公共置物架上的“签收”，哪一点消费者更容易接受呢？解决“最后100米”，只有收费这一个选项吗？此次争议的焦点，在于从免费变收费。暂存包裹，需要收费吗？暂存包裹是个硬性需求，确实有一群人需要这项服务。很多人会觉得丰巢占据了小区共用空间，设置了一个密码，还倒向业主收钱，不合理。另一方面，作为一个公共资源，很多收件人将包裹长期滞留在柜子里，造成低周转率，真正有需求的包裹进不了柜。收费，一定程度上可以减少资源浪费。其次，应该怎么收费？通过梳理快递柜公司和小区业委会各自的发声，可以发现，快递柜入场之前，关于收费的问题并没有协议清楚。现在，多家小区协议要求将收费时限由12小时延长至24小时，但依旧有大量消费者不买账。最后，只有收费这一个选项吗？快递柜拥有公共服务设施属性，同时又是快递商业链条的最后一环。它提高了快递小哥的工作效率，本质上服务了快递公司。因此，当快递柜开始收费时，被讨伐最多的也是快递柜公司和快递公司。但其实，小区物业对快递柜的情绪也很复杂。快递柜入场，几乎都会支付一定的场地费用和水电费。对于物业来说，也是一笔收入。更重要的是，快递柜相当于小区包裹暂存、分发、管理等服务的外包商，物业公司也节省了部分管理成本。上海市消保委副秘书长唐健盛分析认为，目前的利益格局对消费者不利。使用快递柜，对快递公司有降低成本的利益驱动，对物业有减少运营成本的利益驱动，对快递柜公司有以市场份额获得定价权的利益驱动。三者合一，新的交易惯例大概率会缩减消费者的福祉。这也是为何有悲观人士认为，羊毛终会出在羊身上，最终争取来的免费暂存，有可能转嫁到快递的费用中，也可能是更大范围的物业费用中。中国物流学会特约研究员杨达卿认为，快递柜作为一个公共服务设施，需要一定公共服务的支撑，这些支撑来自物业以及其他相关基础设施。4月17日，商务部和国家邮政局两部门的发文中提到的用地保障和财政补贴是积极信号。“快递柜设立的初衷是为了解决末端的问题。目前阶段，全面推进既向快递员收费，又向消费者收费还需慎行。快递柜有类似传统社区邮政信报箱的公共服务功能，在商业化上需要综合考量。”杨达卿说。（原标题《透视丰巢：快递最后100米，咋就这么难打通》）(本文来自澎湃新闻，更多原创资讯请下载“澎湃新闻”APP)	2020-05-12 21:53	人民日报客户端	pp	20200512224307
2020051222430718	华储网：1万吨中央储备冻猪肉将于15日投放，累计34万吨	5月12日，华储网发布《关于2020年5月15日中央储备冻猪肉投放竞价交易有关事项的通知》称，5月15日将出库投放竞价交易1万吨中央储备冻猪肉。累计投放量将达到34万吨。 （原题为《1万吨中央储备冻猪肉又来了 年内累计投放达34万吨》）(本文来自澎湃新闻，更多原创资讯请下载“澎湃新闻”APP)	2020-05-12 21:42	中新经纬微博	pp	20200512224307
2020051222430719	夜读｜李佳琦式的勇气，你有么？	11日，中国就业培训技术指导中心发布《关于对拟发布新职业信息进行公示的公告》，拟新增10个新职业。其中最受关注的，就是“互联网营销师”职业下增设的“直播销售员”工种。用大白话来说，这不就是“直播带货”吗？难怪网友们纷纷奔走相告：“李佳琦终于转正了！”“李佳琦们终于找到了自己的工种。”这当然是玩笑话，不过官方的“盖章认定”倒是应该让我们重新认识一下“带货直播”的意义。说实话，刚知道李佳琦的时候，我的内心里是有些不以为然的。一个男人卖口红，这算什么本事？时间久了，他的名气越来越响，影响力越来越大，也使我的困惑越来越浓：他，到底凭什么？从事任何一个职业，都需要具备相应的职业技能。那么，什么是李佳琦的“绝技”？我原以为，是他无与伦比的口才。但看着他穿梭在各大平台，与各路明星、主持人同台，并且成功“抢戏”后，我才明白过来：敢于表达的勇气，才是他的“杀手锏”。直播带货和传统推销比起来，对主播的应变和表达能力提出了更高的要求。因为其所要面对的受众更广，需要传递的内容也更复杂。常在想，自己能像李佳琦一样，在直播间里“豁出去”吗？答案是，不能。我想，我并不孤单。前段时间，各地方领导纷纷试水直播，为家乡的产品带货。这一举动让网友们倍感亲切，效果极佳，也让我们看到了这一行业的光明前景。只是无须讳言，大多数领导在镜头面前，还是显出了些许局促和拘谨。这并不奇怪。在我们的传统语境里，太过高调总好像是不值得提倡的。这样一来，李佳琦式的“自卖自夸”反倒成了一种异类，让人颇不习惯。于是，我们似乎习惯于躲在别人的身后，保持安全距离，结果，却屡屡错失了表达自己的机会。如今，李佳琦们终于登上了“大雅之堂”。这里头反映的，可不光是新业态、新市场的发展，而是一种社会文化的变迁。在这个信息大爆炸的新时代，小到个人大到国家，学会表达内在的想法、学会与他者顺畅沟通，正变得越来越重要。李佳琦式的勇气，或许不只是特定的职业技能，而是我们每个人都该去学习并掌握的能力。这当然不容易，李佳琦们能走到今天，正是与自身的害羞、胆怯不断战斗的结果。成为正式的“新职业”后，他们要面对的新挑战不会少，一不小心，还有“翻车”的可能。但至少，我们都可以从他们在镜头前的神采飞扬中得到一点鼓舞和启示：面对未知的未来，不断战胜自我、勇于展示自我、善于展示自我的人，运气总不会太差。(本文来自澎湃新闻，更多原创资讯请下载“澎湃新闻”APP)	2020-05-12 21:40	澎湃新闻	pp	20200512224307
2020051222430720	海南中考体育考试调整为日常体育课随班灵活进行，不计入总分	受高温天气、学生安全、疫情防控等因素影响，5月12日，海南省教育厅发布通知，决定调整海南省2020年初中学业水平体育科考试，将原来由各市县教育局统一组织集中进行的中考体育科考试，调整为由各校在日常体育课中随班灵活进行。学生体育课成绩计入综合素质评价内容，作为今年中招录取的参考，但不计入2020年中考总分。（原题为《海南2020年不统一进行中考体育科考试》）(本文来自澎湃新闻，更多原创资讯请下载“澎湃新闻”APP)	2020-05-12 22:35	央视新闻	pp	20200512224307
2020051222430721	汶川地震十二年：他们曾空降打开救援通道	十二年前的汶川地震，15名空降兵临危受命，在无气象资料、无地面表示和无指挥引导的条件下，从近5000米高空纵身一跃，空降震中地带，打开空中救援通道。	2020-05-12 22:32	澎湃新闻	pp	20200512224307
2020051222430722	新华社：“天海之死”，一个当令中国足球警觉的悲剧	5月12日，一名天津天海俱乐部球迷前来为球员送行。新华社记者 李然 摄 “打造百年俱乐部”“敢为天津赢天下”“三年亚冠五年世俱杯”……这些让人豪情万丈、血脉偾张的口号，还在很多天津球迷的耳边回响之际，一个他们竭力回避的残酷现实还是降临：天津天海俱乐部在奋力挣扎了4个月后，无力回天，正式宣布解散。从其源头呼和浩特市滨海职业俱乐部算起，天海俱乐部的历史不长，仅14年，却也曾有昔日美好的憧憬、一掷千金的投入和今日悲痛的落寞，令人唏嘘。天海的破产让成千上万球迷为之心碎。严肃的职业足球俱乐部是球迷的精神家园，是他们的根的维系、魂的回归之所，代表着他们的自我身份认定。职业足球有其精神属性。这里需要豪言壮语和充满激情的口号。口号往往指引一个目标，需要理性驾驭的实干去实现。有报道说，当年天海俱乐部名字还叫“权健”时，权健集团三年内撒出22亿元人民币，用来购买球星，支付高薪。球队一度战绩辉煌。但任何一家职业足球俱乐部的发展都需着眼长远，岁月历史能给俱乐部留下金钱购买不来的宝贵积淀。现任英超热刺俱乐部主帅穆里尼奥曾经说过：“作为一个有钱的俱乐部，你可以买来顶级球星，但是你买不来底蕴。”对此，曼城俱乐部的主教练瓜迪奥拉表示赞同：“这是正确的，你确实不能用金钱买来底蕴。”职业足球俱乐部的持续成长需要相应的社会环境和行业环境。发展职业足球需要金钱，但需预防只顾眼前、忽略长远发展的金元足球的出现。这是当年欧洲足联出台“财务公平竞争政策”的缘由。这也是中国足协现在痛下决心要挤破足球泡沫的原因。天海悲剧，足以让其他诸多中国职业足球俱乐部警觉。控制绝对股权的母公司断奶，寻找不到新的金主，唯有破产。同样的故事，其他俱乐部谁敢保证不会发生在自己的头上？通过天海悲剧，我们再次看到，大多中国职业足球俱乐部自身生存能力存在致命缺陷。2015年3月份，《中国足球改革发展总体方案》正式公布，比权健集团收购这家俱乐部早了将近4个月。其中第十一条、十二条规定：实行政府、企业、个人多元投资……形成合理的投资来源结构……探索实行球队和球员薪金总额管理，有效防止球员身价虚高、无序竞争等问题……早在权健集团入主当时还叫天津松江的这家俱乐部之前，《中国足球改革发展总体方案》已经点明了天海俱乐部今天破产的根本原因，更点明了我们职业足球一直面临的危机。从《中国足球改革发展总体方案》出台至今，5年时光流逝。天海俱乐部的消失，提示我们中国职业足球俱乐部的生存环境并没有发生任何质的好转。由此可见，陈戌源去年当选中国足协主席时提出的“踏踏实实落实足改方案，老老实实遵循足球规律”这一口号，内涵何其深刻。当然，我们希望这也不仅仅是一个口号。（原题为《“天海之死”，一个当令中国足球警觉的悲剧》）(本文来自澎湃新闻，更多原创资讯请下载“澎湃新闻”APP)	2020-05-12 22:26	马邦杰/新华社	pp	20200512224307
2020051222430723	香港特区政府计划27日在立法会恢复二读《国歌条例草案》	香港特区政府政制及内地事务局发言人12日表示，政制及内地事务局局长曾国卫当日向特区立法会秘书处作出预告，在5月27日的立法会大会上恢复二读辩论《国歌条例草案》。政制及内地事务局发言人说，国歌是国家的象征和标志。2017年11月4日，第十二届全国人民代表大会常务委员会通过决定，将国歌法列入香港基本法附件三。根据香港基本法第十八条的规定，凡列于香港基本法附件三的全国性法律，由香港特区在当地公布或立法实施。因此，在香港实施国歌法是香港特区政府应有的宪制责任。发言人指出，考虑到香港的法律制度及实际情况，特区政府决定以本地立法形式在香港实施国歌法。《国歌条例草案》的立法原则很清晰，就是必须充分反映国歌法这条全国性法律的立法目的和原意，即维护国歌的尊严，使市民尊重国歌，同时兼顾香港的普通法制度及实际情况。特区政府政务司司长张建宗也在12日向立法会内务委员会主席李慧琼发信，表示特区政府计划在5月27日的立法会大会会议上恢复10项法案的二读辩论，并建议现阶段优先处理《国歌条例草案》及《2019年商标（修订）条例草案》。张建宗表示，特区政府欣悉立法会内务委员会于5月8日的特别会议上，处理了过去七个月积压而未能处理的多项法案及附属法例项目。特区政府乐见立法会内务委员会终能突破困局，并会全力配合立法会在余下任期的法案审议工作。（原题为《香港特区政府计划5月27日在立法会恢复二读《国歌条例草案》》）(本文来自澎湃新闻，更多原创资讯请下载“澎湃新闻”APP)	2020-05-12 22:26	周文其/新华社	pp	20200512224307
