id	title	txt	datetime	source	web	batch
2020051220081744	通胀超预期回落为货币政策打开空间，机构预计降准降息可期	最新出炉的4月CPI超预期回落，货币政策下一步怎么走？综合机构的最新观点，尽管4月金融数据超预期增长，但货币政策还会逐步放松，降准、降息仍有空间。国家统计局5月12日公布的数据显示，4月CPI同比涨3.3%，重回“3”时代，PPI进一步回落，创下2016年4月以来的最大跌幅。前一日央行公布的4月金融数据显示，新增人民币贷款1.7万亿，新增社会融资规模超过3万亿，M2增速创下2017年以来新高。“这种信用周期再扩张的趋势，主要由政府基建和居民购房恢复驱动，但在就业压力下，消费报复性恢复难以持续。在不看好未来需求的情况下，企业增加资本开支的意愿也不足。4月M1环比下降4850亿，M1同比虽从5.0%上升到5.5%，但主要由翘尾推动（翘尾从5.2%提高到6.6%），且M1-M2剪刀差跌幅扩大，都反映了企业拿到资金后的实际使用效率在下降。”粤开证券首席经济学家、研究院院长李奇霖预计，在预期悲观的情况下，高社融对实体经济的拉动作用，可能要比经验规律显示的要弱得多。市场倾向于认为，随着去年基数走高，下阶段CPI将继续回落，对政策的掣肘将逐渐减弱。在最新的一季度货币政策执行报告中，央行表示，要“处理好稳增长、保就业、调结构、防风险、控通胀的关系，保持物价水平基本稳定，多渠道做好预期引导工作”，央行同时称，短期内，新冠肺炎疫情等因素可能从供求两个方面继续对物价形成扰动，应保持密切监测分析。从基本面看，我国经济运行总体平稳，总供求基本平衡，不存在长期通胀或通缩的基础。“可见，控通胀仍然是需要关注和平衡的一个目标，但其紧迫性已经明显让位于稳增长、保就业等方面，这也为货币政策打开了更大空间。下阶段，货币政策要以更大力度支持实体经济发展，降准、降息仍有空间和必要，加大力度促进需求加快恢复。”中国民生银行首席分析师温彬表示。瑞银证券认为，二季度整体经济的反弹面临一定制约因素，包括G3和部分新兴市场陷入衰退可能导致外需走弱，失业压力犹存、且一季度居民收入下降，消费者态度依然偏谨慎，以及部分供应链可能受阻，预计未来政策宽松还会进一步加码，预计央行会再降准50个基点，并下调政策利率10-20个基点。中金公司更是预计，全年来看，通缩格局会出现，货币政策在二到三季度还会逐步放松，尤其是滞后下行的存贷款利率将会补降。(本文来自澎湃新闻，更多原创资讯请下载“澎湃新闻”APP)	2020-05-12 19:15	澎湃新闻	pp	20200512200817
2020051220081745	苹果WWDC部分内容或用iPhone直播	据海外科技媒体5月11日报道，苹果公司或将在今年的全球开发者大会（WWDC）加入iPhone录制的部分，此前其曾被用于新一季选秀节目《美国偶像》的录制。	2020-05-12 19:12	澎湃新闻	pp	20200512200817
2020051220081746	在远方｜留在英国的我们，并肩作战	马丹琪是英国卡迪夫大学的留学生，疫情后她遇到过戴口罩不被理解，也有同学遇到过电信诈骗。加入全英学联后，这些志愿者们先为国内募捐，又协助大使馆向留学生发放健康包。	2020-05-12 19:11	澎湃新闻	pp	20200512200817
2020051220081747	张福海任广东省委常委、省委宣传部部长	南方+客户端5月12日消息，近日，中央批准：张福海同志任广东省委委员、常委。省委决定：张福海同志任省委宣传部部长。（原题为《张福海任广东省委常委、省委宣传部部长》）(本文来自澎湃新闻，更多原创资讯请下载“澎湃新闻”APP)	2020-05-12 19:09	南方+客户端	pp	20200512200817
2020051220081748	上海市委中心组学习会专题学新中国史：从历史中汲取经验智慧	作为上海市委开展党史、新中国史、改革开放史、社会主义发展史学习教育的重要内容，上海市委中心组今天下午（5月12日）举行学习会，听取中国社会科学院当代中国研究所原副所长武力所作的“深入学习新中国史，汲取新时代奋进力量”的专题辅导报告。上海市委书记李强主持会议并指出，新中国史和党的奋斗史紧密相连，学习新中国史要切实增强党的意识，大力弘扬爱国主义，充分激发奋斗精神，坚决贯彻落实习近平总书记重要讲话和指示批示精神，更加有力地统筹推进疫情防控和经济社会发展各项工作，更好服务国家发展大局。武力的专题辅导报告以丰富的史料、生动的事例、详实的数据和今昔、中外对比，回顾了新中国70多年所取得的伟大成就，着重就中国共产党领导人民建立新中国、开展社会主义建设、开创改革开放新时期以及新时代坚持和发展中国特色社会主义作了全面系统的阐述。李强指出，学习历史是为了鉴往知来。开展“四史”学习教育，要加深对历史规律性的认识和历史必然性的把握，从历史中汲取经验和智慧，增强开拓前进的勇气和力量，更好战胜前进征程上的困难和挑战。李强指出，新中国成立70多年来，正是党领导人民，创造了翻天覆地的变化、改天换地的壮举、惊天动地的事业。实践充分证明，办好中国的事情，关键在党。学习新中国史，要切实增强党的意识。全市各级党组织要坚决做到“两个维护”，坚持党的全面领导，认真落实新时代党的建设总要求，提高党的建设质量和水平。各级党员干部要对党忠诚，自觉在思想上政治上行动上同以习近平同志为核心的党中央保持高度一致。要把广大人民群众凝聚团结在党的旗帜下，拥护党、热爱党，坚定不移跟党走。李强指出，爱国主义是我们民族精神的核心，是中华民族团结奋斗、自强不息的精神纽带。要通过学习新中国史，教育引导党员干部、广大群众和青少年，热爱祖国，自觉维护国家和民族的尊严。爱国主义贯穿于上海红色文化、海派文化、江南文化，在全市精神文明建设中，要高举爱国主义伟大旗帜，努力宣传好、弘扬好爱国主义。李强强调，新中国史是一部奋斗的历史。站在实现“两个一百年”奋斗目标的历史交汇点上，面对世界百年未有之大变局，特别是面对疫情带来的不确定性，要更好激发党员干部的奋斗精神，充满激情、富于创造、勇于担当，坚决守住守好疫情防线，全力落实好中央交给上海的重大任务，奋力夺取疫情防控和实现经济社会发展目标双胜利。（本文图片 陈正宝 摄）(本文来自澎湃新闻，更多原创资讯请下载“澎湃新闻”APP)	2020-05-12 19:09	澎湃新闻	pp	20200512200817
2020051220081749	五台山6辆报废公交起火，员工丢烟头引燃	5月10日，山西忻州。某公交车停车场内公交车起火。五台山风景名胜区委员会回应，明火已扑灭，无人员伤亡。失火原因初断为晋旅公司员工吸烟烟蒂掉落，引燃车内易燃物。	2020-05-12 19:09	澎湃新闻	pp	20200512200817
2020051220081750	清华空间项目有新发现，重启天文软X射线偏振探测窗口	澎湃新闻（www.thepaper.cn）记者从清华大学获悉，5月11日，清华大学天文系教授冯骅课题组与合作者在《自然·天文》杂志发表文章，介绍了清华大学主导的空间天文项目“极光计划”的最新成果：“极光计划”配备的X射线偏振探测器在卫星上经过1年的观测，探测到来自蟹状星云及脉冲星（中子星的一种）的软X射线偏振信号，并首次发现了脉冲星自转突变和恢复过程中X射线偏振信号的变化，说明在此过程中脉冲星磁场发生了变化。这一探测结果也标志着，由于技术困难停滞了40多年的天文软X射线偏振探测窗口重新开启。“极光计划”最新发现为什么重要？作为一门观测驱动的科学，天文学的发展在很大程度上依赖新的观测方法和手段。新的观测方法和手段被称为天文观测的新窗口。X射线是电磁波的一种，是研究黑洞、中子星等天体的最主要媒介。偏振是电磁波的基本属性之一，其在生活中的应用包括3D电影和液晶显示。而X射线偏振是具有重要科学价值的独特的天体物理探针，是研究黑洞、中子星等高能天体的强有力工具。1968年，美国科学家率先开展了天文X射线偏振探测，于1971年在一次探空火箭实验中见到了成功的希望，并在1975年发射的OSO-8卫星上完成了第一次精确测量，这次测量发现了蟹状星云的X射线辐射具有高度线偏振，起源于同步辐射。然而，由于上一代技术的局限性，其探测效率和灵敏度低下，天文软X射线偏振探测在这次实验之后便陷入了停滞。2001年，随着核探测技术的发展，意大利科学家证实了一种新型粒子探测技术可用于高灵敏度X射线偏振测量。2009年，清华冯骅教授带领团队开始对X射线偏振探测技术进行探索和改进，在国际合作的基础上历经多年技术积累，在实验室里研制出了高灵敏度低系统误差的X射线偏振仪。这个火柴盒大小的探测器瓶颈之一就在于探测器封装，其气体纯度要求为99.999%以上。但是探测器腔体材料会吸附杂质气体，当纯净的气体充入后，杂质会慢慢扩散，使得纯度下降，导致探测器最初的工作寿命只有约30分钟。冯骅团队成功解决了这个问题，使得探测器封好之后5-10年性能都不会改变。“空间天文是一个系统工程，哪一个环节出问题，整个项目都会失败，这也是空间天文项目的难度所在。”冯骅介绍。天文探测窗口的重新开启新的探测技术和方法需要进行飞行验证，为此，冯骅提出了“极光计划”，希望利用微纳卫星平台在卫星轨道上直接验证X射线偏振探测技术，从而提高技术成熟度，为未来的空间天文探测所用。2018年10月29日，“极光计划”探测器发射升空，经过1年的观测，探测到来自蟹状星云的X射线偏振信号，并发现了有关脉冲星的新天体物理现象，也就是当蟹状星云脉冲星自转周期突然变化之后，其X射线偏振也发生了显著的变化。脉冲星是一种极其精确的“时钟”，但是经常会在某一个时间点发生一次突变，然后慢慢恢复，这种自转突变是一种有待研究的天文现象。2019年7月23日，蟹状星云脉冲星发生了一次自转突变，其偏振信号的变化被“极光计划”探测器捕捉，经过几十天它的偏振信号又慢慢恢复，这一新的发现有助于理解脉冲星也就是中子星的内部结构。载人航天工程应用系统总设计师顾逸东院士表示：“极光计划采用商业化立方星成功测量了蟹状星云及脉冲星的偏振信号，获得脉冲星的X射线偏振随时间变化的重要成果，同时闯出了一条低成本开展空间天文研究的创新途径，对推动高校空间科学发展有重要意义。”“极光计划”探测器是40多年来国际上第一个专门的空间天文软X射线偏振探测器，宣告了这个天文探测窗口的重新开启，而关于蟹状星云脉冲星自转变化物理过程的意外发现，也说明了这个新窗口的重要性。新成果将用于我国下一代大科学工程上澎湃新闻记者从清华了解到，“极光计划”所采取的技术将被应用到我国下一代大科学工程“增强型X射线时变与偏振天文台(eXTP)”上。eXTP是中国领导的大型中欧合作项目，预计2027年发射。作为eXTP首席科学家，中科院高能所粒子天体物理中心主任张双南研究员表示：“极光计划发展了最先进的X射线偏振测量技术，实现了历史上仅有的第二次天体X射线偏振测量。这不但验证了40多年前的第一次测量结果的正确性，而且还很有可能发现了一个极具科学价值的新现象，这有助于理解中子星的内部结构以及自转变化如何影响其外部磁场。极光计划的成功表明，目前正在研制和计划中的X射线偏振测量空间项目的科学潜力巨大，其结果也对未来新项目的科学目标确定和技术方案选择提供了新的思路。”清华大学天文学科创始人李惕碚院士表示，“清华天文从起步之日起，空间天文就是一个重要的、极具特色的发展方向。‘极光计划’是清华大学主导的第一个空间天文项目，是理工结合的成效。”“极光计划”负责人冯骅是清华大学天文系教授、工物系兼职教授，该项目的成功实施得益于核技术在天文探测中的应用，体现了理工结合、学科交叉的特色。冯骅是论文的第一作者和通讯作者。“极光计划”的合作单位还包括意大利国家核物理研究院（INFN-Pisa）、意大利国家天体物理研究院（INAF/IAPS-Rome）、中科院高能物理研究所、北京大学、宁波工程学院、北方夜视和天仪研究院。同时，“极光计划”探测器和卫星的日常运行均由学生负责，是学生培养的重要平台。“极光计划”搭载在天仪研究院的“铜川一号”立方星上，此星还装载了一个学生项目——“天格计划”。“极光计划”立方星和探测器结构示意图  清华大学 图“极光计划”对蟹状星云进行观测的艺术表现图  清华大学 图(本文来自澎湃新闻，更多原创资讯请下载“澎湃新闻”APP)	2020-05-12 19:09	澎湃新闻	pp	20200512200817
2020051220081751	广州海关破获19吨走私燕窝大案，涉案案值约1.33亿元	广州海关5月12日通报，5月8日，广州海关开展“奋战09”打击燕窝走私专项行动，共打掉7个走私燕窝犯罪团伙，抓获犯罪嫌疑人13名，查证走私燕窝约19吨，初步估算该案案值达1.33亿元人民币。广州海关缉私局分析发现，以孙某、庄某为首的走私团伙将涉案燕窝从马来西亚邮寄至香港，再通过珠江口水路偷运等方式走私进境，并通过国内快递发往广州、佛山、汕头和辽宁等地销售牟利。5月8日凌晨，在海关总署缉私局的统一指挥下，广州海关缉私局进行查缉抓捕。截至目前，共打掉走私燕窝犯罪团伙7个、抓获犯罪嫌疑人13名，查获储存涉案走私燕窝的仓库1个。现场查扣走私燕窝约339千克，查证走私燕窝约19吨，涉案案值约1.33亿元人民币。目前该案正在进一步侦办中。海关提醒，根据有关法律规定，燕窝（罐头装燕窝除外）等动物产品属禁止携带和邮寄进境物。如需输入动物产品，应在进境前办理动植物检疫审批手续，进境时持输出国家或地区的检疫证书向进境口岸海关申报，经正常通关手续缴纳税费、检疫查验合格后方可进境。（原标题：广州海关破获亿元走私燕窝大案）(本文来自澎湃新闻，更多原创资讯请下载“澎湃新闻”APP)	2020-05-12 19:07	丁乐/新华社	pp	20200512200817
2020051220081752	贺江川任首创集团党委书记、董事长，李爱庆卸任	首创集团官方微信公众号消息：5月12日，首创集团召开主要领导任职调整宣布会。北京市委常委、副市长殷勇出席会议并讲话，北京市委组织部副部长王建中宣布北京市委、市政府关于首创集团主要领导调整的任命决定，北京市国资委党委书记、主任张贵林主持会议。会议宣布，贺江川同志任首创集团党委书记、董事长，李爱庆同志因年龄原因不再担任首创集团党委书记、董事长职务。李爱庆、贺江川同志在会上分别作了表态发言。殷勇介绍了首创集团主要领导调整的考虑，充分肯定了李爱庆多年来为国资国企改革和首创集团事业发展所付出的努力和取得的成绩，对贺江川给予了高度评价并提出了希望。结合这次班子调整，殷勇代表市委、市政府对首创集团下一阶段发展提出四点要求。一是要强化思想引领，提高政治站位。要牢记“看北京首先从政治上看”的要求，增强“四个意识”，坚定“四个自信”，坚决做到“两个维护”，把习近平总书记五次对北京的重要讲话精神贯通起来，以更加坚决的态度，更加自觉的行动，更加有力的举措，推动习近平新时代中国特色社会主义思想在京华大地进一步形成生动实践。二是要坚持改革创新，推动企业发展再上新台阶。要进一步强化管理，增强公司治理，深入研究企业发展战略，目标任务，按照市委、市政府、市国资委对国企的发展要求做精做优做强。三是要深入推进全面从严治党，切实提高企业党建工作质量。要坚决扛起全面从严治党的主体责任，党委书记要履行“第一责任”，进一步健全党委发挥作用的机制体制，严格落实“三重一大”决策制度和重大事项请示报告制度。要严肃党内政治生活，坚持“三会一课”，突出政治学习教育，突出党性锻炼；要夯实党的基层组织建设，尤其是抓好京外、境外企业及不同股权、不同地域、不同层级党组织建设；要进一步完成党支部标准化、规范化建设，加强党员的教育和管理，切实把党的政治优势，组织优势和群众工作优势转化为企业发展的竞争优势。四是要着眼企业发展需要，进一步加强领导班子和干部队伍建设。要进一步提升领导班子的履职能力，进一步学习企业经营管理、城市运营管理、金融等领域的相关知识，增强科学决策能力。要重点培养干部斗争精神和斗争本领，鼓励干部在改革发展的主战场、维护稳定的第一线、服务群众的最前沿，直面问题矛盾，敢于斗争、善于斗争。要加强年轻干部的培养，积极为年轻干部锻炼成长搭建平台，确保首创集团事业后继有人。要加强人才强企战略，加强专业技术人员队伍的建设，弘扬工匠精神，完善培养评价激励机制，加强科研力量培养，为企业持续发展引才聚智。坚持从严教育管理监督党员干部，着力建设忠诚干净担保的高素质干部队伍。殷勇强调，当前，巩固疫情防控成果，防止疫情反弹的任务还比较繁重，要继续抓实抓细常态化防疫措施，扎实做好“六稳”工作，全面落实“六保”任务。要充分估计困难，切实增强紧迫感，统筹推进防疫和复工复产两手抓两不误。要坚持稳中求进工作总基调，坚持新发展理念，坚持以供给侧结构改革为主线，坚持以改革开放为动力，推动企业高质量发展。张贵林指出，首创集团全体干部员工要切实把思想和行动统一到市委市政府决策部署上来，相信在以贺江川同志为班长的首创领导班子带领下，讲政治、顾大局，开拓进取、勇于创新，坚持疫情防控与复工复产，特别是达产增收两手抓两不误，全力打造具有国际竞争力和国内领先的城市综合投资建设运营服务商，更好地服务首都四个功能建设，为推动更高质量发展作出新的更大的贡献。市委组织部、市国资委有关处室负责人，集团领导班子成员、内设部室及各直属（控股）公司主要负责人参加会议。(本文来自澎湃新闻，更多原创资讯请下载“澎湃新闻”APP)	2020-05-12 19:05	澎湃新闻	pp	20200512200817
2020051220081753	莫斯科波特金医院首席医生沙布宁确诊新冠肺炎	莫斯科市波特金医院首席医生沙布宁央视新闻5月12日消息，据俄媒援引莫斯科市卫生局消息，莫斯科市波特金医院首席医生沙布宁确诊新冠肺炎。他本人正在办公地点自我隔离，并通过远程方式继续工作。（原题为：《俄罗斯莫斯科波特金医院首席医生沙布宁确诊新冠肺炎》）(本文来自澎湃新闻，更多原创资讯请下载“澎湃新闻”APP)	2020-05-12 19:04	央视新闻	pp	20200512200817
2020051220081754	三岁男童迷路大哭，警察蜀黍实力宠娃	5月3日15时左右，上海公安局长宁分局江苏路派出所接到报警求助称靠近市三女中人行道处一名三岁男童迷路大哭，民警通过视频监控及时找到其家人，现男童已回到妈妈身边。	2020-05-12 19:03	澎湃新闻	pp	20200512200817
2020051220081755	外交部：4家澳大利亚牛肉产品违反要求被禁出口中国	5月12日的外交部例行记者会上，有记者提及“中方已禁止4家澳大利亚牛肉产品加工商向中国出口牛肉”。对此，中国外交部发言人赵立坚表示：据了解，中国海关对进口肉类产品查验时，连续发现澳大利亚个别企业多批次输华牛肉产品，存在违反双方主管部门共同确定的检验检疫要求的情况。为保障中国消费者健康和安全，中方决定即日起暂停接受4家澳企业肉类产品的进口申报，并已通报澳方主管部门，要求澳方全面彻底调查原因并整改。（原题为《外交部：4家澳牛产品违反要求被禁出口中国》）(本文来自澎湃新闻，更多原创资讯请下载“澎湃新闻”APP)	2020-05-12 18:59	央视新闻	pp	20200512200817
2020051220081756	十一届上海市委第七轮巡视启动，将对10个区开展常规巡视	十一届市委第七轮巡视工作动员部署会今天（5月12日）举行。上海市委副书记、市委巡视工作领导小组组长廖国勋出席会议并讲话。会议强调，要深入学习贯彻习近平总书记关于巡视工作的重要论述，贯彻落实全国巡视工作会议暨十九届中央第五轮巡视动员部署会精神，切实增强做好新时代巡视工作的自觉性和坚定性。要深刻理解把握政治巡视定位，紧扣“两个维护”根本任务开展政治监督，为奋力夺取疫情防控和经济社会发展“双胜利”提供有力保障。要深刻理解把握巡视工作方针，坚持发现问题、形成震慑，推动改革、促进发展，持续发挥震慑、遏制和治本作用。要深刻理解把握巡视整改落实要求，扎实做好“后半篇文章”。要深刻理解把握巡视工作战略布局，积极探索巡视监督与其他监督贯通融合的实现形式。会议要求，要紧密结合地区特点，持续深化政治巡视，推进政治监督具体化、常态化。要聚焦职责使命，着力查找和推动纠正政治偏差。要聚焦“关键少数”，紧紧围绕被巡视地区领导班子和领导干部开展监督。要聚焦精准发力，做到主攻方向精准、发现问题精准、分析研判精准。要聚焦上下联动，进一步完善横向全覆盖、纵向全链接、全市“一盘棋”的巡视巡察工作格局。要打造过硬的巡视干部队伍，坚决完成好市委交付的巡视任务。市委常委、组织部部长、市委巡视工作领导小组副组长于绍良宣布十一届市委第七轮巡视组长授权任职及任务分工决定。根据市委部署，本轮将对浦东新区、静安区、松江区、闵行区、长宁区、宝山区、虹口区、普陀区、崇明区、嘉定区等10个区开展常规巡视。（原题为《十一届上海市委第七轮巡视工作启动，将对10个区开展常规巡视》）(本文来自澎湃新闻，更多原创资讯请下载“澎湃新闻”APP)	2020-05-12 18:59	“廉洁上海”微信号	pp	20200512200817
2020051220081757	路虎爬坡过猛撞断护栏冲入店铺，5人受伤	5月12日，四川雅安。某地下停车库入口处一名男子，突然驾车加速冲入对面店铺内。事故造成驾驶员及店内4人受伤（暂无生命危险）。目前，相关部门正对事故调查中。	2020-05-12 18:58	澎湃新闻	pp	20200512200817
