id	title	txt	datetime	source	web	batch
202005122243079	总理、部长、总统新闻秘书：俄罗斯政界要员接连感染新冠病毒	5月12日，俄罗斯总统新闻秘书佩斯科夫确认自己感染了新冠病毒，并表示自己正在医院接受治疗。近期俄罗斯政界已经有多名要员感染新冠病毒。4月30日，俄总理米舒斯京表示自己感染了新冠病毒，并入院接受治疗。5月8日，米舒斯京在确诊后首次公布了工作视频。据总理新闻秘书11日的消息，米舒斯京目前仍在医院接受治疗，病情正在好转，而且他正在远程工作，与俄罗斯总统普京保持联系。俄罗斯政府和议会内部也已经有多人确诊感染。5月1日，俄建设部部长亚库舍夫及副部长沃尔科夫确诊感染了新冠病毒；5月5日，文化部长柳比莫娃也同样确诊，但她的症状较轻微。此前，俄罗斯国家杜马（议会下院）独联体事务委员会主席卡拉什尼科夫、国家杜马国际事务委员会第一副主席诺维科夫也感染了新冠病毒。据俄罗斯卫星通讯社的报道，俄罗斯联邦委员会（议会上院）议程事务委员会主席维季姆琴科此前表示，俄联邦委员会有几位议员曾感染新冠病毒，但都是轻症，没有住院，而且已经恢复。俄罗斯当前的新冠肺炎疫情还在不断蔓延，单日新增确诊病例已连续10日超过1万例，累计确诊病例超过23万例。俄罗斯总统普京11日宣布，从3月30日开始的全国性的统一休假结束，俄罗斯将逐步开始解除防疫限制措施。(本文来自澎湃新闻，更多原创资讯请下载“澎湃新闻”APP)	2020-05-12 22:03	澎湃新闻	pp	20200512224307
2020051222430710	清零！山西省境外输入患者全部治愈出院	人民日报客户端 图5月12日，山西省收治的最后一例新冠肺炎境外输入患者在太原市第四人民医院治愈出院。截至目前，山西省累计报告境外输入性确诊病例64例，已经全部治愈出院。患者林先生，男性，35岁，于莫斯科时间4月5日下午6:45乘中国国航CA910由莫斯科飞往太原，入太原市中心医院隔离点隔离，查咽拭子新型冠状病毒核酸检测为阳性，4月7日由太原市中心医院转入太原市第四人民医院，入院诊断为新型冠状病毒性肺炎（普通型），但患者症状属于进展期，肺部炎症迅速扩大。入院后省市各级相关部门与太原市第四人民医院高度重视，组织精兵强将按照国家卫健委诊疗指南积极给予抗病毒、氧疗、激素、中药、人文关怀等对症治疗，尤其是运用了有山西特色的肺脏脱水治疗，患者新冠肺炎症状很快消失，到4月22日胸部CT显示肺部炎症基本吸收。但林先生核酸检测（咽拭子）一直不转阴，太原市第四人民医院积极给予抗病毒治疗、调节免疫、中医中药治疗、营养支持、心理支持等干预，5月8日患者新型冠状病毒核酸检测转阴，5月11 日、5月12 日间隔24小时连续2次咽拭子新型冠状病毒核酸检测阴性，胸部CT显示肺部炎症完全吸收。5月 12日经省市及四院医疗救治专家评估，符合新型冠状病毒诊疗方案（第七版）出院标准，患者于5月12日痊愈出院。林先生还将在定点隔离点康复修养14天。（原题为《山西省境外输入患者全部治愈出院》）(本文来自澎湃新闻，更多原创资讯请下载“澎湃新闻”APP)	2020-05-12 22:01	人民日报客户端	pp	20200512224307
2020051222430711	催女儿写作业的援鄂护士周国红确诊癌症，已顺利完成手术	5月12日，白衣天使们迎来了特殊而又意义非凡的第109个国际护士节。在武汉抗疫期间，因为自己的防护服上写下督促女儿学习的话语，安徽省第三批援助湖北医疗队队员周国红的身影被定格在了人们的脑海中。而令人揪心的是，4月27日，刚刚凯旋归来的周国红却被确诊为甲状腺癌转移，住进了安徽医科大学第一附属医院，经媒体报道后，她的病情牵动了无数网友的心。周国红  楚天都市报 图12日，澎湃新闻（www.thepaper.cn）从接近安医大一附院的相关知情人士处确认，安徽医科大学第一附属医院的专家组会同来自上海的医疗专家，于5月8日对周国红进行了手术。虽然手术的难度较大，但结果很成功，目前她的恢复情况良好。5月10日下午，周国红已经从ICU病房转入普通病房，因为刚做完颈淋巴清扫和甲状腺切除，她目前说话还有些困难。下一步院方将通过同位素治疗的手段对周国红进行术后辅助治疗，帮助其更好地恢复。女儿送给周国红的生日礼物   楚天都市报 图据《楚天都市报》报道，5月10日母亲节，周国红转入普通病房。也就是在这一天的晚上，周国红收到了女儿送上的母亲节礼物——一副手绘的图画。图画上，一位抱着小孩的母亲站在一朵盛开的粉色鲜花旁，左边空白处有一个大字“爱”，还有5个字“母亲节快乐”。进手术室前，周国红所发的朋友圈。“生病是不幸的，而我却如此幸运。很多人爱我，关心我……”8日早上进手术室前，周国红发了一条朋友圈，她还用水笔在自己的手臂上写下了对关心她的人和医护人员的感谢。从抗疫到抗癌，病魔并没有让她消极畏惧。多位曾在手术前看望过周国红的人士对澎湃新闻表示，虽然病情较重，但周国红精神上一直非常乐观。周国红 合肥京东方医院官方微信号 图2月9日，合肥京东方医院主管护师周国红作为安徽省第三批援鄂医疗队成员奔赴武汉抗疫前线，在武汉市经开区体育中心方舱医院担任病人中心主任，负责对患者进行情绪抚慰和心理护理。据中安在线报道，周国红有一个12岁的女儿，得知母亲要去武汉，女儿害怕地哭了起来。周国红知道女儿的梦想是考取武大，便安慰她：“你一直都喜欢武大，武汉现在生病了，如果我不去治它，将来你就没学校可以读了。”2月23日，她身着白色防护服，在后背喊话女儿“@合肥第四十五中陈彦然，认真写作业”的视频走红网络。2月26日，通过新闻报道得知情况的武汉大学校长窦贤康立即给周国红的女儿陈彦然写了一封公开信，勉励她“刻苦学习，几年后能够如愿常驻珞珈山”。周国红喊女儿写作业的视频截图2月28日，得知窦贤康校长给自己的女儿写了信，周国红非常感动。“我只是一个普通的医者，治病救人是职责，初心只是想为武汉人民做点什么，没有那么伟大。”她在接受《光明日报》记者采访时表示。得知武大校长回信后的陈彦然也说：“非常开心，非常意外，要好好学习，终有一天实现梦想，不让窦校长失望。”周国红的甲状腺癌转移并非没有前兆，在武汉抗疫一线，她先后两次晕倒。“整个三月份，我的嗓子不时喘不上来气、咳嗽，那股难受劲，像有人掐着你的脖子一样。”周国红在接受中安在线记者采访时说，第一次晕倒后，她以为是长期工作的疲劳所致，继续拖着疲惫的身体，向上级递交了请战书，后来转战到协和医院重症医学区奋战。周国红记得，第二次晕倒醒来后，她在华中科技大学同济医学院附属协和医院做了CT检查，“双肺部出现了慢性炎症，医生让我高度警惕，回到合肥结束隔离就复查。”3月27日结束在武汉的医疗援助回到合肥后，周国红先后前往医院做了三次检查。4月27日上午，在安徽医科大学第一附属医院，周国红等来了自己被确诊为甲状腺癌转移的检查报告。报告显示，癌细胞已顺着淋巴转移至肺部、肝部、盆腔等多处器官。抵达武汉的第11天，周国红曾在日记中写道：“疫情让我遇见了武汉，让我们用爱疗愈这座城市吧，然后开往春天的列车，终将从方舱站到达健康站。”(本文来自澎湃新闻，更多原创资讯请下载“澎湃新闻”APP)	2020-05-12 22:00	澎湃新闻	pp	20200512224307
2020051222430712	演员夫妇四合院遗产三子女争，法院：按遗嘱儿子继承母亲份额	一对演员夫妇去世后，留下了多处不动产和一笔钱，三子女因为遗产继承问题无法达成一致而对簿公堂。5月12日，澎湃新闻（www.thepaper.cn）记者从上海市徐汇区人民法院获悉，日前，该院开庭审理这起遗嘱继承纠纷案，认定三子女的母亲于夫人遗嘱有效，遗嘱中提及的遗产按遗嘱继承，未提及部分按照法定继承。母亲遗嘱是否有效成为子女争议焦点于先生是中国著名配音演员，其夫人也曾是话剧演员。夫妇二人育有阿豪、阿越二子，阿芳、阿馨（均为化名）二女。于先生及夫人分别于1998年、2018年去世。儿子阿豪于2013年去世，终身未婚未育。于先生生前未留遗嘱。夫妻二人共同留下一套位于上海市的房屋和一笔45500元的钱款，于夫人还对3幢北京四合院房产享有12/90的份额，于家三姐弟则另外各享有6/90份额。父母去世后，遗产该怎么分？姐弟三人因意见不合而逐渐产生矛盾。阿馨作为原告，将阿芳、阿越告上法庭，要求按照法定继承，遗产由三人均分。对此，阿芳同意均分或者谁照顾老人多谁可以多分。阿越则提出按照母亲的遗嘱分割遗产。庭审中，阿越提交了母亲于2012年、2015年订立的三份遗嘱及立遗嘱时所拍摄的视频。其母在遗嘱中称自己去世后，全部房产都留给儿子阿越。但阿芳、阿馨两姐妹对遗嘱并不认可，她们认为母亲患有精神疾病，遗嘱很可能是在阿越的摆布下而立，母亲以为自己在演话剧，遗嘱不能反映其真实意思。阿馨提交了载有“母患有严重的精神病”的本人职工登记表，1989年于先生单位出具的证明于先生“妻子患病，一直在家”的材料，以及央视某栏目播放的于先生纪录片视频及文字资料，证明阿越也曾在纪录片中称其母患有精神疾病，并且提交了母亲妹妹证明其早年就知道姐姐有精神病史的证明信。于先生的侄子作为第三人也曾致函法院，称于夫人患有精神疾病。但阿越称母亲没有精神疾病，纪录片中自己反映的是母亲患有肺结核的情况，其他亲友同事的证言均是道听途说，并没有被证实。此外，阿馨还提交了一份1998年的《于先生遗留钱款》材料，显示当时尚余45500元在阿越处保管，这笔钱是父母的共同财产，应按照法定继承由三位子女均分。阿越称该钱款已用于母亲养老，并无结余，并且提供了其母在养老机构的花费票据。阿芳则认为分割时谁照顾老人多谁可以多分。于夫人对北京四合院享有份额由儿子继承法院经审理认为，法律规定继承开始后，按照法定继承办理；有遗嘱的，按照遗嘱继承或遗赠办理。本案有两个争议焦点：一是被继承人于夫人的自书遗嘱是否有效。阿越提供的三份遗嘱，符合自书遗嘱的形式要件。阿馨、阿芳称其母生前患有精神疾病，但对此提供的仅是他人证言等传来证据，并无相关病史资料、司法鉴定等直接证据。法院在审理过程中，曾至养老院进行核实，两位遗嘱见证人均证实立遗嘱时于夫人表现正常，未发现其有精神问题，现有证据无法印证于夫人在立遗嘱时失去行为能力，因此法院认定，其遗产应当依照其所立遗嘱进行继承，遗嘱有冲突的，按照后立遗嘱优于前立遗嘱的原则认定效力。二是于先生去世后遗留的45500元如何继承。这笔动产属于夫妻共同财产，于夫人的遗嘱中未提及如何处置，故应按照法定继承处理。阿越称这笔动产已全部用于母亲养老，但于夫人在遗嘱视频中明确养老费用由阿越承担，以此作为将相应房产给阿越继承的条件，因而法院不采纳阿越的抗辩。阿芳自认对父母照顾较少，愿意少分，故具体分割比例由法院根据三子女对老人照顾情况酌情分配。考虑到三位继承人均同意上海市房屋采取产权归阿越所有，给付其他继承人折价款的方式，上海徐汇法院判决上海市房产归阿越所有，并各给付阿馨、阿芳房屋折价款34万元。另外，于夫人对北京四合院享有的12/90份额由阿越继承，即阿越享有上述房屋的18/90份额；阿越给付阿馨动产分割款14000元，给付阿芳动产分割款11000元。(本文来自澎湃新闻，更多原创资讯请下载“澎湃新闻”APP)	2020-05-12 21:59	澎湃新闻	pp	20200512224307
2020051222430713	丰巢为何会在此时推出超时收费：专家分析称有这三方面原因	近日，丰巢推出超时收费举措引发各地小区反弹。丰巢成立于2015年4月，最初由顺丰速运、申通快递、中通快递、韵达货运等共同投资创建，布局快递业终端智能货柜。后“通达系”快递公司逐步退出。天眼查信息显示，目前丰巢注册资本11.7亿，法定代表人为顺丰集团运营高管徐育斌，并担任董事长、总经理职务。丰巢宣布于2020年4月30日上线会员服务，会员权益包括三大部分：1，消费者滞留件享受超长时间保管快件；2，消费者使用丰巢寄件享受额外折扣优惠；3，品牌联合权益，如视频网站、生活服务网站会员超低购买折扣。其中，针对消费者在滞留快件方面，非会员用户将享受12小时的免费保管，超时后收费0.5元/12小时，3元封顶；法定节假日不计费。而会员用户将以5元/月的价格享受滞留包裹保管7天，并获得5元的丰巢寄件优惠券以及视频网站7折购买折扣券。以上服务全国通用，不限柜机。丰巢方面称，以上会员服务消费者可在线上进行选择，未经消费者同意的情况下，将不产生任何费用。针对多次滞留包裹在柜占用资源的用户，丰巢将在两次免费取件过程中询问消费者是否要选择延期保管服务，如仍不同意使用的用户可选择不再允许其快件投递入柜。那么，为何丰巢会选择在这时候推出超时收费？推出超时收费能为丰巢自身带来什么？这是否是其将独立上市的信号？对此，澎湃新闻（www.thepaper.cn）记者采访了多位业内专家对上述问题进行了剖析。为何会在此时推出超时收费此前丰巢方面给出的官方回应是，很多社区因场地问题已经不能再增加柜机投放数量了，又为了更好服务用户，必须不断提高快件领取速度。截至目前，丰巢全国累计铺设超过18万个智能柜，哪怕周转率提升仅仅1%，也会带来极大的资源使用率提升。对于为何丰巢会在此时推出超时收费举措，中国政法大学传播法研究中心副主任朱巍认为有三方面原因：一是大的背景。如今已处于抗疫尾期，在抗疫期间，全国小区大部分为封锁状态，快递员无法直接送上门，很多是放到小区外面，或者是放到丰巢里。所以用户习惯在这几个月内逐渐被养成，形成了用户粘度。对于这点，快递物流专家赵小敏也认为，疫情把快递柜的需求瞬间释放了，使得快递柜的周转量、投放量短时间内有非常大的增长。对于快递柜公司来讲，它的运行成本确实是在急剧增加。从商业角度来说，这时候在价格上有所变动是没什么问题的。二是丰巢自身运营需要。丰巢从建设伊始至今，在公众日常生活中已经存在了很长时间。最开始涵盖建设、推广普及的费用在内，成本花费不少。起初处于构建生态和打开市场的角度，一般都采用免费的做法，这也导致一直处于砸钱养市场的状态。“以前丰巢不要钱，但不要钱不是常态。有一句话叫免费的其实是最贵的，因为这块不要钱，别的地方的花费会增加。”三是与互联网生态有关。丰巢表面上是快递的一种接收方式，但是应该纳入到整个互联网体系之中，未来可能会扮演别的角色。在没有想好角色之前，收费可能是一个暂行的过渡方法。“我觉得未来的发展方向，收不收费都不一定，但是目前在生态经济发展的现阶段，直接的收费可能也是丰巢生态没有构建完毕的一个表现。”具体而言，朱巍解释称，丰巢毕竟还是电子商务、物流的一个延伸，如果自己去经营的话，肯定要弥补成本。但如果纳入到整个的互联网生态体系和平台经济里，可能这部分成本会在别的地方找回来，比如数据流通、精准广告等，所以现在来看，可能在体系的融合还不够深。中国物流学会特约研究员杨达卿则认为，丰巢推出超时收费举措，一方面可能是由于亏损的持续扩大，迫于压力。另一方面，可能正好赶上收购了中邮速递易，在一定程度上来说，自身议价能力得到提高，在这种情况下，可能会希望通过价格的调整去改变自己在市场的被动发展。 不过，杨达卿也提到，短期内国家政策实际上也还没有落实到位。今年4月17日，国家邮政局办公室与商务部办公厅联合下发了关于深入推进电子商务与快递物流协同发展工作的通知，进一步落实《国务院办公厅关于推进电子商务与快递物流协同发展的意见》要求。其中提出，各地要明确智能快件箱、快递末端综合服务场所的公共属性，将智能快件箱、快递末端综合服务场所纳入公共服务设施相关规划，提供用地保障、财政补贴等配套措施。杨达卿说，政策什么时候能落地？能不能赶在这些企业能够很好地活下去之前落地？都还有待于观察。“作为企业来说，它有这种生存的压力，有紧迫感。”推出超时收费对丰巢自身好处何在在杨达卿看来，一是平衡了一些流转空白。就快递柜市场而言，有的地方可能做的好，有的未必好，比如在高端商务区可能快件都不够装，而在差一点的小区，可能空档还比较多，所以丰巢可以通过这种方式，相对去做一个平衡。 二是从市场参与角度来看，2019年快件的入柜率仅为10%，而且主要集中在一线城市。因此快递柜的占有率相对较小，而整个市场的发展空间还是很大的。所以需要去培育一个市场，让运营主体多去参与。那么，会否可能导致有更多的商品只能送货上门，反而降低了快递柜的使用频次？对此，杨达卿认为，这是一个磨合的过程。目前的情况是，一方面，一线的快递员收益越来越低，导致流失率非常高，头部企业的流失率可能在百分之六七十以上。 难以在短期内保持服务的稳定，因此还是需要通过设备来解决。另一方面，从消费者角度来说，并不是消费者都拒绝使用快递柜，比如也有消费者认为快递柜是相对安全选项，能在规定时间内取出件，快递柜可以避免临时破损甚至被误拿。“所以相对来说，快递柜还是一个比较优质的选项，能够解决最后一公里安全、个性化的选择。我觉得最终企业会磨合，即使让快递员不去做，但是到了一定程度快递员不能承受，或者说为了保证服务，还可能去选择。最终它一定会通过磨合，形成一种相对的满足各方诉求的路线。”杨达卿说。赵小敏则认为，目前丰巢有争议，某种程度上也是一个好事，因为大家认识到快递柜原来这么重要。赵小敏坦言，目前全国各地加起来的快递柜，还比不上北京一个市的覆盖区域，所以它的规模是非常小的，即使丰巢占据70%的市场份额，但因规模还小也谈不上垄断。“疫情暴发以后，大家都认识到，这个产品给自己带来的好处。所以我认为对丰巢来讲，要善于利用这个机会，加速提升它的市场规模。另外也会促使其他一些相关的产业资本加速进入这个领域，这对于整个行业的发展也是有促进作用的。”“我认为需要各方应该有一个理性探讨的余地，监管机构也可以更好地发挥监督作用，或者是号召各方共同把蛋糕做大。如果只是互相指责对方，最终受伤害的其实还是用户、快递员和快递公司，用户的收取件效率以及品质会受到影响，快递员和快递公司的收入也因此会受到影响。”赵小敏说。是不是要独立上市的信号问及丰巢选择在此时推出超时收费，是不是未来要独立上市的信号？截至发稿时，丰巢对该问题未予置评。朱巍认为，这个问题应该到互联网生态中去找答案。如果没有成功的成型的商业模式，一直免费是很难做到的。“市场一直是公平加效率，不可能有完全免费的模式。即便完全免费，也应当有免费加增值服务的模式。就像丰巢现在推行12小时内免费，超出12小时就是增值服务。”那么丰巢采用这种模式，是不是为了上市而做更好看的数据？朱巍没有给出肯定的答复，但表示，从一个产业的长期发展来看，必须要有可行的商业模式，如果没有可行商业模式，产业是长不了的。杨达卿则认为，这要看企业自身的定位。从收费来说，在过去企业不敢涨，不敢对消费者去收费，就是担心客户流失，但是达到一定的临界点之后，企业还是会考虑通过一些收费来改变自身财务状况。 因此，杨达卿认为，丰巢也会有上市的可能。“去年丰巢的柜身广告和屏幕广告已经占了10%的收益，如果通过上市之后解决资金的瓶颈，还可以扩大市场占有率和设备升级，可以更好地提高消费体验，那是可以解决自己运营上的困难。”那么，快递行业是否会迎来洗牌？杨达卿认为不会。“如果说中国每个消费者不是3500万人一组快递柜，而是300人一组，这时候它占有率70%，那有可能。但是目前丰巢的市场占有率只是暂时规模领先、相对领先，而不是整体市场占有率的一个绝对领先。在这种情况下，它不足以影响，反而有可能产生一些客户的流失。”杨达卿认为，如今行业的从业者确实需要审慎去看待面向C端的收费可行性、阶段的选择以及个性化服务，还是需要去反复地在市场去测试，有没有达到一个程度可以让消费者去接受，同时还能把这些服务能够保持延续下去。赵小敏对丰巢未来独立上市抱有乐观态度，但认为现在还言之尚早。他认为，从中长期来讲，丰巢肯定是要上市的，“这个是没有悬念的事情。”但是短时间内不存在，原因是其现有规模支撑不了整个资本市场，上升空间还很大。谈及目前有讨论快递公司自建快递柜的话题，赵小敏表示，这需要考虑基本商业常识，“快递公司自建建在哪？成本怎么覆盖？而且很多是上市公司，投资者是否买单？上市公司需要讲求投资回报，但快递柜的成本中长期都难以收回。”(本文来自澎湃新闻，更多原创资讯请下载“澎湃新闻”APP)	2020-05-12 21:58	澎湃新闻	pp	20200512224307
2020051222430714	武钢厂房火灾？官方：设备跳电启动人工放散	5月12日，湖北武汉。有市民称武钢发生火灾。武钢焦化公司发布通报称，回收鼓风机跳电，紧急启动人工放散，可见火光及烟尘逸出，未造成其他影响，现场安全受控。 ​	2020-05-12 21:57	澎湃新闻	pp	20200512224307
